 argument  1 = /var/lib/gitlab-runner/builds/PH7zszVW/0/edoapra/nwchem/QA/tests/tce_eomsd_eomsol1/tce_eomsd_eomsol1.nw
 


============================== echo of input deck ==============================
title "tce_eomccsd_eomsol1"
echo
start tce_eomccsd_eomsol1

memory stack 800 mb heap 100 mb global 1000 mb

geometry units angstrom
N            .034130    -.986909     .000000
N          -1.173397     .981920     .000000
C          -1.218805    -.408164     .000000
C           -.007302    1.702153     .000000
C           1.196200    1.107045     .000000
C           1.289085    -.345905     .000000
O           2.310232    -.996874     .000000
O          -2.257041   -1.026495     .000000
H            .049329   -1.997961     .000000
H          -2.070598    1.437050     .000000
H           -.125651    2.776484     .000000
H           2.111671    1.674079     .000000
end

basis
* library 6-31G
end

scf
thresh 1.0e-10
tol2e 1.0e-10
singlet
rhf
end

tce
freeze atomic
creomsd(t)
eomsol 1
diis 5
tilesize 15
thresh 1.0d-5
2eorb
2emet 13
nroots 1
end

task tce energy


================================================================================


                                         
                                         
 
 
              Northwest Computational Chemistry Package (NWChem) 6.8
              ------------------------------------------------------
 
 
                    Environmental Molecular Sciences Laboratory
                       Pacific Northwest National Laboratory
                                Richland, WA 99352
 
                              Copyright (c) 1994-2018
                       Pacific Northwest National Laboratory
                            Battelle Memorial Institute
 
             NWChem is an open-source computational chemistry package
                        distributed under the terms of the
                      Educational Community License (ECL) 2.0
             A copy of the license is included with this distribution
                              in the LICENSE.TXT file
 
                                  ACKNOWLEDGMENT
                                  --------------

            This software and its documentation were developed at the
            EMSL at Pacific Northwest National Laboratory, a multiprogram
            national laboratory, operated for the U.S. Department of Energy
            by Battelle under Contract Number DE-AC05-76RL01830. Support
            for this work was provided by the Department of Energy Office
            of Biological and Environmental Research, Office of Basic
            Energy Sciences, and the Office of Advanced Scientific Computing.


           Job information
           ---------------

    hostname        = durian
    program         = /var/lib/gitlab-runner/builds/PH7zszVW/0/edoapra/nwchem/bin/LINUX64/nwchem
    date            = Thu Sep 26 23:37:52 2019

    compiled        = Thu_Sep_26_22:43:35_2019
    source          = /var/lib/gitlab-runner/builds/PH7zszVW/0/edoapra/nwchem
    nwchem branch   = Development
    nwchem revision = cd4eb9a3
    ga revision     = 5.7.0
    use scalapack   = T
    input           = /var/lib/gitlab-runner/builds/PH7zszVW/0/edoapra/nwchem/QA/tests/tce_eomsd_eomsol1/tce_eomsd_eomsol1.nw
    prefix          = tce_eomccsd_eomsol1.
    data base       = ./tce_eomccsd_eomsol1.db
    status          = startup
    nproc           =        3
    time left       =     -1s



           Memory information
           ------------------

    heap     =   13107196 doubles =    100.0 Mbytes
    stack    =  104857601 doubles =    800.0 Mbytes
    global   =  131072000 doubles =   1000.0 Mbytes (distinct from heap & stack)
    total    =  249036797 doubles =   1900.0 Mbytes
    verify   = yes
    hardfail = no 


           Directory information
           ---------------------
 
  0 permanent = .
  0 scratch   = .
 
 
 
 
                                NWChem Input Module
                                -------------------
 
 
                                tce_eomccsd_eomsol1
                                -------------------

 Scaling coordinates for geometry "geometry" by  1.889725989
 (inverse scale =  0.529177249)

 CS  symmetry detected

          ------
          auto-z
          ------
  no constraints, skipping   0.000000000000000E+000
  no constraints, skipping   0.000000000000000E+000
 
 
                             Geometry "geometry" -> ""
                             -------------------------
 
 Output coordinates in angstroms (scale by  1.889725989 to convert to a.u.)
 
  No.       Tag          Charge          X              Y              Z
 ---- ---------------- ---------- -------------- -------------- --------------
    1 N                    7.0000    -0.98690909    -0.03391701     0.00000000
    2 N                    7.0000     0.98280277     1.17216932     0.00000000
    3 C                    6.0000    -0.40724764     1.21859426     0.00000000
    4 C                    6.0000     1.70218250     0.00554773     0.00000000
    5 C                    6.0000     1.10619421    -1.19751858     0.00000000
    6 C                    6.0000    -0.34682336    -1.28934062     0.00000000
    7 O                    8.0000    -0.99853922    -2.31001111     0.00000000
    8 O                    8.0000    -1.02481893     2.25728233     0.00000000
    9 H                    1.0000    -1.99797194    -0.04837635     0.00000000
   10 H                    1.0000     1.43858902     2.06903712     0.00000000
   11 H                    1.0000     2.77659979     0.12311075     0.00000000
   12 H                    1.0000     1.67255832    -2.11340416     0.00000000
 
      Atomic Mass 
      ----------- 
 
      N                 14.003070
      C                 12.000000
      O                 15.994910
      H                  1.007825
 

 Effective nuclear repulsion energy (a.u.)     357.1599590286

            Nuclear Dipole moment (a.u.) 
            ----------------------------
        X                 Y               Z
 ---------------- ---------------- ----------------
    -0.0000000000     0.0000000000     0.0000000000
 
      Symmetry information
      --------------------
 
 Group name             Cs        
 Group number              2
 Group order               2
 No. of unique centers    12
 
      Symmetry unique atoms
 
     1    2    3    4    5    6    7    8    9   10   11   12
 


                                Z-matrix (autoz)
                                -------- 

 Units are Angstrom for bonds and degrees for angles
 
      Type          Name      I     J     K     L     M      Value
      ----------- --------  ----- ----- ----- ----- ----- ----------
    1 Stretch                  1     3                       1.38014
    2 Stretch                  1     6                       1.40918
    3 Stretch                  1     9                       1.01117
    4 Stretch                  2     3                       1.39083
    5 Stretch                  2     4                       1.37059
    6 Stretch                  2    10                       1.00604
    7 Stretch                  3     8                       1.20842
    8 Stretch                  4     5                       1.34260
    9 Stretch                  4    11                       1.08083
   10 Stretch                  5     6                       1.45592
   11 Stretch                  5    12                       1.07685
   12 Stretch                  6     7                       1.21099
   13 Bend                     1     3     2               112.92182
   14 Bend                     1     3     8               124.43094
   15 Bend                     1     6     5               113.39911
   16 Bend                     1     6     7               120.42601
   17 Bend                     2     3     8               122.64724
   18 Bend                     2     4     5               121.98716
   19 Bend                     2     4    11               115.41496
   20 Bend                     3     1     6               128.15028
   21 Bend                     3     1     9               115.65401
   22 Bend                     3     2     4               123.57229
   23 Bend                     3     2    10               115.02672
   24 Bend                     4     2    10               121.40099
   25 Bend                     4     5     6               119.96935
   26 Bend                     4     5    12               121.91483
   27 Bend                     5     4    11               122.59788
   28 Bend                     5     6     7               126.17488
   29 Bend                     6     1     9               116.19571
   30 Bend                     6     5    12               118.11582
   31 Torsion                  1     3     2     4           0.00000
   32 Torsion                  1     3     2    10         180.00000
   33 Torsion                  1     6     5     4           0.00000
   34 Torsion                  1     6     5    12         180.00000
   35 Torsion                  2     3     1     6           0.00000
   36 Torsion                  2     3     1     9         180.00000
   37 Torsion                  2     4     5     6           0.00000
   38 Torsion                  2     4     5    12         180.00000
   39 Torsion                  3     1     6     5           0.00000
   40 Torsion                  3     1     6     7         180.00000
   41 Torsion                  3     2     4     5           0.00000
   42 Torsion                  3     2     4    11         180.00000
   43 Torsion                  4     2     3     8         180.00000
   44 Torsion                  4     5     6     7         180.00000
   45 Torsion                  5     4     2    10         180.00000
   46 Torsion                  5     6     1     9         180.00000
   47 Torsion                  6     1     3     8         180.00000
   48 Torsion                  6     5     4    11         180.00000
   49 Torsion                  7     6     1     9           0.00000
   50 Torsion                  7     6     5    12           0.00000
   51 Torsion                  8     3     1     9           0.00000
   52 Torsion                  8     3     2    10           0.00000
   53 Torsion                 10     2     4    11           0.00000
   54 Torsion                 11     4     5    12           0.00000
 
 
            XYZ format geometry
            -------------------
    12
 geometry
 N                    -0.98690909    -0.03391701     0.00000000
 N                     0.98280277     1.17216932     0.00000000
 C                    -0.40724764     1.21859426     0.00000000
 C                     1.70218250     0.00554773     0.00000000
 C                     1.10619421    -1.19751858     0.00000000
 C                    -0.34682336    -1.28934062     0.00000000
 O                    -0.99853922    -2.31001111     0.00000000
 O                    -1.02481893     2.25728233     0.00000000
 H                    -1.99797194    -0.04837635     0.00000000
 H                     1.43858902     2.06903712     0.00000000
 H                     2.77659979     0.12311075     0.00000000
 H                     1.67255832    -2.11340416     0.00000000
 
 ==============================================================================
                                internuclear distances
 ------------------------------------------------------------------------------
       center one      |      center two      | atomic units |  angstroms
 ------------------------------------------------------------------------------
    3 C                |   1 N                |     2.60809  |     1.38014
    3 C                |   2 N                |     2.62828  |     1.39083
    4 C                |   2 N                |     2.59004  |     1.37059
    5 C                |   4 C                |     2.53714  |     1.34260
    6 C                |   1 N                |     2.66297  |     1.40918
    6 C                |   5 C                |     2.75128  |     1.45592
    7 O                |   6 C                |     2.28844  |     1.21099
    8 O                |   3 C                |     2.28357  |     1.20842
    9 H                |   1 N                |     1.91083  |     1.01117
   10 H                |   2 N                |     1.90114  |     1.00604
   11 H                |   4 C                |     2.04247  |     1.08083
   12 H                |   5 C                |     2.03496  |     1.07685
 ------------------------------------------------------------------------------
                         number of included internuclear distances:         12
 ==============================================================================



 ==============================================================================
                                 internuclear angles
 ------------------------------------------------------------------------------
        center 1       |       center 2       |       center 3       |  degrees
 ------------------------------------------------------------------------------
    3 C                |   1 N                |   6 C                |   128.15
    3 C                |   1 N                |   9 H                |   115.65
    6 C                |   1 N                |   9 H                |   116.20
    3 C                |   2 N                |   4 C                |   123.57
    3 C                |   2 N                |  10 H                |   115.03
    4 C                |   2 N                |  10 H                |   121.40
    1 N                |   3 C                |   2 N                |   112.92
    1 N                |   3 C                |   8 O                |   124.43
    2 N                |   3 C                |   8 O                |   122.65
    2 N                |   4 C                |   5 C                |   121.99
    2 N                |   4 C                |  11 H                |   115.41
    5 C                |   4 C                |  11 H                |   122.60
    4 C                |   5 C                |   6 C                |   119.97
    4 C                |   5 C                |  12 H                |   121.91
    6 C                |   5 C                |  12 H                |   118.12
    1 N                |   6 C                |   5 C                |   113.40
    1 N                |   6 C                |   7 O                |   120.43
    5 C                |   6 C                |   7 O                |   126.17
 ------------------------------------------------------------------------------
                            number of included internuclear angles:         18
 ==============================================================================





 Summary of "ao basis" -> "" (cartesian)
 ------------------------------------------------------------------------------
       Tag                 Description            Shells   Functions and Types
 ---------------- ------------------------------  ------  ---------------------
 *                           6-31G                    on all atoms 


                      Basis "ao basis" -> "ao basis" (cartesian)
                      -----
  N (Nitrogen)
  ------------
            Exponent  Coefficients 
       -------------- ---------------------------------------------------------
  1 S  4.17351100E+03  0.001835
  1 S  6.27457900E+02  0.013995
  1 S  1.42902100E+02  0.068587
  1 S  4.02343300E+01  0.232241
  1 S  1.28202100E+01  0.469070
  1 S  4.39043700E+00  0.360455
 
  2 S  1.16263580E+01 -0.114961
  2 S  2.71628000E+00 -0.169118
  2 S  7.72218000E-01  1.145852
 
  3 P  1.16263580E+01  0.067580
  3 P  2.71628000E+00  0.323907
  3 P  7.72218000E-01  0.740895
 
  4 S  2.12031300E-01  1.000000
 
  5 P  2.12031300E-01  1.000000
 
  C (Carbon)
  ----------
            Exponent  Coefficients 
       -------------- ---------------------------------------------------------
  1 S  3.04752490E+03  0.001835
  1 S  4.57369510E+02  0.014037
  1 S  1.03948690E+02  0.068843
  1 S  2.92101550E+01  0.232184
  1 S  9.28666300E+00  0.467941
  1 S  3.16392700E+00  0.362312
 
  2 S  7.86827240E+00 -0.119332
  2 S  1.88128850E+00 -0.160854
  2 S  5.44249300E-01  1.143456
 
  3 P  7.86827240E+00  0.068999
  3 P  1.88128850E+00  0.316424
  3 P  5.44249300E-01  0.744308
 
  4 S  1.68714400E-01  1.000000
 
  5 P  1.68714400E-01  1.000000
 
  O (Oxygen)
  ----------
            Exponent  Coefficients 
       -------------- ---------------------------------------------------------
  1 S  5.48467170E+03  0.001831
  1 S  8.25234950E+02  0.013950
  1 S  1.88046960E+02  0.068445
  1 S  5.29645000E+01  0.232714
  1 S  1.68975700E+01  0.470193
  1 S  5.79963530E+00  0.358521
 
  2 S  1.55396160E+01 -0.110778
  2 S  3.59993360E+00 -0.148026
  2 S  1.01376180E+00  1.130767
 
  3 P  1.55396160E+01  0.070874
  3 P  3.59993360E+00  0.339753
  3 P  1.01376180E+00  0.727159
 
  4 S  2.70005800E-01  1.000000
 
  5 P  2.70005800E-01  1.000000
 
  H (Hydrogen)
  ------------
            Exponent  Coefficients 
       -------------- ---------------------------------------------------------
  1 S  1.87311370E+01  0.033495
  1 S  2.82539370E+00  0.234727
  1 S  6.40121700E-01  0.813757
 
  2 S  1.61277800E-01  1.000000
 


 Summary of "ao basis" -> "ao basis" (cartesian)
 ------------------------------------------------------------------------------
       Tag                 Description            Shells   Functions and Types
 ---------------- ------------------------------  ------  ---------------------
 N                           6-31G                   5        9   3s2p
 C                           6-31G                   5        9   3s2p
 O                           6-31G                   5        9   3s2p
 H                           6-31G                   2        2   2s


                                 NWChem SCF Module
                                 -----------------
 
 
                                tce_eomccsd_eomsol1
 
 

  ao basis        = "ao basis"
  functions       =    80
  atoms           =    12
  closed shells   =    29
  open shells     =     0
  charge          =   0.00
  wavefunction    = RHF 
  input vectors   = atomic
  output vectors  = ./tce_eomccsd_eomsol1.movecs
  use symmetry    = T
  symmetry adapt  = T


 Summary of "ao basis" -> "ao basis" (cartesian)
 ------------------------------------------------------------------------------
       Tag                 Description            Shells   Functions and Types
 ---------------- ------------------------------  ------  ---------------------
 N                           6-31G                   5        9   3s2p
 C                           6-31G                   5        9   3s2p
 O                           6-31G                   5        9   3s2p
 H                           6-31G                   2        2   2s


      Symmetry analysis of basis
      --------------------------
 
        a'         64
        a"         16
 

 Forming initial guess at       0.1s

 
      Superposition of Atomic Density Guess
      -------------------------------------
 
 Sum of atomic energies:        -410.73012770
 
      Non-variational initial energy
      ------------------------------

 Total energy =    -415.530979
 1-e energy   =   -1267.925589
 2-e energy   =     495.234651
 HOMO         =      -0.259864
 LUMO         =       0.009758
 
 
      Symmetry analysis of molecular orbitals - initial
      -------------------------------------------------
 
  Numbering of irreducible representations: 
 
     1 a'          2 a"      
 
  Orbital symmetries:
 
     1 a'          2 a'          3 a'          4 a'          5 a'      
     6 a'          7 a'          8 a'          9 a'         10 a'      
    11 a'         12 a'         13 a'         14 a'         15 a'      
    16 a'         17 a'         18 a'         19 a"         20 a'      
    21 a'         22 a"         23 a'         24 a'         25 a"      
    26 a'         27 a'         28 a"         29 a"         30 a"      
    31 a"         32 a'         33 a'         34 a'         35 a"      
    36 a'         37 a'         38 a'         39 a'      
 

 Starting SCF solution at       0.3s



 ----------------------------------------------
         Quadratically convergent ROHF

 Convergence threshold     :          1.000E-10
 Maximum no. of iterations :           30
 Final Fock-matrix accuracy:          1.000E-10
 ----------------------------------------------


              iter       energy          gnorm     gmax       time
             ----- ------------------- --------- --------- --------
                 1     -412.0371879801  1.90D+00  4.66D-01      0.8
                 2     -412.2491522590  5.41D-01  8.39D-02      1.8
                 3     -412.2785048547  2.25D-02  5.11D-03      3.3
                 4     -412.2786222496  4.56D-04  8.14D-05      5.2
                 5     -412.2786222806  1.10D-07  1.68D-08      8.8
  ga_iter_lsolve: convergence stagnant ... aborting solve
                 6     -412.2786222806  5.19D-11  1.10D-11     12.2


       Final RHF  results 
       ------------------ 

         Total SCF energy =   -412.278622280576
      One-electron energy =  -1269.561794690306
      Two-electron energy =    500.123213381086
 Nuclear repulsion energy =    357.159959028643

        Time for solution =     11.9s


 
       Symmetry analysis of molecular orbitals - final
       -----------------------------------------------
 
  Numbering of irreducible representations: 
 
     1 a'          2 a"      
 
  Orbital symmetries:
 
     1 a'          2 a'          3 a'          4 a'          5 a'      
     6 a'          7 a'          8 a'          9 a'         10 a'      
    11 a'         12 a'         13 a'         14 a'         15 a'      
    16 a'         17 a'         18 a'         19 a"         20 a'      
    21 a'         22 a'         23 a'         24 a"         25 a"      
    26 a'         27 a'         28 a"         29 a"         30 a"      
    31 a"         32 a'         33 a'         34 a'         35 a'      
    36 a"         37 a'         38 a'         39 a'      
 
             Final eigenvalues
             -----------------

              1      
    1  -20.5631
    2  -20.5581
    3  -15.6517
    4  -15.6352
    5  -11.4442
    6  -11.4020
    7  -11.3522
    8  -11.2663
    9   -1.4631
   10   -1.4287
   11   -1.3262
   12   -1.2537
   13   -1.0992
   14   -0.9407
   15   -0.9087
   16   -0.8122
   17   -0.7760
   18   -0.7192
   19   -0.6770
   20   -0.6759
   21   -0.6520
   22   -0.6152
   23   -0.6042
   24   -0.5775
   25   -0.5293
   26   -0.4812
   27   -0.4468
   28   -0.4315
   29   -0.3668
   30    0.0932
   31    0.1645
   32    0.1888
   33    0.2451
   34    0.2531
   35    0.2960
   36    0.3040
   37    0.3631
   38    0.3894
   39    0.4181
 
                       ROHF Final Molecular Orbital Analysis
                       -------------------------------------
 
 Vector    9  Occ=2.000000D+00  E=-1.463088D+00  Symmetry=a'
              MO Center= -6.2D-01,  1.3D+00,  2.3D-17, r^2= 2.0D+00
   Bfn.  Coefficient  Atom+Function         Bfn.  Coefficient  Atom+Function  
  ----- ------------  ---------------      ----- ------------  ---------------
    69      0.335581   8 O  s                65      0.329811   8 O  s         
    20      0.275392   3 C  s                 6      0.162573   1 N  s         
    15      0.163078   2 N  s                64     -0.152022   8 O  s         
 
 Vector   10  Occ=2.000000D+00  E=-1.428660D+00  Symmetry=a'
              MO Center= -7.9D-01, -1.4D+00, -2.3D-17, r^2= 2.2D+00
   Bfn.  Coefficient  Atom+Function         Bfn.  Coefficient  Atom+Function  
  ----- ------------  ---------------      ----- ------------  ---------------
    60      0.411999   7 O  s                56      0.375587   7 O  s         
    47      0.241387   6 C  s                55     -0.174208   7 O  s         
    69     -0.169505   8 O  s         
 
 Vector   11  Occ=2.000000D+00  E=-1.326222D+00  Symmetry=a'
              MO Center=  3.5D-01,  8.3D-01, -3.9D-17, r^2= 2.4D+00
   Bfn.  Coefficient  Atom+Function         Bfn.  Coefficient  Atom+Function  
  ----- ------------  ---------------      ----- ------------  ---------------
    15      0.384693   2 N  s                11      0.293704   2 N  s         
    69     -0.246812   8 O  s                65     -0.215044   8 O  s         
     6      0.188954   1 N  s                29      0.169045   4 C  s         
 
 Vector   12  Occ=2.000000D+00  E=-1.253736D+00  Symmetry=a'
              MO Center= -3.9D-01,  1.5D-01, -1.6D-17, r^2= 2.3D+00
   Bfn.  Coefficient  Atom+Function         Bfn.  Coefficient  Atom+Function  
  ----- ------------  ---------------      ----- ------------  ---------------
     6      0.444027   1 N  s                 2      0.342401   1 N  s         
    15     -0.249300   2 N  s                11     -0.204865   2 N  s         
     1     -0.167554   1 N  s                60     -0.162985   7 O  s         
    49      0.151819   6 C  py        
 
 Vector   13  Occ=2.000000D+00  E=-1.099183D+00  Symmetry=a'
              MO Center=  9.6D-01, -4.0D-01,  1.0D-17, r^2= 2.2D+00
   Bfn.  Coefficient  Atom+Function         Bfn.  Coefficient  Atom+Function  
  ----- ------------  ---------------      ----- ------------  ---------------
    38      0.303278   5 C  s                29      0.234545   4 C  s         
    42      0.193022   5 C  s                15     -0.183322   2 N  s         
    33      0.164074   4 C  s                37     -0.153217   5 C  s         
 
 Vector   14  Occ=2.000000D+00  E=-9.407187D-01  Symmetry=a'
              MO Center=  5.9D-01,  1.1D-01,  4.2D-17, r^2= 3.1D+00
   Bfn.  Coefficient  Atom+Function         Bfn.  Coefficient  Atom+Function  
  ----- ------------  ---------------      ----- ------------  ---------------
    12      0.248536   2 N  px               29      0.220531   4 C  s         
    21     -0.177288   3 C  px               48     -0.158723   6 C  px        
     3     -0.153608   1 N  px        
 
 Vector   15  Occ=2.000000D+00  E=-9.087184D-01  Symmetry=a'
              MO Center= -2.1D-01,  9.6D-02,  1.2D-16, r^2= 2.9D+00
   Bfn.  Coefficient  Atom+Function         Bfn.  Coefficient  Atom+Function  
  ----- ------------  ---------------      ----- ------------  ---------------
     4      0.325266   1 N  py               20      0.213699   3 C  s         
    47     -0.207310   6 C  s                 8      0.192222   1 N  py        
    22     -0.180268   3 C  py               60      0.162820   7 O  s         
    49     -0.159203   6 C  py        
 
 Vector   16  Occ=2.000000D+00  E=-8.122034D-01  Symmetry=a'
              MO Center=  5.4D-01,  1.9D-01, -2.4D-17, r^2= 3.7D+00
   Bfn.  Coefficient  Atom+Function         Bfn.  Coefficient  Atom+Function  
  ----- ------------  ---------------      ----- ------------  ---------------
    13      0.318941   2 N  py               17      0.218898   2 N  py        
     3     -0.217675   1 N  px               75      0.175077  10 H  s         
     7     -0.155712   1 N  px               38      0.154657   5 C  s         
 
 Vector   17  Occ=2.000000D+00  E=-7.759884D-01  Symmetry=a'
              MO Center=  3.3D-01, -8.2D-02, -4.8D-17, r^2= 3.3D+00
   Bfn.  Coefficient  Atom+Function         Bfn.  Coefficient  Atom+Function  
  ----- ------------  ---------------      ----- ------------  ---------------
    12      0.257116   2 N  px               31      0.235048   4 C  py        
    21     -0.229264   3 C  px               48      0.230058   6 C  px        
    39     -0.208075   5 C  px                4      0.201157   1 N  py        
    16      0.159080   2 N  px        
 
 Vector   18  Occ=2.000000D+00  E=-7.191759D-01  Symmetry=a'
              MO Center=  6.0D-01,  1.7D-01,  9.7D-17, r^2= 3.9D+00
   Bfn.  Coefficient  Atom+Function         Bfn.  Coefficient  Atom+Function  
  ----- ------------  ---------------      ----- ------------  ---------------
    30      0.329027   4 C  px                3      0.316418   1 N  px        
     7      0.212834   1 N  px               77      0.213374  11 H  s         
    73     -0.186448   9 H  s                13      0.181370   2 N  py        
 
 Vector   19  Occ=2.000000D+00  E=-6.769970D-01  Symmetry=a"
              MO Center= -1.6D-01,  6.1D-01, -6.8D-17, r^2= 2.8D+00
   Bfn.  Coefficient  Atom+Function         Bfn.  Coefficient  Atom+Function  
  ----- ------------  ---------------      ----- ------------  ---------------
    23      0.283403   3 C  pz               14      0.271899   2 N  pz        
     5      0.268864   1 N  pz               68      0.210588   8 O  pz        
    18      0.187041   2 N  pz                9      0.182668   1 N  pz        
    50      0.154372   6 C  pz        
 
 Vector   20  Occ=2.000000D+00  E=-6.759061D-01  Symmetry=a'
              MO Center= -2.7D-01, -3.5D-01,  3.6D-17, r^2= 5.6D+00
   Bfn.  Coefficient  Atom+Function         Bfn.  Coefficient  Atom+Function  
  ----- ------------  ---------------      ----- ------------  ---------------
    60      0.261423   7 O  s                58     -0.227291   7 O  py        
    57     -0.208206   7 O  px               49      0.203950   6 C  py        
    13      0.172868   2 N  py                3      0.170536   1 N  px        
    69      0.168876   8 O  s                 7      0.162463   1 N  px        
    56      0.162581   7 O  s                22     -0.158162   3 C  py        
 
 Vector   21  Occ=2.000000D+00  E=-6.519601D-01  Symmetry=a'
              MO Center= -1.3D-01,  1.0D+00, -3.5D-16, r^2= 5.0D+00
   Bfn.  Coefficient  Atom+Function         Bfn.  Coefficient  Atom+Function  
  ----- ------------  ---------------      ----- ------------  ---------------
    67      0.357372   8 O  py               69      0.282442   8 O  s         
    22     -0.235137   3 C  py               40     -0.231818   5 C  py        
    21      0.207881   3 C  px               71      0.193679   8 O  py        
    65      0.171450   8 O  s                66     -0.163780   8 O  px        
 
 Vector   22  Occ=2.000000D+00  E=-6.151901D-01  Symmetry=a'
              MO Center= -2.1D-01, -1.1D+00,  9.4D-17, r^2= 4.6D+00
   Bfn.  Coefficient  Atom+Function         Bfn.  Coefficient  Atom+Function  
  ----- ------------  ---------------      ----- ------------  ---------------
    58      0.367945   7 O  py               48     -0.218008   6 C  px        
    49     -0.216009   6 C  py               62      0.209677   7 O  py        
    60     -0.208337   7 O  s                31     -0.195678   4 C  py        
    40      0.185835   5 C  py               66     -0.164815   8 O  px        
 
 Vector   23  Occ=2.000000D+00  E=-6.041835D-01  Symmetry=a'
              MO Center=  5.8D-01, -7.7D-01,  1.0D-16, r^2= 4.4D+00
   Bfn.  Coefficient  Atom+Function         Bfn.  Coefficient  Atom+Function  
  ----- ------------  ---------------      ----- ------------  ---------------
    40      0.231467   5 C  py               79     -0.227325  12 H  s         
    48      0.211463   6 C  px               39     -0.206884   5 C  px        
    67      0.194763   8 O  py               57      0.173438   7 O  px        
    44      0.158163   5 C  py        
 
 Vector   24  Occ=2.000000D+00  E=-5.774775D-01  Symmetry=a"
              MO Center= -4.6D-01, -7.3D-01,  2.0D-16, r^2= 3.7D+00
   Bfn.  Coefficient  Atom+Function         Bfn.  Coefficient  Atom+Function  
  ----- ------------  ---------------      ----- ------------  ---------------
    59      0.351308   7 O  pz               50      0.310241   6 C  pz        
    63      0.236066   7 O  pz               14     -0.221735   2 N  pz        
    68     -0.187606   8 O  pz               18     -0.173350   2 N  pz        
    54      0.172926   6 C  pz                5      0.161757   1 N  pz        
 
 Vector   25  Occ=2.000000D+00  E=-5.292884D-01  Symmetry=a"
              MO Center=  4.2D-01,  7.8D-01, -1.0D-16, r^2= 3.2D+00
   Bfn.  Coefficient  Atom+Function         Bfn.  Coefficient  Atom+Function  
  ----- ------------  ---------------      ----- ------------  ---------------
    14      0.327695   2 N  pz               68     -0.287369   8 O  pz        
    18      0.278263   2 N  pz               32      0.263896   4 C  pz        
    72     -0.206605   8 O  pz                5     -0.200027   1 N  pz        
    41      0.171514   5 C  pz               23     -0.166042   3 C  pz        
    36      0.159488   4 C  pz                9     -0.154554   1 N  pz        
 
 Vector   26  Occ=2.000000D+00  E=-4.812026D-01  Symmetry=a'
              MO Center= -6.8D-01,  1.2D+00, -2.0D-17, r^2= 4.0D+00
   Bfn.  Coefficient  Atom+Function         Bfn.  Coefficient  Atom+Function  
  ----- ------------  ---------------      ----- ------------  ---------------
    66      0.473424   8 O  px                6      0.416815   1 N  s         
    70      0.315129   8 O  px               15     -0.287802   2 N  s         
    16      0.253745   2 N  px               67      0.235573   8 O  py        
    25      0.232123   3 C  px               57      0.223394   7 O  px        
    12      0.185197   2 N  px               26      0.172902   3 C  py        
 
 Vector   27  Occ=2.000000D+00  E=-4.468320D-01  Symmetry=a'
              MO Center= -7.8D-01, -1.2D+00, -4.6D-20, r^2= 3.9D+00
   Bfn.  Coefficient  Atom+Function         Bfn.  Coefficient  Atom+Function  
  ----- ------------  ---------------      ----- ------------  ---------------
    57      0.444881   7 O  px                8     -0.324578   1 N  py        
    61      0.313377   7 O  px               42     -0.305373   5 C  s         
    58     -0.288914   7 O  py                4     -0.216334   1 N  py        
    43      0.213010   5 C  px               52      0.213586   6 C  px        
    66     -0.203152   8 O  px               62     -0.201002   7 O  py        
 
 Vector   28  Occ=2.000000D+00  E=-4.314588D-01  Symmetry=a"
              MO Center= -9.9D-01, -2.6D-02, -8.9D-17, r^2= 3.5D+00
   Bfn.  Coefficient  Atom+Function         Bfn.  Coefficient  Atom+Function  
  ----- ------------  ---------------      ----- ------------  ---------------
     5      0.430927   1 N  pz                9      0.426844   1 N  pz        
    68     -0.325162   8 O  pz               59     -0.318151   7 O  pz        
    72     -0.262139   8 O  pz               63     -0.251564   7 O  pz        
 
 Vector   29  Occ=2.000000D+00  E=-3.668177D-01  Symmetry=a"
              MO Center=  7.8D-01, -3.3D-01, -4.8D-16, r^2= 3.6D+00
   Bfn.  Coefficient  Atom+Function         Bfn.  Coefficient  Atom+Function  
  ----- ------------  ---------------      ----- ------------  ---------------
    41      0.364600   5 C  pz               18     -0.342210   2 N  pz        
    45      0.329833   5 C  pz               14     -0.314501   2 N  pz        
    32      0.225409   4 C  pz               59     -0.215753   7 O  pz        
    36      0.203106   4 C  pz               63     -0.183365   7 O  pz        
    68      0.182122   8 O  pz               72      0.153129   8 O  pz        
 
 Vector   30  Occ=0.000000D+00  E= 9.324948D-02  Symmetry=a"
              MO Center=  7.6D-01, -6.2D-01,  9.4D-17, r^2= 3.4D+00
   Bfn.  Coefficient  Atom+Function         Bfn.  Coefficient  Atom+Function  
  ----- ------------  ---------------      ----- ------------  ---------------
    36      0.643362   4 C  pz               45     -0.397337   5 C  pz        
    32      0.384050   4 C  pz               54     -0.318853   6 C  pz        
    63      0.289624   7 O  pz               18     -0.270444   2 N  pz        
    50     -0.266329   6 C  pz                9      0.242087   1 N  pz        
    59      0.228798   7 O  pz               41     -0.207204   5 C  pz        
 
 Vector   31  Occ=0.000000D+00  E= 1.645355D-01  Symmetry=a"
              MO Center= -3.6D-01,  5.2D-01, -1.2D-15, r^2= 3.6D+00
   Bfn.  Coefficient  Atom+Function         Bfn.  Coefficient  Atom+Function  
  ----- ------------  ---------------      ----- ------------  ---------------
    27      0.630381   3 C  pz               23      0.467127   3 C  pz        
    72     -0.422584   8 O  pz               54     -0.390130   6 C  pz        
    45      0.347349   5 C  pz               68     -0.298126   8 O  pz        
    50     -0.272470   6 C  pz               63      0.262660   7 O  pz        
    18     -0.258184   2 N  pz               59      0.185987   7 O  pz        
 
 Vector   32  Occ=0.000000D+00  E= 1.887850D-01  Symmetry=a'
              MO Center=  1.8D+00,  1.2D+00, -2.4D-16, r^2= 5.1D+00
   Bfn.  Coefficient  Atom+Function         Bfn.  Coefficient  Atom+Function  
  ----- ------------  ---------------      ----- ------------  ---------------
    76      1.376035  10 H  s                78      1.077465  11 H  s         
    33     -0.946493   4 C  s                15     -0.895864   2 N  s         
    80      0.557962  12 H  s                17     -0.532086   2 N  py        
    34     -0.467587   4 C  px               74      0.425238   9 H  s         
    44      0.352945   5 C  py               16     -0.277607   2 N  px        
 
 Vector   33  Occ=0.000000D+00  E= 2.450592D-01  Symmetry=a'
              MO Center= -1.3D+00, -1.2D-02,  1.9D-15, r^2= 6.0D+00
   Bfn.  Coefficient  Atom+Function         Bfn.  Coefficient  Atom+Function  
  ----- ------------  ---------------      ----- ------------  ---------------
    74      1.777236   9 H  s                78     -1.018157  11 H  s         
     7      0.933715   1 N  px                6     -0.926855   1 N  s         
    34      0.655650   4 C  px               33      0.367369   4 C  s         
    44      0.255349   5 C  py               42      0.234720   5 C  s         
    53     -0.226988   6 C  py                3      0.212611   1 N  px        
 
 Vector   34  Occ=0.000000D+00  E= 2.530534D-01  Symmetry=a'
              MO Center=  1.8D+00,  4.4D-01,  1.1D-15, r^2= 6.6D+00
   Bfn.  Coefficient  Atom+Function         Bfn.  Coefficient  Atom+Function  
  ----- ------------  ---------------      ----- ------------  ---------------
    78     -1.332788  11 H  s                76      1.268684  10 H  s         
    15     -1.105114   2 N  s                42      1.106362   5 C  s         
    33      1.073562   4 C  s                80     -0.982956  12 H  s         
    34      0.654690   4 C  px               74     -0.489431   9 H  s         
    44     -0.467217   5 C  py               17     -0.442381   2 N  py        
 
 Vector   35  Occ=0.000000D+00  E= 2.960251D-01  Symmetry=a'
              MO Center=  1.9D+00, -1.6D+00,  9.8D-16, r^2= 4.8D+00
   Bfn.  Coefficient  Atom+Function         Bfn.  Coefficient  Atom+Function  
  ----- ------------  ---------------      ----- ------------  ---------------
    80      2.246767  12 H  s                78     -1.353074  11 H  s         
    44      1.222477   5 C  py               43     -1.109461   5 C  px        
    34      1.028216   4 C  px               42     -0.938402   5 C  s         
    33      0.737549   4 C  s                 6      0.540164   1 N  s         
    74     -0.437815   9 H  s                51     -0.352947   6 C  s         
 
 Vector   36  Occ=0.000000D+00  E= 3.040471D-01  Symmetry=a"
              MO Center=  1.4D-01, -4.1D-01, -6.0D-15, r^2= 3.8D+00
   Bfn.  Coefficient  Atom+Function         Bfn.  Coefficient  Atom+Function  
  ----- ------------  ---------------      ----- ------------  ---------------
    54     -0.700217   6 C  pz               45      0.665371   5 C  pz        
    36     -0.557280   4 C  pz               27     -0.517815   3 C  pz        
     9      0.439858   1 N  pz               50     -0.386066   6 C  pz        
    18      0.372456   2 N  pz               63      0.345226   7 O  pz        
    23     -0.294671   3 C  pz               41      0.270302   5 C  pz        
 
 Vector   37  Occ=0.000000D+00  E= 3.630512D-01  Symmetry=a'
              MO Center=  1.2D+00,  3.0D-02,  1.0D-16, r^2= 3.9D+00
   Bfn.  Coefficient  Atom+Function         Bfn.  Coefficient  Atom+Function  
  ----- ------------  ---------------      ----- ------------  ---------------
    15      1.758012   2 N  s                51      1.698214   6 C  s         
    35     -1.391849   4 C  py               42     -1.358929   5 C  s         
    17     -1.287728   2 N  py               33     -1.076073   4 C  s         
    24     -1.031803   3 C  s                34      0.907358   4 C  px        
    76      0.883216  10 H  s                43      0.554315   5 C  px        
 
 Vector   38  Occ=0.000000D+00  E= 3.893612D-01  Symmetry=a'
              MO Center= -4.8D-01,  3.6D-01,  2.0D-15, r^2= 3.6D+00
   Bfn.  Coefficient  Atom+Function         Bfn.  Coefficient  Atom+Function  
  ----- ------------  ---------------      ----- ------------  ---------------
    24      2.745281   3 C  s                51      1.725720   6 C  s         
     6     -1.412596   1 N  s                69     -1.132814   8 O  s         
    33     -0.812323   4 C  s                 7     -0.643782   1 N  px        
    60     -0.601749   7 O  s                71      0.590499   8 O  py        
    43      0.570562   5 C  px               15     -0.548843   2 N  s         
 
 Vector   39  Occ=0.000000D+00  E= 4.180710D-01  Symmetry=a'
              MO Center= -1.4D-01, -1.2D+00, -3.6D-16, r^2= 4.5D+00
   Bfn.  Coefficient  Atom+Function         Bfn.  Coefficient  Atom+Function  
  ----- ------------  ---------------      ----- ------------  ---------------
    53      1.838679   6 C  py               60      1.800181   7 O  s         
    52      1.753597   6 C  px               43      1.701284   5 C  px        
    35      1.230557   4 C  py               26      0.745198   3 C  py        
    69     -0.624191   8 O  s                62      0.602345   7 O  py        
    16     -0.469585   2 N  px               51      0.439096   6 C  s         
 
 Vector   40  Occ=0.000000D+00  E= 4.379474D-01  Symmetry=a'
              MO Center=  3.2D-01,  6.6D-01,  1.8D-16, r^2= 4.6D+00
   Bfn.  Coefficient  Atom+Function         Bfn.  Coefficient  Atom+Function  
  ----- ------------  ---------------      ----- ------------  ---------------
    33      2.064998   4 C  s                26      1.981206   3 C  py        
    44     -1.521615   5 C  py               24     -1.413121   3 C  s         
    25     -1.420177   3 C  px               69     -1.366008   8 O  s         
    16     -1.130305   2 N  px               34     -1.120286   4 C  px        
     7      0.820206   1 N  px                8      0.808360   1 N  py        
 
 Vector   41  Occ=0.000000D+00  E= 4.960987D-01  Symmetry=a'
              MO Center=  4.5D-02,  2.3D-01,  3.4D-16, r^2= 5.1D+00
   Bfn.  Coefficient  Atom+Function         Bfn.  Coefficient  Atom+Function  
  ----- ------------  ---------------      ----- ------------  ---------------
    24      2.781828   3 C  s                51     -2.002588   6 C  s         
    42     -1.915289   5 C  s                35     -1.869586   4 C  py        
    69     -1.661392   8 O  s                26      1.347871   3 C  py        
     6      1.317593   1 N  s                52      1.300700   6 C  px        
     8     -1.250653   1 N  py               16      1.161436   2 N  px        
 
 Vector   42  Occ=0.000000D+00  E= 5.359650D-01  Symmetry=a'
              MO Center=  2.3D-01, -1.4D-01,  3.6D-16, r^2= 4.9D+00
   Bfn.  Coefficient  Atom+Function         Bfn.  Coefficient  Atom+Function  
  ----- ------------  ---------------      ----- ------------  ---------------
    33     -2.153999   4 C  s                 6      2.066094   1 N  s         
    51      2.018210   6 C  s                53     -1.858833   6 C  py        
    44      1.730297   5 C  py               60     -1.663987   7 O  s         
    35      1.634751   4 C  py               26      1.545566   3 C  py        
    24     -1.466784   3 C  s                42      1.396219   5 C  s         
 

 center of mass
 --------------
 x =  -0.06492752 y =  -0.00044477 z =   0.00000000

 moments of inertia (a.u.)
 ------------------
         892.471327895643          -0.000000000000           0.000000000000
          -0.000000000000         461.966741462078           0.000000000000
           0.000000000000           0.000000000000        1354.438069357720
 
  Mulliken analysis of the total density
  --------------------------------------

    Atom       Charge   Shell Charges
 -----------   ------   -------------------------------------------------------
    1 N    7     8.03   2.00  0.74  2.55  0.98  1.76
    2 N    7     7.99   2.00  0.74  2.56  0.97  1.73
    3 C    6     4.93   2.00  0.75  1.94  0.01  0.24
    4 C    6     5.74   2.00  0.72  1.98  0.35  0.70
    5 C    6     6.35   2.00  0.68  2.08  0.54  1.07
    6 C    6     5.19   2.00  0.74  1.93  0.18  0.34
    7 O    8     8.57   2.00  0.91  2.85  1.06  1.75
    8 O    8     8.56   2.00  0.91  2.86  1.05  1.74
    9 H    1     0.57   0.49  0.08
   10 H    1     0.58   0.49  0.08
   11 H    1     0.74   0.53  0.21
   12 H    1     0.75   0.52  0.23
 
       Multipole analysis of the density wrt the origin
       ------------------------------------------------
 
     L   x y z        total         open         nuclear
     -   - - -        -----         ----         -------
     0   0 0 0     -0.000000      0.000000     58.000000
 
     1   1 0 0      1.975620      0.000000     -0.000000
     1   0 1 0      0.498858      0.000000      0.000000
     1   0 0 1      0.000000      0.000000      0.000000
 
     2   2 0 0    -28.561394      0.000000    260.579374
     2   1 1 0      1.797610      0.000000     -0.217199
     2   1 0 1      0.000000      0.000000      0.000000
     2   0 2 0    -45.629482      0.000000    461.850471
     2   0 1 1      0.000000      0.000000      0.000000
     2   0 0 2    -34.805003      0.000000      0.000000
 
                   NWChem Extensible Many-Electron Theory Module
                   ---------------------------------------------
 
              ======================================================
                   This portion of the program was automatically
                  generated by a Tensor Contraction Engine (TCE).
                  The development of this portion of the program
                 and TCE was supported by US Department of Energy,
                Office of Science, Office of Basic Energy Science.
                      TCE is a product of Battelle and PNNL.
              Please cite: S.Hirata, J.Phys.Chem.A 107, 9887 (2003).
              ======================================================
 
                                tce_eomccsd_eomsol1
 
 
            General Information
            -------------------
      Number of processors :     3
         Wavefunction type : Restricted Hartree-Fock
          No. of electrons :    58
           Alpha electrons :    29
            Beta electrons :    29
           No. of orbitals :   160
            Alpha orbitals :    80
             Beta orbitals :    80
        Alpha frozen cores :     8
         Beta frozen cores :     8
     Alpha frozen virtuals :     0
      Beta frozen virtuals :     0
         Spin multiplicity : singlet 
    Number of AO functions :    80
       Number of AO shells :    48
        Use of symmetry is : on 
      Symmetry adaption is : on 
         Schwarz screening : 0.10D-09
 
          Correlation Information
          -----------------------
          Calculation type : Coupled-cluster singles & doubles w/ perturbation           
   Perturbative correction : completely renormalized EOMCCSD(T)                          
            Max iterations :      100
        Residual threshold : 0.10D-04
     T(0) DIIS level shift : 0.00D+00
     L(0) DIIS level shift : 0.00D+00
     T(1) DIIS level shift : 0.00D+00
     L(1) DIIS level shift : 0.00D+00
     T(R) DIIS level shift : 0.00D+00
     T(I) DIIS level shift : 0.00D+00
   CC-T/L Amplitude update :  5-th order DIIS
     No. of excited states :     1
               Target root :     1
           Target symmetry : none
      Symmetry restriction : off
   Dipole & oscillator str : off
                I/O scheme : Global Array Library
        L-threshold :  0.10D-04
        EOM-threshold :  0.10D-04
 no EOMCCSD initial starts read in
 TCE RESTART OPTIONS
 READ_INT:   F
 WRITE_INT:  F
 READ_TA:    F
 WRITE_TA:   F
 READ_XA:    F
 WRITE_XA:   F
 READ_IN3:   F
 WRITE_IN3:  F
 SLICE:      F
 D4D5:       F
 quantumc:   F
 qrotation:  F
 qducc:      F
 nacto:                          0
 nrotv:                          0
 nrot:                           0
 
            Memory Information
            ------------------
          Available GA space size is     393209600 doubles
          Available MA space size is     117937556 doubles
 
 Maximum block size supplied by input
 Maximum block size        15 doubles

 tile_dim =     14

 Block   Spin    Irrep     Size     Offset   Alpha
 -------------------------------------------------
   1    alpha     a'     8 doubles       0       1
   2    alpha     a'     8 doubles       8       2
   3    alpha     a"     5 doubles      16       3
   4    beta      a'     8 doubles      21       1
   5    beta      a'     8 doubles      29       2
   6    beta      a"     5 doubles      37       3
   7    alpha     a'    13 doubles      42       7
   8    alpha     a'    13 doubles      55       8
   9    alpha     a'    14 doubles      68       9
  10    alpha     a"    11 doubles      82      10
  11    beta      a'    13 doubles      93       7
  12    beta      a'    13 doubles     106       8
  13    beta      a'    14 doubles     119       9
  14    beta      a"    11 doubles     133      10

 Global array virtual files algorithm will be used

 Parallel file system coherency ......... OK
 
 Fock matrix recomputed
 1-e file size   =             3392
 1-e file name   = ./tce_eomccsd_eomsol1.f1
 Cpu & wall time / sec            0.5            0.6
 4-electron integrals stored in orbital form
 
 v2    file size   =          2799373
 4-index algorithm nr.  13 is used
 imaxsize =       30
 imaxsize ichop =        0
 Cpu & wall time / sec            4.2            4.3
 T1-number-of-tasks                     7
 
 t1 file size   =              695
 t1 file name   = ./tce_eomccsd_eomsol1.t1
 t1 file handle =       -998
 T2-number-of-boxes                   108
 
 t2 file size   =           917397
 t2 file name   = ./tce_eomccsd_eomsol1.t2
 t2 file handle =       -996

 CCSD iterations
 -----------------------------------------------------------------
 Iter          Residuum       Correlation     Cpu    Wall    V2*C2
 -----------------------------------------------------------------
    1   0.2099089631468  -0.7921802242054     0.8     0.9     0.1
    2   0.0717319085009  -0.7916520259692     0.8     0.9     0.1
    3   0.0287190329678  -0.8107015812518     0.9     1.0     0.1
    4   0.0135304146867  -0.8135278785363     0.8     0.9     0.1
    5   0.0063743337139  -0.8161061011657     0.8     0.9     0.1
 MICROCYCLE DIIS UPDATE:                     5                     5
    6   0.0018426379204  -0.8174692147429     0.8     0.9     0.1
    7   0.0009521815060  -0.8175505123194     0.8     0.9     0.1
    8   0.0005276293837  -0.8175601935208     0.8     0.9     0.1
    9   0.0003363560617  -0.8175690653388     0.8     0.9     0.1
   10   0.0002022530077  -0.8175825445731     0.9     1.0     0.1
 MICROCYCLE DIIS UPDATE:                    10                     5
   11   0.0000609557865  -0.8175951142337     0.8     0.9     0.1
   12   0.0000307015868  -0.8175968024524     0.9     0.9     0.1
   13   0.0000202458812  -0.8175969210293     0.8     0.9     0.1
   14   0.0000125441387  -0.8175972076043     0.8     0.9     0.1
   15   0.0000085587578  -0.8175970277202     0.9     1.0     0.1
 -----------------------------------------------------------------
 Iterations converged
 CCSD correlation energy / hartree =        -0.817597027720175
 CCSD total energy / hartree       =      -413.096219308296554

 Singles contributions

 Doubles contributions
 
 Ground-state symmetry is a'  
 
 =========================================
 Excited-state calculation ( a'  symmetry)
 =========================================
 Dim. of EOMCC iter. space      500
 
 x1 file size   =              695
 
 x2 file size   =           917397

 EOMCCSD SOLVER TYPE  1

 No. of initial right vectors    1

 EOM-CCSD right-hand side iterations
 --------------------------------------------------------------
      Residuum       Omega / hartree  Omega / eV    Cpu    Wall
 --------------------------------------------------------------

 Iteration   1 using    1 trial vectors
   0.5657084984310   0.3734404254564   10.16184     1.6     1.8

 Iteration   2 using    2 trial vectors
   0.1515159114496   0.2381814319849    6.48125     1.1     1.2

 Iteration   3 using    3 trial vectors
   0.0877869633337   0.2252552570469    6.12951     1.2     1.3

 Iteration   4 using    4 trial vectors
   0.0455104323121   0.2219477299599    6.03951     1.1     1.2

 Iteration   5 using    5 trial vectors
   0.0268149103212   0.2204122493639    5.99773     1.2     1.4

 Iteration   6 using    6 trial vectors
   0.0169456092733   0.2195742326285    5.97492     1.2     1.3

 Iteration   7 using    7 trial vectors
   0.0107697499316   0.2192242297304    5.96540     1.2     1.3

 Iteration   8 using    8 trial vectors
   0.0071463187526   0.2190974815422    5.96195     1.3     1.4

 Iteration   9 using    9 trial vectors
   0.0046466982149   0.2190569240082    5.96084     1.3     1.3

 Iteration  10 using   10 trial vectors
   0.0034737471000   0.2190398983795    5.96038     1.3     1.4

 Iteration  11 using   11 trial vectors
   0.0022359220660   0.2190646772096    5.96106     1.4     1.5

 Iteration  12 using   12 trial vectors
   0.0012626518458   0.2190830705586    5.96156     1.3     1.3

 Iteration  13 using   13 trial vectors
   0.0008657839752   0.2190825416640    5.96154     1.4     1.5

 Iteration  14 using   14 trial vectors
   0.0007622033032   0.2190802003080    5.96148     1.4     1.5

 Iteration  15 using   15 trial vectors
   0.0006331474828   0.2190744580676    5.96132     1.3     1.5

 Iteration  16 using   16 trial vectors
   0.0004441591640   0.2190704425460    5.96121     1.4     1.5

 Iteration  17 using   17 trial vectors
   0.0003022638726   0.2190719367538    5.96125     1.4     1.6

 Iteration  18 using   18 trial vectors
   0.0001778803913   0.2190737767364    5.96130     1.5     1.9

 Iteration  19 using   19 trial vectors
   0.0000997762722   0.2190745736844    5.96132     1.4     1.4

 Iteration  20 using   20 trial vectors
   0.0000673997176   0.2190746293778    5.96133     1.4     1.5

 Iteration  21 using   21 trial vectors
   0.0000580687869   0.2190744617119    5.96132     1.4     1.5

 Iteration  22 using   22 trial vectors
   0.0000468043784   0.2190741712438    5.96131     1.3     1.4

 Iteration  23 using   23 trial vectors
   0.0000281043343   0.2190741305444    5.96131     1.5     1.6

 Iteration  24 using   24 trial vectors
   0.0000147848853   0.2190741911850    5.96131     1.5     1.6

 Iteration  25 using   25 trial vectors
   0.0000075825319   0.2190742006004    5.96131     1.3     1.4
 --------------------------------------------------------------
 Iterations converged
 ------------------

 Excited state root  1
 Excitation energy / hartree =        0.219074200600369
                   / eV      =        5.961314847827500
 largest EOMCCSD amplitudes: R1 and R2

 Singles contributions
    30a"  (alpha) ---    25a"  (alpha)        0.1447862764
    30a"  (alpha) ---    29a"  (alpha)       -0.8514301044
    31a"  (alpha) ---    25a"  (alpha)       -0.1342245940
    31a"  (alpha) ---    28a"  (alpha)        0.1574503212

 Doubles contributions
    30a"  (alpha)    30a"  (beta ) ---    29a"  (alpha)    29a"  (beta )        0.1050469279
======= CR-EOMCCSD(T) calculation ======
corresponding R0 value =     0.030687
          
CR-EOMCCSD(T) Intermediates cpu wall time             3.5            3.8
 cr_N i1_1 nr of boxes                    148
 cr_N i1_2 nr of boxes                    264
 creom_N i2_1 nr of boxes                    148
 creom_N i2_2 nr of boxes                    264
 creom_N i2_3 nr of boxes                    148
 creom_N i2_4 nr of boxes                    264
          
          
CR-EOMCCSD(T) triples loop cpu wall           307.2          311.9
          
 CR-EOMCCSD(T)  total energy / hartree       =      -412.885281820595310
 CR-EOMCCSD(T)  excitation energy (eV)       =      5.73990
 
 
 =========================================
 Excited-state calculation ( a"  symmetry)
 =========================================
 Dim. of EOMCC iter. space      500
 
 x1 file size   =              376
 
 x2 file size   =           713160

 EOMCCSD SOLVER TYPE  1

 No. of initial right vectors    1

 EOM-CCSD right-hand side iterations
 --------------------------------------------------------------
      Residuum       Omega / hartree  Omega / eV    Cpu    Wall
 --------------------------------------------------------------

 Iteration   1 using    1 trial vectors
   0.7164784057232   0.4043041938507   11.00168     1.3     1.5

 Iteration   2 using    2 trial vectors
   0.1736239331302   0.2178154279334    5.92706     0.9     0.9

 Iteration   3 using    3 trial vectors
   0.0857462530558   0.2046785839342    5.56959     0.9     1.0

 Iteration   4 using    4 trial vectors
   0.0605102905750   0.1981277075683    5.39133     0.9     0.9

 Iteration   5 using    5 trial vectors
   0.0459218632339   0.1934077448826    5.26289     0.9     1.1

 Iteration   6 using    6 trial vectors
   0.0292104232503   0.1911911356540    5.20258     0.9     1.0

 Iteration   7 using    7 trial vectors
   0.0167042789985   0.1899850828285    5.16976     1.1     1.1

 Iteration   8 using    8 trial vectors
   0.0094400804880   0.1895900813381    5.15901     0.9     1.0

 Iteration   9 using    9 trial vectors
   0.0064537953302   0.1897122115754    5.16233     1.1     1.2

 Iteration  10 using   10 trial vectors
   0.0059514051976   0.1895978207647    5.15922     0.9     1.0

 Iteration  11 using   11 trial vectors
   0.0044000346917   0.1895597505592    5.15819     1.1     1.1

 Iteration  12 using   12 trial vectors
   0.0024196771312   0.1895940125331    5.15912     1.0     1.0

 Iteration  13 using   13 trial vectors
   0.0014569823595   0.1895690464967    5.15844     1.1     1.2

 Iteration  14 using   14 trial vectors
   0.0008400097361   0.1895636890402    5.15829     1.0     1.1

 Iteration  15 using   15 trial vectors
   0.0003700312356   0.1895700467600    5.15847     1.0     1.1

 Iteration  16 using   16 trial vectors
   0.0001562023602   0.1895703242331    5.15847     1.1     1.1

 Iteration  17 using   17 trial vectors
   0.0000768043233   0.1895693218982    5.15845     1.1     1.2

 Iteration  18 using   18 trial vectors
   0.0000450818374   0.1895699938113    5.15846     1.0     1.1

 Iteration  19 using   19 trial vectors
   0.0000287716930   0.1895700555228    5.15847     1.2     1.2

 Iteration  20 using   20 trial vectors
   0.0000164709467   0.1895697438732    5.15846     1.0     1.1

 Iteration  21 using   21 trial vectors
   0.0000088416583   0.1895698384295    5.15846     1.1     1.2
 --------------------------------------------------------------
 Iterations converged
 ------------------

 Excited state root  1
 Excitation energy / hartree =        0.189569838429468
                   / eV      =        5.158459962117256
 largest EOMCCSD amplitudes: R1 and R2

 Singles contributions
    30a"  (alpha) ---    26a'  (alpha)       -0.2312804670
    30a"  (alpha) ---    27a'  (alpha)       -0.7846526392
    31a"  (alpha) ---    27a'  (alpha)       -0.2827990911
    36a"  (alpha) ---    27a'  (alpha)       -0.1984853939

 Doubles contributions
    30a"  (alpha)    30a"  (beta ) ---    27a'  (alpha)    29a"  (beta )        0.1104366294
    30a"  (alpha)    30a"  (beta ) ---    29a"  (alpha)    27a'  (beta )        0.1104366294
======= CR-EOMCCSD(T) calculation ======
corresponding R0 value =     0.000000
          
CR-EOMCCSD(T) Intermediates cpu wall time             2.2            2.4
 creom_N i2_1 nr of boxes                    140
 creom_N i2_2 nr of boxes                    240
 creom_N i2_3 nr of boxes                    148
 creom_N i2_4 nr of boxes                    264
          
          
CR-EOMCCSD(T) triples loop cpu wall            95.6           96.7
          
 CR-EOMCCSD(T)  total energy / hartree       =      -412.909120647713735
 CR-EOMCCSD(T)  excitation energy (eV)       =      5.09122
 

 Task  times  cpu:      493.6s     wall:      506.0s
 
 
                                NWChem Input Module
                                -------------------
 
 
 Summary of allocated global arrays
-----------------------------------
  No active global arrays



                         GA Statistics for process    0
                         ------------------------------

       create   destroy   get      put      acc     scatter   gather  read&inc
calls: 1.16e+04 1.16e+04 1.26e+06 1.68e+04 1.69e+05    0        0     3.16e+05 
number of processes/call -4.12e+12 -7.76e+13 -5.10e+13 0.00e+00 0.00e+00
bytes total:             9.49e+10 5.85e+08 9.42e+09 0.00e+00 0.00e+00 2.53e+06
bytes remote:            5.35e+10 3.75e+08 6.23e+09 0.00e+00 0.00e+00 0.00e+00
Max memory consumed for GA by this process: 162173424 bytes
 
MA_summarize_allocated_blocks: starting scan ...
MA_summarize_allocated_blocks: scan completed: 0 heap blocks, 0 stack blocks
MA usage statistics:

	allocation statistics:
					      heap	     stack
					      ----	     -----
	current number of blocks	         0	         0
	maximum number of blocks	        17	        47
	current total bytes		         0	         0
	maximum total bytes		    215664	  36574824
	maximum total K-bytes		       216	     36575
	maximum total M-bytes		         1	        37
 
 
                                     CITATION
                                     --------
                Please cite the following reference when publishing
                           results obtained with NWChem:
 
                 M. Valiev, E.J. Bylaska, N. Govind, K. Kowalski,
              T.P. Straatsma, H.J.J. van Dam, D. Wang, J. Nieplocha,
                        E. Apra, T.L. Windus, W.A. de Jong
                 "NWChem: a comprehensive and scalable open-source
                  solution for large scale molecular simulations"
                      Comput. Phys. Commun. 181, 1477 (2010)
                           doi:10.1016/j.cpc.2010.04.018
 
                                      AUTHORS
                                      -------
          E. Apra, E. J. Bylaska, W. A. de Jong, N. Govind, K. Kowalski,
       T. P. Straatsma, M. Valiev, H. J. J. van Dam, D. Wang, T. L. Windus,
        J. Hammond, J. Autschbach, K. Bhaskaran-Nair, J. Brabec, K. Lopata,
    S. A. Fischer, S. Krishnamoorthy, M. Jacquelin, W. Ma, M. Klemm, O. Villa,
      Y. Chen, V. Anisimov, F. Aquino, S. Hirata, M. T. Hackler, V. Konjkov,
            D. Mejia-Rodriguez, T. Risthaus, M. Malagoli, A. Marenich,
   A. Otero-de-la-Roza, J. Mullin, P. Nichols, R. Peverati, J. Pittner, Y. Zhao,
        P.-D. Fan, A. Fonari, M. J. Williamson, R. J. Harrison, J. R. Rehr,
      M. Dupuis, D. Silverstein, D. M. A. Smith, J. Nieplocha, V. Tipparaju,
    M. Krishnan, B. E. Van Kuiken, A. Vazquez-Mayagoitia, L. Jensen, M. Swart,
      Q. Wu, T. Van Voorhis, A. A. Auer, M. Nooijen, L. D. Crosby, E. Brown,
      G. Cisneros, G. I. Fann, H. Fruchtl, J. Garza, K. Hirao, R. A. Kendall,
      J. A. Nichols, K. Tsemekhman, K. Wolinski, J. Anchell, D. E. Bernholdt,
      P. Borowski, T. Clark, D. Clerc, H. Dachsel, M. J. O. Deegan, K. Dyall,
    D. Elwood, E. Glendening, M. Gutowski, A. C. Hess, J. Jaffe, B. G. Johnson,
     J. Ju, R. Kobayashi, R. Kutteh, Z. Lin, R. Littlefield, X. Long, B. Meng,
      T. Nakajima, S. Niu, L. Pollack, M. Rosing, K. Glaesemann, G. Sandrone,
      M. Stave, H. Taylor, G. Thomas, J. H. van Lenthe, A. T. Wong, Z. Zhang.

 Total times  cpu:      493.6s     wall:      506.1s
