 argument  1 = h2o_bnl2007_tddft.nw



============================== echo of input deck ==============================
echo
start h2o

geometry noautoz noautosym units angstrom
O        0.000000    0.119088    0.000000
H        0.759830   -0.476352    0.000000
H       -0.759830   -0.476350    0.000000
end

basis spherical
 * library cc-pvtz
end

basis "cd basis"
O  library "Ahlrichs Coulomb Fitting"
H  library "Ahlrichs Coulomb Fitting"
end

set int:acc_std 1d-15
set int:cando_txs f

dft
 xc xbnl07 0.90 lyp 1.00 hfexch 1.00
 cam 0.5 cam_alpha 0.0 cam_beta 1.0
end
task dft energy

property
 dipole
end
task dft property

tddft
 nroots 5
 notriplet
 algorithm 3
end
task tddft energy
================================================================================


                                         
                                         


              Northwest Computational Chemistry Package (NWChem) 6.3
              ------------------------------------------------------


                    Environmental Molecular Sciences Laboratory
                       Pacific Northwest National Laboratory
                                Richland, WA 99352

                              Copyright (c) 1994-2013
                       Pacific Northwest National Laboratory
                            Battelle Memorial Institute

             NWChem is an open-source computational chemistry package
                        distributed under the terms of the
                      Educational Community License (ECL) 2.0
             A copy of the license is included with this distribution
                              in the LICENSE.TXT file

                                  ACKNOWLEDGMENT
                                  --------------

            This software and its documentation were developed at the
            EMSL at Pacific Northwest National Laboratory, a multiprogram
            national laboratory, operated for the U.S. Department of Energy
            by Battelle under Contract Number DE-AC05-76RL01830. Support
            for this work was provided by the Department of Energy Office
            of Biological and Environmental Research, Office of Basic
            Energy Sciences, and the Office of Advanced Scientific Computing.


           Job information
           ---------------

    hostname        = orion
    program         = ../../../bin/LINUX64/nwchem
    date            = Tue Aug 26 18:09:24 2014

    compiled        = Tue_Aug_26_14:53:02_2014
    source          = /home/niri/nwchem/nwchem-6.5
    nwchem branch   = Development
    nwchem revision = 26025
    ga revision     = 10501
    input           = h2o_bnl2007_tddft.nw
    prefix          = h2o.
    data base       = ./h2o.db
    status          = startup
    nproc           =        4
    time left       =     -1s



           Memory information
           ------------------

    heap     =   13107196 doubles =    100.0 Mbytes
    stack    =   13107201 doubles =    100.0 Mbytes
    global   =   26214400 doubles =    200.0 Mbytes (distinct from heap & stack)
    total    =   52428797 doubles =    400.0 Mbytes
    verify   = yes
    hardfail = no 


           Directory information
           ---------------------

  0 permanent = .
  0 scratch   = .




                                NWChem Input Module
                                -------------------



 Scaling coordinates for geometry "geometry" by  1.889725989
 (inverse scale =  0.529177249)



                             Geometry "geometry" -> ""
                             -------------------------

 Output coordinates in angstroms (scale by  1.889725989 to convert to a.u.)

  No.       Tag          Charge          X              Y              Z
 ---- ---------------- ---------- -------------- -------------- --------------
    1 O                    8.0000     0.00000000     0.11908780     0.00000000
    2 H                    1.0000     0.75983000    -0.47635220     0.00000000
    3 H                    1.0000    -0.75983000    -0.47635020     0.00000000

      Atomic Mass 
      ----------- 

      O                 15.994910
      H                  1.007825


 Effective nuclear repulsion energy (a.u.)       9.1190166238

            Nuclear Dipole moment (a.u.) 
            ----------------------------
        X                 Y               Z
 ---------------- ---------------- ----------------
     0.0000000000     0.0000000000     0.0000000000


            XYZ format geometry
            -------------------
     3
 geometry
 O                     0.00000000     0.11908780     0.00000000
 H                     0.75983000    -0.47635220     0.00000000
 H                    -0.75983000    -0.47635020     0.00000000

 ==============================================================================
                                internuclear distances
 ------------------------------------------------------------------------------
       center one      |      center two      | atomic units |  angstroms
 ------------------------------------------------------------------------------
    2 H                |   1 O                |     1.82424  |     0.96534
    3 H                |   1 O                |     1.82423  |     0.96534
 ------------------------------------------------------------------------------
                         number of included internuclear distances:          2
 ==============================================================================



 ==============================================================================
                                 internuclear angles
 ------------------------------------------------------------------------------
        center 1       |       center 2       |       center 3       |  degrees
 ------------------------------------------------------------------------------
    2 H                |   1 O                |   3 H                |   103.83
 ------------------------------------------------------------------------------
                            number of included internuclear angles:          1
 ==============================================================================



  library name resolved from: environment
  library file name is: </home/niri/nwchem/nwchem-6.5/src/basis/libraries/>
  


 Summary of "ao basis" -> "" (spherical)
 ------------------------------------------------------------------------------
       Tag                 Description            Shells   Functions and Types
 ---------------- ------------------------------  ------  ---------------------
 *                          cc-pvtz                   on all atoms 


  library name resolved from: environment
  library file name is: </home/niri/nwchem/nwchem-6.5/src/basis/libraries/>
  
                      Basis "cd basis" -> "" (cartesian)
                      -----
  O (Oxygen)
  ----------
            Exponent  Coefficients 
       -------------- ---------------------------------------------------------
  1 S  9.57843253E+02  0.562496
  1 S  2.81967425E+02  1.491090
  1 S  9.01998320E+01  3.865477

  2 S  3.11382990E+01  1.000000

  3 S  1.14937320E+01  1.000000

  4 S  4.48404900E+00  1.000000

  5 S  1.82350400E+00  1.000000

  6 S  7.60903000E-01  1.000000

  7 S  3.20292000E-01  1.000000

  8 P  6.14708863E-01  1.000000

  9 P  1.47530127E+00  1.000000

 10 P  3.69562968E+00  1.000000

 11 D  7.65267200E+00  1.000000

 12 D  2.21786800E+00  1.000000

 13 D  6.82337000E-01  1.000000

 14 F  2.19178082E+00  1.000000

  H (Hydrogen)
  ------------
            Exponent  Coefficients 
       -------------- ---------------------------------------------------------
  1 S  9.30813000E+00  0.034466
  1 S  2.30671800E+00  0.122534

  2 S  7.52012000E-01  1.000000

  3 S  2.73978000E-01  1.000000

  4 P  2.03270400E+00  1.000000

  5 P  7.90252000E-01  1.000000

  6 D  2.01954800E+00  1.000000



 Summary of "cd basis" -> "" (cartesian)
 ------------------------------------------------------------------------------
       Tag                 Description            Shells   Functions and Types
 ---------------- ------------------------------  ------  ---------------------
 O                  Ahlrichs Coulomb Fitting        14       44   7s3p3d1f
 H                  Ahlrichs Coulomb Fitting         6       15   3s2p1d



                                 NWChem DFT Module
                                 -----------------


                      Basis "ao basis" -> "ao basis" (spherical)
                      -----
  O (Oxygen)
  ----------
            Exponent  Coefficients 
       -------------- ---------------------------------------------------------
  1 S  1.53300000E+04  0.000508
  1 S  2.29900000E+03  0.003929
  1 S  5.22400000E+02  0.020243
  1 S  1.47300000E+02  0.079181
  1 S  4.75500000E+01  0.230687
  1 S  1.67600000E+01  0.433118
  1 S  6.20700000E+00  0.350260
  1 S  6.88200000E-01 -0.008154

  2 S  1.53300000E+04 -0.000115
  2 S  2.29900000E+03 -0.000895
  2 S  5.22400000E+02 -0.004636
  2 S  1.47300000E+02 -0.018724
  2 S  4.75500000E+01 -0.058463
  2 S  1.67600000E+01 -0.136463
  2 S  6.20700000E+00 -0.175740
  2 S  6.88200000E-01  0.603418

  3 S  1.75200000E+00  1.000000

  4 S  2.38400000E-01  1.000000

  5 P  3.44600000E+01  0.015928
  5 P  7.74900000E+00  0.099740
  5 P  2.28000000E+00  0.310492

  6 P  7.15600000E-01  1.000000

  7 P  2.14000000E-01  1.000000

  8 D  2.31400000E+00  1.000000

  9 D  6.45000000E-01  1.000000

 10 F  1.42800000E+00  1.000000

  H (Hydrogen)
  ------------
            Exponent  Coefficients 
       -------------- ---------------------------------------------------------
  1 S  3.38700000E+01  0.006068
  1 S  5.09500000E+00  0.045308
  1 S  1.15900000E+00  0.202822

  2 S  3.25800000E-01  1.000000

  3 S  1.02700000E-01  1.000000

  4 P  1.40700000E+00  1.000000

  5 P  3.88000000E-01  1.000000

  6 D  1.05700000E+00  1.000000



 Summary of "ao basis" -> "ao basis" (spherical)
 ------------------------------------------------------------------------------
       Tag                 Description            Shells   Functions and Types
 ---------------- ------------------------------  ------  ---------------------
 O                          cc-pvtz                 10       30   4s3p2d1f
 H                          cc-pvtz                  6       14   3s2p1d




 Summary of "ao basis" -> "ao basis" (spherical)
 ------------------------------------------------------------------------------
       Tag                 Description            Shells   Functions and Types
 ---------------- ------------------------------  ------  ---------------------
 O                          cc-pvtz                 10       30   4s3p2d1f
 H                          cc-pvtz                  6       14   3s2p1d



int_init: setting std/high accuracies to  1.0D-15  1.0D-30
  int_init: cando_txs set to always be  F
  Caching 1-el integrals 

            General Information
            -------------------
          SCF calculation type: DFT
          Wavefunction type:  closed shell.
          No. of atoms     :     3
          No. of electrons :    10
           Alpha electrons :     5
            Beta electrons :     5
          Charge           :     0
          Spin multiplicity:     1
          Use of symmetry is: off; symmetry adaption is: off
          Maximum number of iterations:  30
          AO basis - number of functions:    58
                     number of shells:    22
          A Charge density fitting basis will be used.
          CD basis - number of functions:    74
                     number of shells:    26
          Convergence on energy requested: 1.00D-06
          Convergence on density requested: 1.00D-05
          Convergence on gradient requested: 5.00D-04

              XC Information
              --------------
                     Hartree-Fock (Exact) Exchange  1.000          
                   LC-BNL 2007 Exchange Functional  0.900 local    
              Lee-Yang-Parr Correlation Functional  1.000          

           Range-Separation Parameters        
           ---------------------------
           Alpha           :  0.00
           Beta            :  1.00
           Gamma           :  0.50
           Short-Range HF  :     F

             Grid Information
             ----------------
          Grid used for XC integration:  medium    
          Radial quadrature: Mura-Knowles        
          Angular quadrature: Lebedev. 
          Tag              B.-S. Rad. Rad. Pts. Rad. Cut. Ang. Pts.
          ---              ---------- --------- --------- ---------
          O                   0.60       49           6.0       434
          H                   0.35       45           7.0       434
          Grid pruning is: on 
          Number of quadrature shells:   139
          Spatial weights used:  Erf1

          Convergence Information
          -----------------------
          Convergence aids based upon iterative change in 
          total energy or number of iterations. 
          Levelshifting, if invoked, occurs when the 
          HOMO/LUMO gap drops below (HL_TOL): 1.00D-02
          DIIS, if invoked, will attempt to extrapolate 
          using up to (NFOCK): 10 stored Fock matrices.

                    Damping( 0%)  Levelshifting(0.5)       DIIS
                  --------------- ------------------- ---------------
          dE  on:    start            ASAP                start   
          dE off:    2 iters         30 iters            30 iters 


      Screening Tolerance Information
      -------------------------------
          Density screening/tol_rho: 1.00D-10
          AO Gaussian exp screening on grid/accAOfunc:  14
          CD Gaussian exp screening on grid/accCDfunc:  20
          XC Gaussian exp screening on grid/accXCfunc:  20
          Schwarz screening/accCoul: 1.00D-08


      Superposition of Atomic Density Guess
      -------------------------------------

 Sum of atomic energies:         -75.78028790

      Non-variational initial energy
      ------------------------------

 Total energy =     -75.930196
 1-e energy   =    -121.638497
 2-e energy   =      36.589285
 HOMO         =      -0.475368
 LUMO         =       0.064403

   Time after variat. SCF:      0.2

      3 Center 2 Electron Integral Information
      ----------------------------------------
          Maximum number of 3-center 2e- integrals is:          248936.
            This is reduced with Schwarz screening to:          168054.
            Incore requires a per proc buffer size of:           75118.
                  The minimum integral buffer size is:            7252
          Minimum dble words available (all nodes) is:        26212820
                   This is reduced (for later use) to:        25959385
                             Suggested buffer size is:           75118

           0.075 MW buffer allocated for incore 3-center 
          2e- integral storage on stack. 
          The percent of 3c 2e- integrals held in-core is: 100.00

   Time prior to 1st pass:      0.3

 Integral file          = ./h2o.aoints.0
 Record size in doubles =  65536        No. of integs per rec  =  43688
 Max. records in memory =     13        Max. records in file   =  17017
 No. of bits per label  =      8        No. of bits per value  =     64


 #quartets = 3.213D+04 #integrals = 7.488D+05 #direct =  0.0% #cached =100.0%


File balance: exchanges=     3  moved=     4  time=   0.0


 Grid_pts file          = ./h2o.gridpts.0
 Record size in doubles =  12289        No. of grid_pts per rec  =   3070
 Max. records in memory =      7        Max. recs in file   =     90757


           Memory utilization after 1st SCF pass: 
           Heap Space remaining (MW):       12.17            12168020
          Stack Space remaining (MW):       13.03            13031484

   convergence    iter        energy       DeltaE   RMS-Dens  Diis-err    time
 ---------------- ----- ----------------- --------- --------- ---------  ------
 d= 0,ls=0.0,diis     1    -75.1587502931 -8.43D+01  8.40D-03  1.37D+00     1.0
 d= 0,ls=0.0,diis     2    -75.1816571517 -2.29D-02  3.83D-03  5.03D-01     1.2
 d= 0,ls=0.0,diis     3    -75.2148811697 -3.32D-02  9.44D-04  5.15D-02     1.4
 d= 0,ls=0.0,diis     4    -75.2185416918 -3.66D-03  8.04D-05  4.79D-05     1.6
 d= 0,ls=0.0,diis     5    -75.2185499175 -8.23D-06  4.79D-05  3.72D-06     1.8
  Resetting Diis
 d= 0,ls=0.0,diis     6    -75.2185513247 -1.41D-06  1.22D-05  1.11D-07     2.0
 d= 0,ls=0.0,diis     7    -75.2185513848 -6.00D-08  1.63D-06  5.21D-09     2.2


         Total DFT energy =      -75.218551384760
      One electron energy =     -122.612309228813
           Coulomb energy =       46.290238543504
    Exchange-Corr. energy =       -8.015497323288
 Nuclear repulsion energy =        9.119016623837

 Numeric. integr. density =       10.000000268850

     Total iterative time =      1.9s



                       DFT Final Molecular Orbital Analysis
                       ------------------------------------

 Vector    1  Occ=2.000000D+00  E=-1.866224D+01
              MO Center= -2.5D-10,  1.2D-01,  5.7D-15, r^2= 1.5D-02
   Bfn.  Coefficient  Atom+Function         Bfn.  Coefficient  Atom+Function  
  ----- ------------  ---------------      ----- ------------  ---------------
     1      0.949623  1 O  s          

 Vector    2  Occ=2.000000D+00  E=-1.144979D+00
              MO Center= -5.9D-07, -8.8D-02,  9.5D-13, r^2= 5.3D-01
   Bfn.  Coefficient  Atom+Function         Bfn.  Coefficient  Atom+Function  
  ----- ------------  ---------------      ----- ------------  ---------------
     2      0.468702  1 O  s                  4      0.290601  1 O  s          

 Vector    3  Occ=2.000000D+00  E=-6.517672D-01
              MO Center=  5.0D-07, -9.5D-02,  9.2D-14, r^2= 7.9D-01
   Bfn.  Coefficient  Atom+Function         Bfn.  Coefficient  Atom+Function  
  ----- ------------  ---------------      ----- ------------  ---------------
     8      0.322313  1 O  px                 5      0.299153  1 O  px         
    32      0.214031  2 H  s                 46     -0.214031  3 H  s          
    11      0.163776  1 O  px         

 Vector    4  Occ=2.000000D+00  E=-5.128434D-01
              MO Center=  2.2D-07,  2.0D-01,  3.6D-12, r^2= 7.1D-01
   Bfn.  Coefficient  Atom+Function         Bfn.  Coefficient  Atom+Function  
  ----- ------------  ---------------      ----- ------------  ---------------
     9      0.354077  1 O  py                 6      0.322514  1 O  py         
    12      0.310240  1 O  py                 4      0.283115  1 O  s          
     2      0.185067  1 O  s          

 Vector    5  Occ=2.000000D+00  E=-4.401798D-01
              MO Center= -5.4D-08,  8.1D-02,  4.8D-12, r^2= 6.6D-01
   Bfn.  Coefficient  Atom+Function         Bfn.  Coefficient  Atom+Function  
  ----- ------------  ---------------      ----- ------------  ---------------
    10      0.410772  1 O  pz                13      0.404255  1 O  pz         
     7      0.365546  1 O  pz         

 Vector    6  Occ=0.000000D+00  E= 1.105902D-01
              MO Center=  2.4D-06, -6.4D-01, -3.8D-11, r^2= 3.6D+00
   Bfn.  Coefficient  Atom+Function         Bfn.  Coefficient  Atom+Function  
  ----- ------------  ---------------      ----- ------------  ---------------
     4      1.447222  1 O  s                 33     -0.891469  2 H  s          
    47     -0.891466  3 H  s                 12     -0.427182  1 O  py         
    32     -0.259702  2 H  s                 46     -0.259703  3 H  s          
     9     -0.196092  1 O  py         

 Vector    7  Occ=0.000000D+00  E= 1.754000D-01
              MO Center= -3.6D-06, -6.8D-01, -2.6D-13, r^2= 4.4D+00
   Bfn.  Coefficient  Atom+Function         Bfn.  Coefficient  Atom+Function  
  ----- ------------  ---------------      ----- ------------  ---------------
    33      1.689897  2 H  s                 47     -1.689900  3 H  s          
    11     -0.801654  1 O  px                 8     -0.217138  1 O  px         
     5     -0.166741  1 O  px         

 Vector    8  Occ=0.000000D+00  E= 4.875551D-01
              MO Center=  8.1D-06, -8.6D-02,  2.2D-14, r^2= 2.3D+00
   Bfn.  Coefficient  Atom+Function         Bfn.  Coefficient  Atom+Function  
  ----- ------------  ---------------      ----- ------------  ---------------
    32      1.451183  2 H  s                 46     -1.451176  3 H  s          
    11     -1.061953  1 O  px                33     -0.717247  2 H  s          
    47      0.717237  3 H  s                  8     -0.264800  1 O  px         

 Vector    9  Occ=0.000000D+00  E= 5.439181D-01
              MO Center= -5.3D-06, -5.4D-01, -3.0D-11, r^2= 2.1D+00
   Bfn.  Coefficient  Atom+Function         Bfn.  Coefficient  Atom+Function  
  ----- ------------  ---------------      ----- ------------  ---------------
    32      1.152830  2 H  s                 46      1.152851  3 H  s          
    33     -0.651240  2 H  s                 47     -0.651244  3 H  s          
    12      0.343722  1 O  py                37      0.285454  2 H  px         
    51     -0.285452  3 H  px                 2     -0.197948  1 O  s          
     4     -0.190794  1 O  s                  9      0.176225  1 O  py         

 Vector   10  Occ=0.000000D+00  E= 6.127505D-01
              MO Center= -2.5D-07,  3.4D-01,  1.8D-11, r^2= 2.2D+00
   Bfn.  Coefficient  Atom+Function         Bfn.  Coefficient  Atom+Function  
  ----- ------------  ---------------      ----- ------------  ---------------
     4      4.363520  1 O  s                 12     -2.579113  1 O  py         
    32     -2.270201  2 H  s                 46     -2.270207  3 H  s          
    37      0.818148  2 H  px                51     -0.818152  3 H  px         
    38     -0.623856  2 H  py                52     -0.623856  3 H  py         
    33     -0.395413  2 H  s                 47     -0.395417  3 H  s          

 Vector   11  Occ=0.000000D+00  E= 7.194720D-01
              MO Center=  1.9D-06,  7.0D-02,  8.1D-12, r^2= 1.7D+00
   Bfn.  Coefficient  Atom+Function         Bfn.  Coefficient  Atom+Function  
  ----- ------------  ---------------      ----- ------------  ---------------
    13      1.108921  1 O  pz                10     -0.757334  1 O  pz         
     7     -0.291592  1 O  pz         

 Vector   12  Occ=0.000000D+00  E= 7.367190D-01
              MO Center= -1.6D-06,  1.1D-01, -3.0D-13, r^2= 3.0D+00
   Bfn.  Coefficient  Atom+Function         Bfn.  Coefficient  Atom+Function  
  ----- ------------  ---------------      ----- ------------  ---------------
    11      2.906547  1 O  px                32     -1.567133  2 H  s          
    46      1.567141  3 H  s                 33     -1.432434  2 H  s          
    47      1.432434  3 H  s                 37      0.840207  2 H  px         
    51      0.840213  3 H  px                38     -0.672081  2 H  py         
    52      0.672075  3 H  py                19     -0.435589  1 O  d -2       

 Vector   13  Occ=0.000000D+00  E= 7.388091D-01
              MO Center= -1.2D-07, -1.5D-01,  3.3D-11, r^2= 2.0D+00
   Bfn.  Coefficient  Atom+Function         Bfn.  Coefficient  Atom+Function  
  ----- ------------  ---------------      ----- ------------  ---------------
    12      1.481614  1 O  py                32      1.109741  2 H  s          
    46      1.109733  3 H  s                  4     -1.011766  1 O  s          
    37     -0.613965  2 H  px                51      0.613958  3 H  px         
    38     -0.609467  2 H  py                52     -0.609474  3 H  py         
    33     -0.218710  2 H  s                 47     -0.218722  3 H  s          

 Vector   14  Occ=0.000000D+00  E= 8.016794D-01
              MO Center= -3.9D-07, -4.6D-01,  1.6D-14, r^2= 1.7D+00
   Bfn.  Coefficient  Atom+Function         Bfn.  Coefficient  Atom+Function  
  ----- ------------  ---------------      ----- ------------  ---------------
    39      0.835715  2 H  pz                53     -0.835713  3 H  pz         

 Vector   15  Occ=0.000000D+00  E= 8.933698D-01
              MO Center= -1.4D-06, -2.0D-01, -3.2D-11, r^2= 2.0D+00
   Bfn.  Coefficient  Atom+Function         Bfn.  Coefficient  Atom+Function  
  ----- ------------  ---------------      ----- ------------  ---------------
    13      1.162417  1 O  pz                39     -0.987666  2 H  pz         
    53     -0.987669  3 H  pz         


 center of mass
 --------------
 x =   0.00000000 y =   0.09911481 z =   0.00000000

 moments of inertia (a.u.)
 ------------------
           2.266428026031           0.000005469268           0.000000000000
           0.000005469268           4.155714155453           0.000000000000
           0.000000000000           0.000000000000           6.422142181484

     Multipole analysis of the density
     ---------------------------------

     L   x y z        total         alpha         beta         nuclear
     -   - - -        -----         -----         ----         -------
     0   0 0 0      0.000000     -5.000000     -5.000000     10.000000

     1   1 0 0      0.000000      0.000000      0.000000      0.000000
     1   0 1 0     -0.803722     -0.401861     -0.401861      0.000000
     1   0 0 1      0.000000      0.000000      0.000000      0.000000

     2   2 0 0     -3.369727     -3.746588     -3.746588      4.123448
     2   1 1 0     -0.000002      0.000002      0.000002     -0.000005
     2   1 0 1      0.000000      0.000000      0.000000      0.000000
     2   0 2 0     -4.739000     -3.382390     -3.382390      2.025780
     2   0 1 1      0.000000      0.000000      0.000000      0.000000
     2   0 0 2     -5.663830     -2.831915     -2.831915      0.000000


 Parallel integral file used      19 records with       0 large values


 Task  times  cpu:        2.2s     wall:        3.5s


                                NWChem Input Module
                                -------------------


                              NWChem Property Module
                              ----------------------


  itol2e modified to match energy
  convergence criterion.

                                 NWChem DFT Module
                                 -----------------




 Summary of "ao basis" -> "ao basis" (spherical)
 ------------------------------------------------------------------------------
       Tag                 Description            Shells   Functions and Types
 ---------------- ------------------------------  ------  ---------------------
 O                          cc-pvtz                 10       30   4s3p2d1f
 H                          cc-pvtz                  6       14   3s2p1d



int_init: setting std/high accuracies to  1.0D-15  1.0D-30
  int_init: cando_txs set to always be  F
  Caching 1-el integrals 
  itol2e modified to match energy
  convergence criterion.

            General Information
            -------------------
          SCF calculation type: DFT
          Wavefunction type:  closed shell.
          No. of atoms     :     3
          No. of electrons :    10
           Alpha electrons :     5
            Beta electrons :     5
          Charge           :     0
          Spin multiplicity:     1
          Use of symmetry is: off; symmetry adaption is: off
          Maximum number of iterations:  30
          AO basis - number of functions:    58
                     number of shells:    22
          A Charge density fitting basis will be used.
          CD basis - number of functions:    74
                     number of shells:    26
          Convergence on energy requested: 1.00D-07
          Convergence on density requested: 1.00D-05
          Convergence on gradient requested: 5.00D-04

              XC Information
              --------------
                     Hartree-Fock (Exact) Exchange  1.000          
                   LC-BNL 2007 Exchange Functional  0.900 local    
              Lee-Yang-Parr Correlation Functional  1.000          

           Range-Separation Parameters        
           ---------------------------
           Alpha           :  0.00
           Beta            :  1.00
           Gamma           :  0.50
           Short-Range HF  :     F

             Grid Information
             ----------------
          Grid used for XC integration:  fine      
          Radial quadrature: Mura-Knowles        
          Angular quadrature: Lebedev. 
          Tag              B.-S. Rad. Rad. Pts. Rad. Cut. Ang. Pts.
          ---              ---------- --------- --------- ---------
          O                   0.60       70           6.0       590
          H                   0.35       60           7.0       590
          Grid pruning is: on 
          Number of quadrature shells:   190
          Spatial weights used:  Erf1

          Convergence Information
          -----------------------
          Convergence aids based upon iterative change in 
          total energy or number of iterations. 
          Levelshifting, if invoked, occurs when the 
          HOMO/LUMO gap drops below (HL_TOL): 1.00D-02
          DIIS, if invoked, will attempt to extrapolate 
          using up to (NFOCK): 10 stored Fock matrices.

                    Damping( 0%)  Levelshifting(0.5)       DIIS
                  --------------- ------------------- ---------------
          dE  on:    start            ASAP                start   
          dE off:    2 iters         30 iters            30 iters 


      Screening Tolerance Information
      -------------------------------
          Density screening/tol_rho: 1.00D-11
          AO Gaussian exp screening on grid/accAOfunc:  16
          CD Gaussian exp screening on grid/accCDfunc:  20
          XC Gaussian exp screening on grid/accXCfunc:  20
          Schwarz screening/accCoul: 1.00D-08


 Loading old vectors from job with title :



   Time after variat. SCF:      2.3

      3 Center 2 Electron Integral Information
      ----------------------------------------
          Maximum number of 3-center 2e- integrals is:          248936.
            This is reduced with Schwarz screening to:          168054.
            Incore requires a per proc buffer size of:           75118.
                  The minimum integral buffer size is:            7252
          Minimum dble words available (all nodes) is:        26212820
                   This is reduced (for later use) to:        25762833
                             Suggested buffer size is:           75118

           0.075 MW buffer allocated for incore 3-center 
          2e- integral storage on stack. 
          The percent of 3c 2e- integrals held in-core is: 100.00

   Time prior to 1st pass:      2.3

 Integral file          = ./h2o.aoints.0
 Record size in doubles =  65536        No. of integs per rec  =  43688
 Max. records in memory =     13        Max. records in file   =  17017
 No. of bits per label  =      8        No. of bits per value  =     64


 #quartets = 3.213D+04 #integrals = 7.484D+05 #direct =  0.0% #cached =100.0%


File balance: exchanges=     3  moved=     4  time=   0.0


 Grid_pts file          = ./h2o.gridpts.0
 Record size in doubles =  12289        No. of grid_pts per rec  =   3070
 Max. records in memory =     12        Max. recs in file   =     90757


           Memory utilization after 1st SCF pass: 
           Heap Space remaining (MW):       12.11            12106580
          Stack Space remaining (MW):       13.03            13031484

   convergence    iter        energy       DeltaE   RMS-Dens  Diis-err    time
 ---------------- ----- ----------------- --------- --------- ---------  ------
 d= 0,ls=0.0,diis     1    -75.2185510871 -8.43D+01  6.74D-07  2.33D-09     3.2
 d= 0,ls=0.0,diis     2    -75.2185510873 -1.88D-10  2.08D-07  2.21D-09     3.5


         Total DFT energy =      -75.218551087315
      One electron energy =     -122.612316878285
           Coulomb energy =       46.290246056193
    Exchange-Corr. energy =       -8.015496889061
 Nuclear repulsion energy =        9.119016623837

 Numeric. integr. density =       10.000000185408

     Total iterative time =      1.2s



                       DFT Final Molecular Orbital Analysis
                       ------------------------------------

 Vector    1  Occ=2.000000D+00  E=-1.866226D+01
              MO Center= -2.5D-10,  1.2D-01,  4.6D-15, r^2= 1.5D-02
   Bfn.  Coefficient  Atom+Function         Bfn.  Coefficient  Atom+Function  
  ----- ------------  ---------------      ----- ------------  ---------------
     1      0.949623  1 O  s          

 Vector    2  Occ=2.000000D+00  E=-1.144985D+00
              MO Center= -5.9D-07, -8.8D-02,  5.9D-12, r^2= 5.3D-01
   Bfn.  Coefficient  Atom+Function         Bfn.  Coefficient  Atom+Function  
  ----- ------------  ---------------      ----- ------------  ---------------
     2      0.468703  1 O  s                  4      0.290600  1 O  s          

 Vector    3  Occ=2.000000D+00  E=-6.517719D-01
              MO Center=  5.0D-07, -9.5D-02, -8.6D-12, r^2= 7.9D-01
   Bfn.  Coefficient  Atom+Function         Bfn.  Coefficient  Atom+Function  
  ----- ------------  ---------------      ----- ------------  ---------------
     8      0.322314  1 O  px                 5      0.299154  1 O  px         
    32      0.214029  2 H  s                 46     -0.214029  3 H  s          
    11      0.163777  1 O  px         

 Vector    4  Occ=2.000000D+00  E=-5.128501D-01
              MO Center=  2.2D-07,  2.0D-01, -5.8D-12, r^2= 7.1D-01
   Bfn.  Coefficient  Atom+Function         Bfn.  Coefficient  Atom+Function  
  ----- ------------  ---------------      ----- ------------  ---------------
     9      0.354081  1 O  py                 6      0.322517  1 O  py         
    12      0.310240  1 O  py                 4      0.283102  1 O  s          
     2      0.185064  1 O  s          

 Vector    5  Occ=2.000000D+00  E=-4.401861D-01
              MO Center= -5.4D-08,  8.1D-02,  8.5D-12, r^2= 6.6D-01
   Bfn.  Coefficient  Atom+Function         Bfn.  Coefficient  Atom+Function  
  ----- ------------  ---------------      ----- ------------  ---------------
    10      0.410772  1 O  pz                13      0.404253  1 O  pz         
     7      0.365547  1 O  pz         

 Vector    6  Occ=0.000000D+00  E= 1.105885D-01
              MO Center=  2.4D-06, -6.4D-01, -2.6D-11, r^2= 3.6D+00
   Bfn.  Coefficient  Atom+Function         Bfn.  Coefficient  Atom+Function  
  ----- ------------  ---------------      ----- ------------  ---------------
     4      1.447214  1 O  s                 33     -0.891467  2 H  s          
    47     -0.891464  3 H  s                 12     -0.427171  1 O  py         
    32     -0.259700  2 H  s                 46     -0.259701  3 H  s          
     9     -0.196089  1 O  py         

 Vector    7  Occ=0.000000D+00  E= 1.753988D-01
              MO Center= -3.6D-06, -6.8D-01, -2.5D-11, r^2= 4.4D+00
   Bfn.  Coefficient  Atom+Function         Bfn.  Coefficient  Atom+Function  
  ----- ------------  ---------------      ----- ------------  ---------------
    33      1.689894  2 H  s                 47     -1.689898  3 H  s          
    11     -0.801655  1 O  px                 8     -0.217140  1 O  px         
     5     -0.166742  1 O  px         

 Vector    8  Occ=0.000000D+00  E= 4.875534D-01
              MO Center=  8.1D-06, -8.6D-02, -3.4D-12, r^2= 2.3D+00
   Bfn.  Coefficient  Atom+Function         Bfn.  Coefficient  Atom+Function  
  ----- ------------  ---------------      ----- ------------  ---------------
    32      1.451173  2 H  s                 46     -1.451166  3 H  s          
    11     -1.061934  1 O  px                33     -0.717257  2 H  s          
    47      0.717247  3 H  s                  8     -0.264800  1 O  px         

 Vector    9  Occ=0.000000D+00  E= 5.439157D-01
              MO Center= -5.3D-06, -5.4D-01, -8.4D-12, r^2= 2.1D+00
   Bfn.  Coefficient  Atom+Function         Bfn.  Coefficient  Atom+Function  
  ----- ------------  ---------------      ----- ------------  ---------------
    32      1.152802  2 H  s                 46      1.152823  3 H  s          
    33     -0.651247  2 H  s                 47     -0.651251  3 H  s          
    12      0.343690  1 O  py                37      0.285462  2 H  px         
    51     -0.285461  3 H  px                 2     -0.197948  1 O  s          
     4     -0.190738  1 O  s                  9      0.176224  1 O  py         

 Vector   10  Occ=0.000000D+00  E= 6.127497D-01
              MO Center= -2.5D-07,  3.4D-01, -1.2D-11, r^2= 2.2D+00
   Bfn.  Coefficient  Atom+Function         Bfn.  Coefficient  Atom+Function  
  ----- ------------  ---------------      ----- ------------  ---------------
     4      4.363490  1 O  s                 12     -2.579097  1 O  py         
    32     -2.270193  2 H  s                 46     -2.270199  3 H  s          
    37      0.818133  2 H  px                51     -0.818137  3 H  px         
    38     -0.623859  2 H  py                52     -0.623859  3 H  py         
    33     -0.395407  2 H  s                 47     -0.395412  3 H  s          

 Vector   11  Occ=0.000000D+00  E= 7.194691D-01
              MO Center=  1.9D-06,  7.0D-02,  2.9D-11, r^2= 1.7D+00
   Bfn.  Coefficient  Atom+Function         Bfn.  Coefficient  Atom+Function  
  ----- ------------  ---------------      ----- ------------  ---------------
    13      1.108917  1 O  pz                10     -0.757332  1 O  pz         
     7     -0.291593  1 O  pz         

 Vector   12  Occ=0.000000D+00  E= 7.367166D-01
              MO Center= -1.6D-06,  1.1D-01, -1.3D-11, r^2= 3.0D+00
   Bfn.  Coefficient  Atom+Function         Bfn.  Coefficient  Atom+Function  
  ----- ------------  ---------------      ----- ------------  ---------------
    11      2.906548  1 O  px                32     -1.567135  2 H  s          
    46      1.567143  3 H  s                 33     -1.432430  2 H  s          
    47      1.432430  3 H  s                 37      0.840204  2 H  px         
    51      0.840211  3 H  px                38     -0.672078  2 H  py         
    52      0.672072  3 H  py                19     -0.435588  1 O  d -2       

 Vector   13  Occ=0.000000D+00  E= 7.388083D-01
              MO Center= -1.2D-07, -1.5D-01,  4.3D-11, r^2= 2.0D+00
   Bfn.  Coefficient  Atom+Function         Bfn.  Coefficient  Atom+Function  
  ----- ------------  ---------------      ----- ------------  ---------------
    12      1.481635  1 O  py                32      1.109757  2 H  s          
    46      1.109748  3 H  s                  4     -1.011800  1 O  s          
    37     -0.613972  2 H  px                51      0.613965  3 H  px         
    38     -0.609461  2 H  py                52     -0.609468  3 H  py         
    33     -0.218705  2 H  s                 47     -0.218716  3 H  s          

 Vector   14  Occ=0.000000D+00  E= 8.016777D-01
              MO Center= -3.9D-07, -4.6D-01,  1.1D-10, r^2= 1.7D+00
   Bfn.  Coefficient  Atom+Function         Bfn.  Coefficient  Atom+Function  
  ----- ------------  ---------------      ----- ------------  ---------------
    39      0.835714  2 H  pz                53     -0.835713  3 H  pz         

 Vector   15  Occ=0.000000D+00  E= 8.933689D-01
              MO Center= -1.4D-06, -2.0D-01, -8.9D-11, r^2= 2.0D+00
   Bfn.  Coefficient  Atom+Function         Bfn.  Coefficient  Atom+Function  
  ----- ------------  ---------------      ----- ------------  ---------------
    13      1.162420  1 O  pz                39     -0.987665  2 H  pz         
    53     -0.987668  3 H  pz         


 center of mass
 --------------
 x =   0.00000000 y =   0.09911481 z =   0.00000000

 moments of inertia (a.u.)
 ------------------
           2.266428026031           0.000005469268           0.000000000000
           0.000005469268           4.155714155453           0.000000000000
           0.000000000000           0.000000000000           6.422142181484

     Multipole analysis of the density
     ---------------------------------

     L   x y z        total         alpha         beta         nuclear
     -   - - -        -----         -----         ----         -------
     0   0 0 0      0.000000     -5.000000     -5.000000     10.000000

     1   1 0 0      0.000000      0.000000      0.000000      0.000000
     1   0 1 0     -0.803746     -0.401873     -0.401873      0.000000
     1   0 0 1      0.000000      0.000000      0.000000      0.000000

     2   2 0 0     -3.369687     -3.746568     -3.746568      4.123448
     2   1 1 0     -0.000002      0.000002      0.000002     -0.000005
     2   1 0 1      0.000000      0.000000      0.000000      0.000000
     2   0 2 0     -4.738958     -3.382369     -3.382369      2.025780
     2   0 1 1      0.000000      0.000000      0.000000      0.000000
     2   0 0 2     -5.663805     -2.831903     -2.831903      0.000000


 Parallel integral file used      19 records with       0 large values


          -------------
          Dipole Moment
          -------------

int_init: setting std/high accuracies to  1.0D-15  1.0D-30
  int_init: cando_txs set to always be  F

 Center of charge (in au) is the expansion point
         X =       0.0000000 Y =       0.0000000 Z =       0.0000000

   Dipole moment        0.8037457393 A.U.
             DMX       -0.0000002697 DMXEFC        0.0000000000
             DMY       -0.8037457393 DMYEFC        0.0000000000
             DMZ        0.0000000000 DMZEFC        0.0000000000
   -EFC- dipole         0.0000000000 A.U.
   Total dipole         0.8037457393 A.U.

   Dipole moment        2.0429333355 Debye(s)
             DMX       -0.0000006855 DMXEFC        0.0000000000
             DMY       -2.0429333355 DMYEFC        0.0000000000
             DMZ        0.0000000000 DMZEFC        0.0000000000
   -EFC- dipole         0.0000000000 DEBYE(S)
   Total dipole         2.0429333355 DEBYE(S)

 1 a.u. = 2.541766 Debyes 

 Task  times  cpu:        1.3s     wall:        2.5s


                                NWChem Input Module
                                -------------------



                                 NWChem DFT Module
                                 -----------------




 Summary of "ao basis" -> "ao basis" (spherical)
 ------------------------------------------------------------------------------
       Tag                 Description            Shells   Functions and Types
 ---------------- ------------------------------  ------  ---------------------
 O                          cc-pvtz                 10       30   4s3p2d1f
 H                          cc-pvtz                  6       14   3s2p1d



int_init: setting std/high accuracies to  1.0D-15  1.0D-30
  int_init: cando_txs set to always be  F
  Caching 1-el integrals 
  itol2e modified to match energy
  convergence criterion.

            General Information
            -------------------
          SCF calculation type: DFT
          Wavefunction type:  closed shell.
          No. of atoms     :     3
          No. of electrons :    10
           Alpha electrons :     5
            Beta electrons :     5
          Charge           :     0
          Spin multiplicity:     1
          Use of symmetry is: off; symmetry adaption is: off
          Maximum number of iterations:  30
          AO basis - number of functions:    58
                     number of shells:    22
          A Charge density fitting basis will be used.
          CD basis - number of functions:    74
                     number of shells:    26
          Convergence on energy requested: 1.00D-07
          Convergence on density requested: 1.00D-05
          Convergence on gradient requested: 5.00D-04

              XC Information
              --------------
                     Hartree-Fock (Exact) Exchange  1.000          
                   LC-BNL 2007 Exchange Functional  0.900 local    
              Lee-Yang-Parr Correlation Functional  1.000          

           Range-Separation Parameters        
           ---------------------------
           Alpha           :  0.00
           Beta            :  1.00
           Gamma           :  0.50
           Short-Range HF  :     F

             Grid Information
             ----------------
          Grid used for XC integration:  fine      
          Radial quadrature: Mura-Knowles        
          Angular quadrature: Lebedev. 
          Tag              B.-S. Rad. Rad. Pts. Rad. Cut. Ang. Pts.
          ---              ---------- --------- --------- ---------
          O                   0.60       70           6.0       590
          H                   0.35       60           7.0       590
          Grid pruning is: on 
          Number of quadrature shells:   190
          Spatial weights used:  Erf1

          Convergence Information
          -----------------------
          Convergence aids based upon iterative change in 
          total energy or number of iterations. 
          Levelshifting, if invoked, occurs when the 
          HOMO/LUMO gap drops below (HL_TOL): 1.00D-02
          DIIS, if invoked, will attempt to extrapolate 
          using up to (NFOCK): 10 stored Fock matrices.

                    Damping( 0%)  Levelshifting(0.5)       DIIS
                  --------------- ------------------- ---------------
          dE  on:    start            ASAP                start   
          dE off:    2 iters         30 iters            30 iters 


      Screening Tolerance Information
      -------------------------------
          Density screening/tol_rho: 1.00D-11
          AO Gaussian exp screening on grid/accAOfunc:  16
          CD Gaussian exp screening on grid/accCDfunc:  20
          XC Gaussian exp screening on grid/accXCfunc:  20
          Schwarz screening/accCoul: 1.00D-08


 Loading old vectors from job with title :



   Time after variat. SCF:      3.6

      3 Center 2 Electron Integral Information
      ----------------------------------------
          Maximum number of 3-center 2e- integrals is:          248936.
            This is reduced with Schwarz screening to:          168054.
            Incore requires a per proc buffer size of:           75118.
                  The minimum integral buffer size is:            7252
          Minimum dble words available (all nodes) is:        26212820
                   This is reduced (for later use) to:        25762833
                             Suggested buffer size is:           75118

           0.075 MW buffer allocated for incore 3-center 
          2e- integral storage on stack. 
          The percent of 3c 2e- integrals held in-core is: 100.00

   Time prior to 1st pass:      3.6

 Integral file          = ./h2o.aoints.0
 Record size in doubles =  65536        No. of integs per rec  =  43688
 Max. records in memory =     13        Max. records in file   =  17015
 No. of bits per label  =      8        No. of bits per value  =     64


 #quartets = 3.213D+04 #integrals = 7.484D+05 #direct =  0.0% #cached =100.0%


File balance: exchanges=     3  moved=     4  time=   0.0


 Grid_pts file          = ./h2o.gridpts.0
 Record size in doubles =  12289        No. of grid_pts per rec  =   3070
 Max. records in memory =     12        Max. recs in file   =     90747


           Memory utilization after 1st SCF pass: 
           Heap Space remaining (MW):       12.11            12106580
          Stack Space remaining (MW):       13.03            13031484

   convergence    iter        energy       DeltaE   RMS-Dens  Diis-err    time
 ---------------- ----- ----------------- --------- --------- ---------  ------
 d= 0,ls=0.0,diis     1    -75.2185510875 -8.43D+01  1.52D-07  3.57D-11     4.5
 d= 0,ls=0.0,diis     2    -75.2185510875 -1.59D-11  8.36D-08  7.52D-12     4.8


         Total DFT energy =      -75.218551087499
      One electron energy =     -122.612233007621
           Coulomb energy =       46.290151606645
    Exchange-Corr. energy =       -8.015486310360
 Nuclear repulsion energy =        9.119016623837

 Numeric. integr. density =       10.000000185411

     Total iterative time =      1.2s



                       DFT Final Molecular Orbital Analysis
                       ------------------------------------

 Vector    1  Occ=2.000000D+00  E=-1.866226D+01
              MO Center= -2.5D-10,  1.2D-01,  2.1D-15, r^2= 1.5D-02
   Bfn.  Coefficient  Atom+Function         Bfn.  Coefficient  Atom+Function  
  ----- ------------  ---------------      ----- ------------  ---------------
     1      0.949623  1 O  s          

 Vector    2  Occ=2.000000D+00  E=-1.144985D+00
              MO Center= -5.9D-07, -8.8D-02,  6.2D-12, r^2= 5.3D-01
   Bfn.  Coefficient  Atom+Function         Bfn.  Coefficient  Atom+Function  
  ----- ------------  ---------------      ----- ------------  ---------------
     2      0.468703  1 O  s                  4      0.290600  1 O  s          

 Vector    3  Occ=2.000000D+00  E=-6.517715D-01
              MO Center=  5.0D-07, -9.5D-02, -9.9D-12, r^2= 7.9D-01
   Bfn.  Coefficient  Atom+Function         Bfn.  Coefficient  Atom+Function  
  ----- ------------  ---------------      ----- ------------  ---------------
     8      0.322314  1 O  px                 5      0.299154  1 O  px         
    32      0.214029  2 H  s                 46     -0.214029  3 H  s          
    11      0.163777  1 O  px         

 Vector    4  Occ=2.000000D+00  E=-5.128500D-01
              MO Center=  2.2D-07,  2.0D-01, -5.6D-12, r^2= 7.1D-01
   Bfn.  Coefficient  Atom+Function         Bfn.  Coefficient  Atom+Function  
  ----- ------------  ---------------      ----- ------------  ---------------
     9      0.354081  1 O  py                 6      0.322518  1 O  py         
    12      0.310242  1 O  py                 4      0.283098  1 O  s          
     2      0.185063  1 O  s          

 Vector    5  Occ=2.000000D+00  E=-4.401856D-01
              MO Center= -5.4D-08,  8.1D-02,  6.2D-12, r^2= 6.6D-01
   Bfn.  Coefficient  Atom+Function         Bfn.  Coefficient  Atom+Function  
  ----- ------------  ---------------      ----- ------------  ---------------
    10      0.410772  1 O  pz                13      0.404253  1 O  pz         
     7      0.365547  1 O  pz         

 Vector    6  Occ=0.000000D+00  E= 1.105884D-01
              MO Center=  2.4D-06, -6.4D-01, -2.2D-11, r^2= 3.6D+00
   Bfn.  Coefficient  Atom+Function         Bfn.  Coefficient  Atom+Function  
  ----- ------------  ---------------      ----- ------------  ---------------
     4      1.447214  1 O  s                 33     -0.891467  2 H  s          
    47     -0.891464  3 H  s                 12     -0.427168  1 O  py         
    32     -0.259699  2 H  s                 46     -0.259700  3 H  s          
     9     -0.196087  1 O  py         

 Vector    7  Occ=0.000000D+00  E= 1.753989D-01
              MO Center= -3.6D-06, -6.8D-01, -2.5D-11, r^2= 4.4D+00
   Bfn.  Coefficient  Atom+Function         Bfn.  Coefficient  Atom+Function  
  ----- ------------  ---------------      ----- ------------  ---------------
    33      1.689895  2 H  s                 47     -1.689898  3 H  s          
    11     -0.801656  1 O  px                 8     -0.217140  1 O  px         
     5     -0.166743  1 O  px         

 Vector    8  Occ=0.000000D+00  E= 4.875535D-01
              MO Center=  8.1D-06, -8.6D-02, -3.3D-12, r^2= 2.3D+00
   Bfn.  Coefficient  Atom+Function         Bfn.  Coefficient  Atom+Function  
  ----- ------------  ---------------      ----- ------------  ---------------
    32      1.451171  2 H  s                 46     -1.451164  3 H  s          
    11     -1.061932  1 O  px                33     -0.717257  2 H  s          
    47      0.717248  3 H  s                  8     -0.264800  1 O  px         

 Vector    9  Occ=0.000000D+00  E= 5.439155D-01
              MO Center= -5.3D-06, -5.4D-01, -5.9D-12, r^2= 2.1D+00
   Bfn.  Coefficient  Atom+Function         Bfn.  Coefficient  Atom+Function  
  ----- ------------  ---------------      ----- ------------  ---------------
    32      1.152801  2 H  s                 46      1.152823  3 H  s          
    33     -0.651247  2 H  s                 47     -0.651251  3 H  s          
    12      0.343688  1 O  py                37      0.285463  2 H  px         
    51     -0.285462  3 H  px                 2     -0.197948  1 O  s          
     4     -0.190736  1 O  s                  9      0.176224  1 O  py         

 Vector   10  Occ=0.000000D+00  E= 6.127501D-01
              MO Center= -2.5D-07,  3.4D-01, -1.2D-11, r^2= 2.2D+00
   Bfn.  Coefficient  Atom+Function         Bfn.  Coefficient  Atom+Function  
  ----- ------------  ---------------      ----- ------------  ---------------
     4      4.363492  1 O  s                 12     -2.579096  1 O  py         
    32     -2.270193  2 H  s                 46     -2.270199  3 H  s          
    37      0.818133  2 H  px                51     -0.818137  3 H  px         
    38     -0.623861  2 H  py                52     -0.623861  3 H  py         
    33     -0.395408  2 H  s                 47     -0.395412  3 H  s          

 Vector   11  Occ=0.000000D+00  E= 7.194694D-01
              MO Center=  1.9D-06,  7.0D-02,  2.7D-11, r^2= 1.7D+00
   Bfn.  Coefficient  Atom+Function         Bfn.  Coefficient  Atom+Function  
  ----- ------------  ---------------      ----- ------------  ---------------
    13      1.108916  1 O  pz                10     -0.757332  1 O  pz         
     7     -0.291593  1 O  pz         

 Vector   12  Occ=0.000000D+00  E= 7.367170D-01
              MO Center= -1.6D-06,  1.1D-01, -1.2D-11, r^2= 3.0D+00
   Bfn.  Coefficient  Atom+Function         Bfn.  Coefficient  Atom+Function  
  ----- ------------  ---------------      ----- ------------  ---------------
    11      2.906548  1 O  px                32     -1.567135  2 H  s          
    46      1.567144  3 H  s                 33     -1.432429  2 H  s          
    47      1.432430  3 H  s                 37      0.840205  2 H  px         
    51      0.840211  3 H  px                38     -0.672078  2 H  py         
    52      0.672072  3 H  py                19     -0.435588  1 O  d -2       

 Vector   13  Occ=0.000000D+00  E= 7.388084D-01
              MO Center= -1.2D-07, -1.5D-01,  4.4D-11, r^2= 2.0D+00
   Bfn.  Coefficient  Atom+Function         Bfn.  Coefficient  Atom+Function  
  ----- ------------  ---------------      ----- ------------  ---------------
    12      1.481639  1 O  py                32      1.109761  2 H  s          
    46      1.109752  3 H  s                  4     -1.011807  1 O  s          
    37     -0.613973  2 H  px                51      0.613966  3 H  px         
    38     -0.609460  2 H  py                52     -0.609467  3 H  py         
    33     -0.218704  2 H  s                 47     -0.218716  3 H  s          

 Vector   14  Occ=0.000000D+00  E= 8.016775D-01
              MO Center= -3.9D-07, -4.6D-01,  1.1D-10, r^2= 1.7D+00
   Bfn.  Coefficient  Atom+Function         Bfn.  Coefficient  Atom+Function  
  ----- ------------  ---------------      ----- ------------  ---------------
    39      0.835714  2 H  pz                53     -0.835713  3 H  pz         

 Vector   15  Occ=0.000000D+00  E= 8.933690D-01
              MO Center= -1.4D-06, -2.0D-01, -8.9D-11, r^2= 2.0D+00
   Bfn.  Coefficient  Atom+Function         Bfn.  Coefficient  Atom+Function  
  ----- ------------  ---------------      ----- ------------  ---------------
    13      1.162421  1 O  pz                39     -0.987665  2 H  pz         
    53     -0.987668  3 H  pz         


 center of mass
 --------------
 x =   0.00000000 y =   0.09911481 z =   0.00000000

 moments of inertia (a.u.)
 ------------------
           2.266428026031           0.000005469268           0.000000000000
           0.000005469268           4.155714155453           0.000000000000
           0.000000000000           0.000000000000           6.422142181484

     Multipole analysis of the density
     ---------------------------------

     L   x y z        total         alpha         beta         nuclear
     -   - - -        -----         -----         ----         -------
     0   0 0 0      0.000000     -5.000000     -5.000000     10.000000

     1   1 0 0      0.000000      0.000000      0.000000      0.000000
     1   0 1 0     -0.803751     -0.401876     -0.401876      0.000000
     1   0 0 1      0.000000      0.000000      0.000000      0.000000

     2   2 0 0     -3.369687     -3.746568     -3.746568      4.123448
     2   1 1 0     -0.000002      0.000002      0.000002     -0.000005
     2   1 0 1      0.000000      0.000000      0.000000      0.000000
     2   0 2 0     -4.738954     -3.382367     -3.382367      2.025780
     2   0 1 1      0.000000      0.000000      0.000000      0.000000
     2   0 0 2     -5.663806     -2.831903     -2.831903      0.000000


 Parallel integral file used      19 records with       0 large values


int_init: setting std/high accuracies to  1.0D-15  1.0D-30
  int_init: cando_txs set to always be  F
                                NWChem TDDFT Module
                                -------------------


            General Information
            -------------------
           No. of orbitals :   116
            Alpha orbitals :    58
             Beta orbitals :    58
        Alpha frozen cores :     0
         Beta frozen cores :     0
     Alpha frozen virtuals :     0
      Beta frozen virtuals :     0
         Spin multiplicity :     1
    Number of AO functions :    58
        Use of symmetry is : off
      Symmetry adaption is : off
         Schwarz screening : 0.10D-07

              XC Information
              --------------
              Hartree-Fock (Exact) Exchange   1.00          
            LC-BNL 2007 Exchange Functional   0.90 local    
       Lee-Yang-Parr Correlation Functional   1.00          
           Alpha           :  0.00
           Beta            :  1.00
           Gamma           :  0.50

             TDDFT Information
             -----------------
          Calculation type : TDDFT             
         Wavefunction type : Restricted singlets
          No. of electrons :    10
           Alpha electrons :     5
            Beta electrons :     5
              No. of roots :     5
          Max subspacesize :  5000
            Max iterations :   100
               Target root :     1
           Target symmetry : none
      Symmetry restriction : off
                 Algorithm : Disk-based multiple tensor contraction
        Davidson threshold : 0.10D-03

            Memory Information
            ------------------
          Available GA space size is         104854236 doubles
          Available MA space size is          26213292 doubles
          Length of a trial vector is          265
          Estimated peak GA usage is            151196 doubles
          Estimated peak MA usage is           1268000 doubles
          Estimated peak DRA usage is          5300000 doubles

    5 smallest eigenvalue differences (eV) 
--------------------------------------------------------
  No. Spin  Occ  Vir  Irrep   E(Occ)    E(Vir)   E(Diff)
--------------------------------------------------------
    1    1    5    6 a        -0.440     0.111    14.987
    2    1    5    7 a        -0.440     0.175    16.751
    3    1    4    6 a        -0.513     0.111    16.965
    4    1    4    7 a        -0.513     0.175    18.728
    5    1    3    6 a        -0.652     0.111    20.745
--------------------------------------------------------

  Entering Davidson iterations
  Restricted singlet excited states

  Iter   NTrls   NConv    DeltaV     DeltaE      Time   
  ----  ------  ------  ---------  ---------  --------- 
    1      5       0     0.20E+00   0.10+100        5.5
    2     15       0     0.65E-01   0.11E-01        9.2
    3     25       0     0.99E-02   0.84E-03        9.4
    4     35       0     0.17E-02   0.32E-04        9.5
    5     45       4     0.39E-03   0.11E-05        9.5
    6     47       5     0.82E-04   0.30E-07        3.5
  ----  ------  ------  ---------  ---------  --------- 
  Convergence criterion met

  Ground state a         -75.218551087499 a.u.

  ----------------------------------------------------------------------------
  Root   1 singlet a              0.282446111 a.u.                7.6858 eV 
  ----------------------------------------------------------------------------
     Transition Moments    X  0.00000   Y  0.00000   Z -0.41852
     Transition Moments   XX  0.00000  XY  0.00000  XZ  0.00000
     Transition Moments   YY  0.00000  YZ  0.12615  ZZ  0.00000
     Dipole Oscillator Strength                         0.03298

     Occ.    5  a   ---  Virt.    6  a   -0.99530 X
     Occ.    5  a   ---  Virt.    9  a    0.08611 X
  ----------------------------------------------------------------------------
  Root   2 singlet a              0.353212834 a.u.                9.6114 eV 
  ----------------------------------------------------------------------------
     Transition Moments    X  0.00000   Y  0.00000   Z  0.00000
     Transition Moments   XX  0.00000  XY  0.00000  XZ  0.44897
     Transition Moments   YY  0.00000  YZ  0.00000  ZZ  0.00000
     Dipole Oscillator Strength                         0.00000

     Occ.    5  a   ---  Virt.    7  a   -0.98435 X
     Occ.    5  a   ---  Virt.    8  a   -0.14859 X
     Occ.    5  a   ---  Virt.   12  a   -0.09344 X
  ----------------------------------------------------------------------------
  Root   3 singlet a              0.364092124 a.u.                9.9075 eV 
  ----------------------------------------------------------------------------
     Transition Moments    X  0.00000   Y  0.59424   Z  0.00000
     Transition Moments   XX -0.35356  XY  0.00000  XZ  0.00000
     Transition Moments   YY -0.37859  YZ  0.00000  ZZ -0.05062
     Dipole Oscillator Strength                         0.08571

     Occ.    3  a   ---  Virt.    7  a   -0.05561 X
     Occ.    4  a   ---  Virt.    6  a    0.99356 X
     Occ.    4  a   ---  Virt.    9  a   -0.07907 X
  ----------------------------------------------------------------------------
  Root   4 singlet a              0.439096863 a.u.               11.9484 eV 
  ----------------------------------------------------------------------------
     Transition Moments    X  0.35789   Y  0.00000   Z  0.00000
     Transition Moments   XX  0.00000  XY -0.63839  XZ  0.00000
     Transition Moments   YY  0.00000  YZ  0.00000  ZZ  0.00000
     Dipole Oscillator Strength                         0.03750

     Occ.    3  a   ---  Virt.    6  a   -0.06593 X
     Occ.    4  a   ---  Virt.    7  a    0.98921 X
     Occ.    4  a   ---  Virt.    8  a    0.07590 X
     Occ.    4  a   ---  Virt.   12  a    0.09323 X
  ----------------------------------------------------------------------------
  Root   5 singlet a              0.498122827 a.u.               13.5546 eV 
  ----------------------------------------------------------------------------
     Transition Moments    X -0.80866   Y  0.00000   Z  0.00000
     Transition Moments   XX  0.00000  XY  0.72048  XZ  0.00000
     Transition Moments   YY  0.00000  YZ  0.00000  ZZ  0.00000
     Dipole Oscillator Strength                         0.21716

     Occ.    3  a   ---  Virt.    6  a   -0.99278 X
     Occ.    3  a   ---  Virt.   10  a    0.05287 X
     Occ.    4  a   ---  Virt.    7  a   -0.07102 X
     Occ.    4  a   ---  Virt.    8  a    0.05514 X

              Target root =      1
          Target symmetry = none
      Ground state energy =    -75.218551087499
        Excitation energy =      0.282446111081
     Excited state energy =    -74.936104976417


 Task  times  cpu:       48.0s     wall:       60.0s


                                NWChem Input Module
                                -------------------


 Summary of allocated global arrays
-----------------------------------
  No active global arrays



                         GA Statistics for process    0
                         ------------------------------

       create   destroy   get      put      acc     scatter   gather  read&inc
calls: 1031     1031     4.39e+05 8.65e+04 1.55e+05  235        0     1361     
number of processes/call 1.03e+00 1.12e+00 1.09e+00 1.60e+00 0.00e+00
bytes total:             4.06e+08 2.80e+07 1.78e+08 1.58e+06 0.00e+00 1.09e+04
bytes remote:            6.67e+07 1.29e+07 4.73e+07 -2.22e+04 0.00e+00 0.00e+00
Max memory consumed for GA by this process: 977160 bytes

MA_summarize_allocated_blocks: starting scan ...
MA_summarize_allocated_blocks: scan completed: 0 heap blocks, 0 stack blocks
MA usage statistics:

	allocation statistics:
					      heap	     stack
					      ----	     -----
	current number of blocks	         0	         0
	maximum number of blocks	        26	        53
	current total bytes		         0	         0
	maximum total bytes		   8004360	  22512168
	maximum total K-bytes		      8005	     22513
	maximum total M-bytes		         9	        23


                                     CITATION
                                     --------
                Please cite the following reference when publishing
                           results obtained with NWChem:

                 M. Valiev, E.J. Bylaska, N. Govind, K. Kowalski,
              T.P. Straatsma, H.J.J. van Dam, D. Wang, J. Nieplocha,
                        E. Apra, T.L. Windus, W.A. de Jong
                 "NWChem: a comprehensive and scalable open-source
                  solution for large scale molecular simulations"
                      Comput. Phys. Commun. 181, 1477 (2010)
                           doi:10.1016/j.cpc.2010.04.018

                              AUTHORS & CONTRIBUTORS
                              ----------------------
          E. Apra, E. J. Bylaska, W. A. de Jong, N. Govind, K. Kowalski,
       T. P. Straatsma, M. Valiev, H. J. J. van Dam, D. Wang, T. L. Windus,
    J. Hammond, J. Autschbach, K. Bhaskaran-Nair, J. Brabec, K. Lopata, W. Ma,
       M. Klemm, O. Villa, F. Aquino, S. Hirata, M. T. Hackler, T. Risthaus,
       M. Malagoli, A. Marenich, A. Otero-de-la-Roza, J. Mullin, P. Nichols,
      R. Peverati, J. Pittner, Y. Zhao, P.-D. Fan, A. Fonari, R. J. Harrison,
      M. Dupuis, D. Silverstein, D. M. A. Smith, J. Nieplocha, V. Tipparaju,
    M. Krishnan, B. E. Van Kuiken, A. Vazquez-Mayagoitia, L. Jensen, M. Swart,
      Q. Wu, T. Van Voorhis, A. A. Auer, M. Nooijen, L. D. Crosby, E. Brown,
      G. Cisneros, G. I. Fann, H. Fruchtl, J. Garza, K. Hirao, R. A. Kendall,
      J. A. Nichols, K. Tsemekhman, K. Wolinski, J. Anchell, D. E. Bernholdt,
      P. Borowski, T. Clark, D. Clerc, H. Dachsel, M. J. O. Deegan, K. Dyall,
    D. Elwood, E. Glendening, M. Gutowski, A. C. Hess, J. Jaffe, B. G. Johnson,
     J. Ju, R. Kobayashi, R. Kutteh, Z. Lin, R. Littlefield, X. Long, B. Meng,
      T. Nakajima, S. Niu, L. Pollack, M. Rosing, K. Glaesemann, G. Sandrone,
      M. Stave, H. Taylor, G. Thomas, J. H. van Lenthe, A. T. Wong, Z. Zhang.

 Total times  cpu:       51.6s     wall:       66.2s
