 
Processor list
 
cu03n[175,188]
 
ARMCI configured for 2 cluster nodes. Network protocol is 'OpenIB Verbs API'.
All connections between all procs tested: SUCCESS
 argument  1 = /mscf/home/d3p852/nwchem-5.1.1/QA/tests/h2o_bnl2007_tddft/h2o.nw



============================== echo of input deck ==============================
echo
start h2o

geometry noautoz noautosym units angstrom
O        0.000000    0.119088    0.000000
H        0.759830   -0.476352    0.000000
H       -0.759830   -0.476350    0.000000
end

basis spherical
 * library cc-pvtz
end

basis "cd basis"
O  library "Ahlrichs Coulomb Fitting"
H  library "Ahlrichs Coulomb Fitting"
end

set int:acc_std 1d-15
set int:cando_txs f

dft
 xc xbnl07 0.90 lyp 1.00 hfexch 1.00
 cam 0.5 cam_alpha 0.0 cam_beta 1.0
end
task dft energy

property
 dipole
end
task dft property

tddft
 nroots 5
 notriplet
 algorithm 3
end
task tddft energy
================================================================================


                                         
                                         


              Northwest Computational Chemistry Package (NWChem) 6.0
              ------------------------------------------------------


                    Environmental Molecular Sciences Laboratory
                       Pacific Northwest National Laboratory
                                Richland, WA 99352

                              Copyright (c) 1994-2010
                       Pacific Northwest National Laboratory
                            Battelle Memorial Institute

             NWChem is an open-source computational chemistry package
                        distributed under the terms of the
                      Educational Community License (ECL) 2.0
             A copy of the license is included with this distribution
                              in the LICENSE.TXT file

                                  ACKNOWLEDGMENT
                                  --------------

            This software and its documentation were developed at the
            EMSL at Pacific Northwest National Laboratory, a multiprogram
            national laboratory, operated for the U.S. Department of Energy
            by Battelle under Contract Number DE-AC05-76RL01830. Support
            for this work was provided by the Department of Energy Office
            of Biological and Environmental Research, Office of Basic
            Energy Sciences, and the Office of Advanced Scientific Computing.


           Job information
           ---------------

    hostname      = cu3n175
    program       = /scratch/nwchem
    date          = Fri Oct 29 11:38:04 2010

    compiled      = Thu_Oct_28_07:10:53_2010
    source        = /home/scicons/user/kurt/nwchem-6.0-release-pgf90-final/
    nwchem branch = 6.0
    input         = /mscf/home/d3p852/nwchem-5.1.1/QA/tests/h2o_bnl2007_tddft/h2o.nw
    prefix        = h2o.
    data base     = ./h2o.db
    status        = startup
    nproc         =        8
    time left     =   1763s



           Memory information
           ------------------

    heap     =  104857601 doubles =    800.0 Mbytes
    stack    =  104857601 doubles =    800.0 Mbytes
    global   =  209715200 doubles =   1600.0 Mbytes (distinct from heap & stack)
    total    =  419430402 doubles =   3200.0 Mbytes
    verify   = yes
    hardfail = no 


           Directory information
           ---------------------

  0 permanent = .
  0 scratch   = .




                                NWChem Input Module
                                -------------------



 Scaling coordinates for geometry "geometry" by  1.889725989
 (inverse scale =  0.529177249)



                             Geometry "geometry" -> ""
                             -------------------------

 Output coordinates in angstroms (scale by  1.889725989 to convert to a.u.)

  No.       Tag          Charge          X              Y              Z
 ---- ---------------- ---------- -------------- -------------- --------------
    1 O                    8.0000     0.00000000     0.11908780     0.00000000
    2 H                    1.0000     0.75983000    -0.47635220     0.00000000
    3 H                    1.0000    -0.75983000    -0.47635020     0.00000000

      Atomic Mass 
      ----------- 

      O                 15.994910
      H                  1.007825


 Effective nuclear repulsion energy (a.u.)       9.1190166238

            Nuclear Dipole moment (a.u.) 
            ----------------------------
        X                 Y               Z
 ---------------- ---------------- ----------------
     0.0000000000     0.0000000000     0.0000000000


            XYZ format geometry
            -------------------
     3
 geometry
 O                     0.00000000     0.11908780     0.00000000
 H                     0.75983000    -0.47635220     0.00000000
 H                    -0.75983000    -0.47635020     0.00000000

 ==============================================================================
                                internuclear distances
 ------------------------------------------------------------------------------
       center one      |      center two      | atomic units |  angstroms
 ------------------------------------------------------------------------------
    2 H                |   1 O                |     1.82424  |     0.96534
    3 H                |   1 O                |     1.82423  |     0.96534
 ------------------------------------------------------------------------------
                         number of included internuclear distances:          2
 ==============================================================================



 ==============================================================================
                                 internuclear angles
 ------------------------------------------------------------------------------
        center 1       |       center 2       |       center 3       |  degrees
 ------------------------------------------------------------------------------
    2 H                |   1 O                |   3 H                |   103.83
 ------------------------------------------------------------------------------
                            number of included internuclear angles:          1
 ==============================================================================



  library name resolved from: environment
  library file name is: <
 /mscf/scicons/apps/nwchem-6.0.oct19//src/basis/libraries/>
  


 Summary of "ao basis" -> "" (spherical)
 ------------------------------------------------------------------------------
       Tag                 Description            Shells   Functions and Types
 ---------------- ------------------------------  ------  ---------------------
 *                          cc-pvtz                   on all atoms 


  library name resolved from: environment
  library file name is: <
 /mscf/scicons/apps/nwchem-6.0.oct19//src/basis/libraries/>
  
                      Basis "cd basis" -> "" (cartesian)
                      -----
  O (Oxygen)
  ----------
            Exponent  Coefficients 
       -------------- ---------------------------------------------------------
  1 S  9.57843253E+02  0.562496
  1 S  2.81967425E+02  1.491090
  1 S  9.01998320E+01  3.865477

  2 S  3.11382990E+01  1.000000

  3 S  1.14937320E+01  1.000000

  4 S  4.48404900E+00  1.000000

  5 S  1.82350400E+00  1.000000

  6 S  7.60903000E-01  1.000000

  7 S  3.20292000E-01  1.000000

  8 P  6.14708863E-01  1.000000

  9 P  1.47530127E+00  1.000000

 10 P  3.69562968E+00  1.000000

 11 D  7.65267200E+00  1.000000

 12 D  2.21786800E+00  1.000000

 13 D  6.82337000E-01  1.000000

 14 F  2.19178082E+00  1.000000

  H (Hydrogen)
  ------------
            Exponent  Coefficients 
       -------------- ---------------------------------------------------------
  1 S  9.30813000E+00  0.034466
  1 S  2.30671800E+00  0.122534

  2 S  7.52012000E-01  1.000000

  3 S  2.73978000E-01  1.000000

  4 P  2.03270400E+00  1.000000

  5 P  7.90252000E-01  1.000000

  6 D  2.01954800E+00  1.000000



 Summary of "cd basis" -> "" (cartesian)
 ------------------------------------------------------------------------------
       Tag                 Description            Shells   Functions and Types
 ---------------- ------------------------------  ------  ---------------------
 O                  Ahlrichs Coulomb Fitting        14       44   7s3p3d1f
 H                  Ahlrichs Coulomb Fitting         6       15   3s2p1d



                                 NWChem DFT Module
                                 -----------------


                      Basis "ao basis" -> "ao basis" (spherical)
                      -----
  O (Oxygen)
  ----------
            Exponent  Coefficients 
       -------------- ---------------------------------------------------------
  1 S  1.53300000E+04  0.000508
  1 S  2.29900000E+03  0.003929
  1 S  5.22400000E+02  0.020243
  1 S  1.47300000E+02  0.079181
  1 S  4.75500000E+01  0.230687
  1 S  1.67600000E+01  0.433118
  1 S  6.20700000E+00  0.350260
  1 S  6.88200000E-01 -0.008154

  2 S  1.53300000E+04 -0.000115
  2 S  2.29900000E+03 -0.000895
  2 S  5.22400000E+02 -0.004636
  2 S  1.47300000E+02 -0.018724
  2 S  4.75500000E+01 -0.058463
  2 S  1.67600000E+01 -0.136463
  2 S  6.20700000E+00 -0.175740
  2 S  6.88200000E-01  0.603418

  3 S  1.75200000E+00  1.000000

  4 S  2.38400000E-01  1.000000

  5 P  3.44600000E+01  0.015928
  5 P  7.74900000E+00  0.099740
  5 P  2.28000000E+00  0.310492

  6 P  7.15600000E-01  1.000000

  7 P  2.14000000E-01  1.000000

  8 D  2.31400000E+00  1.000000

  9 D  6.45000000E-01  1.000000

 10 F  1.42800000E+00  1.000000

  H (Hydrogen)
  ------------
            Exponent  Coefficients 
       -------------- ---------------------------------------------------------
  1 S  3.38700000E+01  0.006068
  1 S  5.09500000E+00  0.045308
  1 S  1.15900000E+00  0.202822

  2 S  3.25800000E-01  1.000000

  3 S  1.02700000E-01  1.000000

  4 P  1.40700000E+00  1.000000

  5 P  3.88000000E-01  1.000000

  6 D  1.05700000E+00  1.000000



 Summary of "ao basis" -> "ao basis" (spherical)
 ------------------------------------------------------------------------------
       Tag                 Description            Shells   Functions and Types
 ---------------- ------------------------------  ------  ---------------------
 O                          cc-pvtz                 10       30   4s3p2d1f
 H                          cc-pvtz                  6       14   3s2p1d



int_init: setting std/high accuracies to  1.0D-15  1.0D-30
  int_init: cando_txs set to always be   F
  Caching 1-el integrals 

            General Information
            -------------------
          SCF calculation type: DFT
          Wavefunction type:  closed shell.
          No. of atoms     :     3
          No. of electrons :    10
           Alpha electrons :     5
            Beta electrons :     5
          Charge           :     0
          Spin multiplicity:     1
          Use of symmetry is: off; symmetry adaption is: off
          Maximum number of iterations:  30
          AO basis - number of functions:    58
                     number of shells:    22
          A Charge density fitting basis will be used.
          CD basis - number of functions:    74
                     number of shells:    26
          Convergence on energy requested: 1.00D-06
          Convergence on density requested: 1.00D-05
          Convergence on gradient requested: 5.00D-04

              XC Information
              --------------
                     Hartree-Fock (Exact) Exchange  1.000          
                   LC-BNL 2007 Exchange Functional  0.900 local    
              Lee-Yang-Parr Correlation Functional  1.000          

             Grid Information
             ----------------
          Grid used for XC integration:  medium    
          Radial quadrature: Mura-Knowles        
          Angular quadrature: Lebedev. 
          Tag              B.-S. Rad. Rad. Pts. Rad. Cut. Ang. Pts.
          ---              ---------- --------- --------- ---------
          O                   0.60       49           6.0       434
          H                   0.35       45           7.0       434
          Grid pruning is: on 
          Number of quadrature shells:   139
          Spatial weights used:  Erf1

          Convergence Information
          -----------------------
          Convergence aids based upon iterative change in 
          total energy or number of iterations. 
          Levelshifting, if invoked, occurs when the 
          HOMO/LUMO gap drops below (HL_TOL): 1.00D-02
          DIIS, if invoked, will attempt to extrapolate 
          using up to (NFOCK): 10 stored Fock matrices.

                    Damping( 0%)  Levelshifting(0.5)       DIIS
                  --------------- ------------------- ---------------
          dE  on:    start            ASAP                start   
          dE off:    2 iters         30 iters            30 iters 


      Screening Tolerance Information
      -------------------------------
          Density screening/tol_rho: 1.00D-10
          AO Gaussian exp screening on grid/accAOfunc:  14
          CD Gaussian exp screening on grid/accCDfunc:  20
          XC Gaussian exp screening on grid/accXCfunc:  20
          Schwarz screening/accCoul: 1.00D-08


      Superposition of Atomic Density Guess
      -------------------------------------

 Sum of atomic energies:         -75.78028790

      Non-variational initial energy
      ------------------------------

 Total energy =     -75.930196
 1-e energy   =    -121.638497
 2-e energy   =      36.589285
 HOMO         =      -0.475368
 LUMO         =       0.064403

   Time after variat. SCF:      0.6

      3 Center 2 Electron Integral Information
      ----------------------------------------
          Maximum number of 3-center 2e- integrals is:          248936.
            This is reduced with Schwarz screening to:          132682.
            Incore requires a per proc buffer size of:           35185.
                  The minimum integral buffer size is:            3626
          Minimum dble words available (all nodes) is:       209713711
                   This is reduced (for later use) to:       209466163
                             Suggested buffer size is:           35185

           0.035 MW buffer allocated for incore 3-center 
          2e- integral storage on stack. 
          The percent of 3c 2e- integrals held in-core is: 100.00

   Time prior to 1st pass:      0.6

 Integral file          = ./h2o.aoints.0
 Record size in doubles =  65536        No. of integs per rec  =  43688
 Max. records in memory =      7        Max. records in file   = 169374
 No. of bits per label  =      8        No. of bits per value  =     64


 #quartets = 3.213D+04 #integrals = 7.488D+05 #direct =  0.0% #cached =100.0%


File balance: exchanges=     0  moved=     0  time=   0.0


 Grid_pts file          = ./h2o.gridpts.0
 Record size in doubles =  12289        No. of grid_pts per rec  =   3070
 Max. records in memory =      4        Max. recs in file   =    903262


           Memory utilization after 1st SCF pass: 
           Heap Space remaining (MW):      104.35           104348575
          Stack Space remaining (MW):      104.82           104821920

   convergence    iter        energy       DeltaE   RMS-Dens  Diis-err    time
 ---------------- ----- ----------------- --------- --------- ---------  ------
 d= 0,ls=0.0,diis     1    -75.1587502933 -8.43D+01  8.40D-03  1.37D+00     0.9
 d= 0,ls=0.0,diis     2    -75.1816571620 -2.29D-02  3.83D-03  5.03D-01     1.0
 d= 0,ls=0.0,diis     3    -75.2148811755 -3.32D-02  9.44D-04  5.15D-02     1.1
 d= 0,ls=0.0,diis     4    -75.2185416919 -3.66D-03  8.04D-05  4.79D-05     1.2
 d= 0,ls=0.0,diis     5    -75.2185499177 -8.23D-06  4.79D-05  3.72D-06     1.3
 d= 0,ls=0.0,diis     6    -75.2185513249 -1.41D-06  1.22D-05  1.11D-07     1.4
 d= 0,ls=0.0,diis     7    -75.2185513850 -6.00D-08  2.39D-06  5.21D-09     1.5


         Total DFT energy =      -75.218551384966
      One electron energy =     -122.612309252122
           Coulomb energy =       46.290238569554
    Exchange-Corr. energy =       -8.015497326235
 Nuclear repulsion energy =        9.119016623837

 Numeric. integr. density =       10.000000271268

     Total iterative time =      0.8s



                       DFT Final Molecular Orbital Analysis
                       ------------------------------------

 Vector    1  Occ=2.000000D+00  E=-1.866226D+01
              MO Center= -2.5D-10,  1.2D-01,  5.6D-18, r^2= 1.5D-02
   Bfn.  Coefficient  Atom+Function         Bfn.  Coefficient  Atom+Function  
  ----- ------------  ---------------      ----- ------------  ---------------
     1     -0.949623  1 O  s          

 Vector    2  Occ=2.000000D+00  E=-1.144984D+00
              MO Center= -5.9D-07, -8.8D-02, -3.8D-16, r^2= 5.3D-01
   Bfn.  Coefficient  Atom+Function         Bfn.  Coefficient  Atom+Function  
  ----- ------------  ---------------      ----- ------------  ---------------
     2     -0.468702  1 O  s                  4     -0.290599  1 O  s          

 Vector    3  Occ=2.000000D+00  E=-6.517707D-01
              MO Center=  5.0D-07, -9.5D-02, -3.6D-17, r^2= 7.9D-01
   Bfn.  Coefficient  Atom+Function         Bfn.  Coefficient  Atom+Function  
  ----- ------------  ---------------      ----- ------------  ---------------
     8     -0.322313  1 O  px                 5     -0.299153  1 O  px         
    46      0.214032  3 H  s                 32     -0.214031  2 H  s          
    11     -0.163775  1 O  px         

 Vector    4  Occ=2.000000D+00  E=-5.128488D-01
              MO Center=  2.2D-07,  2.0D-01, -9.2D-16, r^2= 7.1D-01
   Bfn.  Coefficient  Atom+Function         Bfn.  Coefficient  Atom+Function  
  ----- ------------  ---------------      ----- ------------  ---------------
     9     -0.354081  1 O  py                 6     -0.322517  1 O  py         
    12     -0.310242  1 O  py                 4     -0.283100  1 O  s          
     2     -0.185064  1 O  s          

 Vector    5  Occ=2.000000D+00  E=-4.401845D-01
              MO Center= -5.4D-08,  8.1D-02,  6.9D-16, r^2= 6.6D-01
   Bfn.  Coefficient  Atom+Function         Bfn.  Coefficient  Atom+Function  
  ----- ------------  ---------------      ----- ------------  ---------------
    10     -0.410772  1 O  pz                13     -0.404253  1 O  pz         
     7     -0.365547  1 O  pz         

 Vector    6  Occ=0.000000D+00  E= 1.105887D-01
              MO Center=  2.4D-06, -6.4D-01,  9.7D-17, r^2= 3.6D+00
   Bfn.  Coefficient  Atom+Function         Bfn.  Coefficient  Atom+Function  
  ----- ------------  ---------------      ----- ------------  ---------------
     4      1.447215  1 O  s                 33     -0.891467  2 H  s          
    47     -0.891464  3 H  s                 12     -0.427171  1 O  py         
    46     -0.259701  3 H  s                 32     -0.259700  2 H  s          
     9     -0.196087  1 O  py         

 Vector    7  Occ=0.000000D+00  E= 1.753992D-01
              MO Center= -3.6D-06, -6.8D-01, -1.8D-16, r^2= 4.4D+00
   Bfn.  Coefficient  Atom+Function         Bfn.  Coefficient  Atom+Function  
  ----- ------------  ---------------      ----- ------------  ---------------
    47      1.689897  3 H  s                 33     -1.689894  2 H  s          
    11      0.801653  1 O  px                 8      0.217139  1 O  px         
     5      0.166743  1 O  px         

 Vector    8  Occ=0.000000D+00  E= 4.875538D-01
              MO Center=  8.1D-06, -8.6D-02, -1.3D-16, r^2= 2.3D+00
   Bfn.  Coefficient  Atom+Function         Bfn.  Coefficient  Atom+Function  
  ----- ------------  ---------------      ----- ------------  ---------------
    32     -1.451173  2 H  s                 46      1.451166  3 H  s          
    11      1.061935  1 O  px                33      0.717256  2 H  s          
    47     -0.717246  3 H  s                  8      0.264800  1 O  px         

 Vector    9  Occ=0.000000D+00  E= 5.439160D-01
              MO Center= -5.3D-06, -5.4D-01, -3.7D-17, r^2= 2.1D+00
   Bfn.  Coefficient  Atom+Function         Bfn.  Coefficient  Atom+Function  
  ----- ------------  ---------------      ----- ------------  ---------------
    46     -1.152829  3 H  s                 32     -1.152808  2 H  s          
    47      0.651249  3 H  s                 33      0.651246  2 H  s          
    12     -0.343696  1 O  py                37     -0.285461  2 H  px         
    51      0.285459  3 H  px                 2      0.197948  1 O  s          
     4      0.190751  1 O  s                  9     -0.176224  1 O  py         

 Vector   10  Occ=0.000000D+00  E= 6.127494D-01
              MO Center= -2.5D-07,  3.4D-01,  1.9D-15, r^2= 2.2D+00
   Bfn.  Coefficient  Atom+Function         Bfn.  Coefficient  Atom+Function  
  ----- ------------  ---------------      ----- ------------  ---------------
     4      4.363507  1 O  s                 12     -2.579105  1 O  py         
    46     -2.270206  3 H  s                 32     -2.270200  2 H  s          
    51     -0.818143  3 H  px                37      0.818139  2 H  px         
    38     -0.623859  2 H  py                52     -0.623859  3 H  py         
    47     -0.395414  3 H  s                 33     -0.395409  2 H  s          

 Vector   11  Occ=0.000000D+00  E= 7.194697D-01
              MO Center=  1.9D-06,  7.0D-02, -1.6D-15, r^2= 1.7D+00
   Bfn.  Coefficient  Atom+Function         Bfn.  Coefficient  Atom+Function  
  ----- ------------  ---------------      ----- ------------  ---------------
    13      1.108918  1 O  pz                10     -0.757333  1 O  pz         
     7     -0.291592  1 O  pz         

 Vector   12  Occ=0.000000D+00  E= 7.367177D-01
              MO Center= -1.6D-06,  1.1D-01,  5.0D-15, r^2= 3.0D+00
   Bfn.  Coefficient  Atom+Function         Bfn.  Coefficient  Atom+Function  
  ----- ------------  ---------------      ----- ------------  ---------------
    11     -2.906547  1 O  px                46     -1.567143  3 H  s          
    32      1.567134  2 H  s                 47     -1.432431  3 H  s          
    33      1.432430  2 H  s                 51     -0.840211  3 H  px         
    37     -0.840205  2 H  px                38      0.672077  2 H  py         
    52     -0.672071  3 H  py                19      0.435588  1 O  d -2       

 Vector   13  Occ=0.000000D+00  E= 7.388083D-01
              MO Center= -1.2D-07, -1.5D-01, -7.7D-16, r^2= 2.0D+00
   Bfn.  Coefficient  Atom+Function         Bfn.  Coefficient  Atom+Function  
  ----- ------------  ---------------      ----- ------------  ---------------
    12     -1.481631  1 O  py                32     -1.109757  2 H  s          
    46     -1.109749  3 H  s                  4      1.011800  1 O  s          
    37      0.613972  2 H  px                51     -0.613965  3 H  px         
    52      0.609468  3 H  py                38      0.609462  2 H  py         
    47      0.218718  3 H  s                 33      0.218706  2 H  s          

 Vector   14  Occ=0.000000D+00  E= 8.016778D-01
              MO Center= -3.9D-07, -4.6D-01, -5.8D-15, r^2= 1.7D+00
   Bfn.  Coefficient  Atom+Function         Bfn.  Coefficient  Atom+Function  
  ----- ------------  ---------------      ----- ------------  ---------------
    39     -0.835715  2 H  pz                53      0.835713  3 H  pz         

 Vector   15  Occ=0.000000D+00  E= 8.933690D-01
              MO Center= -1.4D-06, -2.0D-01, -1.5D-14, r^2= 2.0D+00
   Bfn.  Coefficient  Atom+Function         Bfn.  Coefficient  Atom+Function  
  ----- ------------  ---------------      ----- ------------  ---------------
    13     -1.162420  1 O  pz                53      0.987669  3 H  pz         
    39      0.987666  2 H  pz         


 center of mass
 --------------
 x =   0.00000000 y =   0.09911481 z =   0.00000000

 moments of inertia (a.u.)
 ------------------
           2.266428026031           0.000005469268           0.000000000000
           0.000005469268           4.155714155453           0.000000000000
           0.000000000000           0.000000000000           6.422142181484

     Multipole analysis of the density
     ---------------------------------

     L   x y z        total         alpha         beta         nuclear
     -   - - -        -----         -----         ----         -------
     0   0 0 0      0.000000     -5.000000     -5.000000     10.000000

     1   1 0 0      0.000000      0.000000      0.000000      0.000000
     1   0 1 0     -0.803749     -0.401875     -0.401875      0.000000
     1   0 0 1      0.000000      0.000000      0.000000      0.000000

     2   2 0 0     -3.369692     -3.746570     -3.746570      4.123448
     2   1 1 0     -0.000002      0.000002      0.000002     -0.000005
     2   1 0 1      0.000000      0.000000      0.000000      0.000000
     2   0 2 0     -4.738961     -3.382370     -3.382370      2.025780
     2   0 1 1      0.000000      0.000000      0.000000      0.000000
     2   0 0 2     -5.663809     -2.831904     -2.831904      0.000000


 Parallel integral file used      23 records with       0 large values


 Task  times  cpu:        1.0s     wall:        1.2s


                                NWChem Input Module
                                -------------------


                              NWChem Property Module
                              ----------------------



                                 NWChem DFT Module
                                 -----------------



int_init: setting std/high accuracies to  1.0D-15  1.0D-30
  int_init: cando_txs set to always be   F
  Caching 1-el integrals 

            General Information
            -------------------
          SCF calculation type: DFT
          Wavefunction type:  closed shell.
          No. of atoms     :     3
          No. of electrons :    10
           Alpha electrons :     5
            Beta electrons :     5
          Charge           :     0
          Spin multiplicity:     1
          Use of symmetry is: off; symmetry adaption is: off
          Maximum number of iterations:  30
          AO basis - number of functions:    58
                     number of shells:    22
          A Charge density fitting basis will be used.
          CD basis - number of functions:    74
                     number of shells:    26
          Convergence on energy requested: 1.00D-07
          Convergence on density requested: 1.00D-05
          Convergence on gradient requested: 1.00D-06

              XC Information
              --------------
                     Hartree-Fock (Exact) Exchange  1.000          
                   LC-BNL 2007 Exchange Functional  0.900 local    
              Lee-Yang-Parr Correlation Functional  1.000          

             Grid Information
             ----------------
          Grid used for XC integration:  fine      
          Radial quadrature: Mura-Knowles        
          Angular quadrature: Lebedev. 
          Tag              B.-S. Rad. Rad. Pts. Rad. Cut. Ang. Pts.
          ---              ---------- --------- --------- ---------
          O                   0.60       70           6.0       590
          H                   0.35       60           7.0       590
          Grid pruning is: on 
          Number of quadrature shells:   190
          Spatial weights used:  Erf1

          Convergence Information
          -----------------------
          Convergence aids based upon iterative change in 
          total energy or number of iterations. 
          Levelshifting, if invoked, occurs when the 
          HOMO/LUMO gap drops below (HL_TOL): 1.00D-02
          DIIS, if invoked, will attempt to extrapolate 
          using up to (NFOCK): 10 stored Fock matrices.

                    Damping( 0%)  Levelshifting(0.5)       DIIS
                  --------------- ------------------- ---------------
          dE  on:    start            ASAP                start   
          dE off:    2 iters         30 iters            30 iters 


      Screening Tolerance Information
      -------------------------------
          Density screening/tol_rho: 1.00D-11
          AO Gaussian exp screening on grid/accAOfunc:  16
          CD Gaussian exp screening on grid/accCDfunc:  20
          XC Gaussian exp screening on grid/accXCfunc:  20
          Schwarz screening/accCoul: 1.00D-08


 Loading old vectors from job with title :



   Time after variat. SCF:      1.5

      3 Center 2 Electron Integral Information
      ----------------------------------------
          Maximum number of 3-center 2e- integrals is:          248936.
            This is reduced with Schwarz screening to:          132682.
            Incore requires a per proc buffer size of:           35185.
                  The minimum integral buffer size is:            3626
          Minimum dble words available (all nodes) is:       209713711
                   This is reduced (for later use) to:       209269611
                             Suggested buffer size is:           35185

           0.035 MW buffer allocated for incore 3-center 
          2e- integral storage on stack. 
          The percent of 3c 2e- integrals held in-core is: 100.00

   Time prior to 1st pass:      1.6

 Integral file          = ./h2o.aoints.0
 Record size in doubles =  65536        No. of integs per rec  =  43688
 Max. records in memory =      7        Max. records in file   = 169374
 No. of bits per label  =      8        No. of bits per value  =     64


 #quartets = 3.213D+04 #integrals = 7.484D+05 #direct =  0.0% #cached =100.0%


File balance: exchanges=     0  moved=     0  time=   0.0


 Grid_pts file          = ./h2o.gridpts.0
 Record size in doubles =  12289        No. of grid_pts per rec  =   3070
 Max. records in memory =      7        Max. recs in file   =    903262


           Memory utilization after 1st SCF pass: 
           Heap Space remaining (MW):      104.31           104311708
          Stack Space remaining (MW):      104.82           104821920

   convergence    iter        energy       DeltaE   RMS-Dens  Diis-err    time
 ---------------- ----- ----------------- --------- --------- ---------  ------
 d= 0,ls=0.0,diis     1    -75.2185510877 -8.43D+01  1.55D-07  8.79D-11     1.9
 d= 0,ls=0.0,diis     2    -75.2185510877 -1.07D-11  3.57D-08  5.86D-11     2.1


         Total DFT energy =      -75.218551087682
      One electron energy =     -122.612244922373
           Coulomb energy =       46.290165043611
    Exchange-Corr. energy =       -8.015487832757
 Nuclear repulsion energy =        9.119016623837

 Numeric. integr. density =       10.000000185489

     Total iterative time =      0.5s



                       DFT Final Molecular Orbital Analysis
                       ------------------------------------

 Vector    1  Occ=2.000000D+00  E=-1.866226D+01
              MO Center= -2.5D-10,  1.2D-01,  1.3D-19, r^2= 1.5D-02
   Bfn.  Coefficient  Atom+Function         Bfn.  Coefficient  Atom+Function  
  ----- ------------  ---------------      ----- ------------  ---------------
     1     -0.949623  1 O  s          

 Vector    2  Occ=2.000000D+00  E=-1.144985D+00
              MO Center= -5.9D-07, -8.8D-02, -1.7D-17, r^2= 5.3D-01
   Bfn.  Coefficient  Atom+Function         Bfn.  Coefficient  Atom+Function  
  ----- ------------  ---------------      ----- ------------  ---------------
     2     -0.468703  1 O  s                  4     -0.290600  1 O  s          

 Vector    3  Occ=2.000000D+00  E=-6.517716D-01
              MO Center=  5.0D-07, -9.5D-02, -3.7D-17, r^2= 7.9D-01
   Bfn.  Coefficient  Atom+Function         Bfn.  Coefficient  Atom+Function  
  ----- ------------  ---------------      ----- ------------  ---------------
     8      0.322313  1 O  px                 5      0.299154  1 O  px         
    46     -0.214029  3 H  s                 32      0.214029  2 H  s          
    11      0.163777  1 O  px         

 Vector    4  Occ=2.000000D+00  E=-5.128502D-01
              MO Center=  2.2D-07,  2.0D-01, -2.7D-16, r^2= 7.1D-01
   Bfn.  Coefficient  Atom+Function         Bfn.  Coefficient  Atom+Function  
  ----- ------------  ---------------      ----- ------------  ---------------
     9     -0.354081  1 O  py                 6     -0.322518  1 O  py         
    12     -0.310242  1 O  py                 4     -0.283098  1 O  s          
     2     -0.185063  1 O  s          

 Vector    5  Occ=2.000000D+00  E=-4.401858D-01
              MO Center= -5.4D-08,  8.1D-02,  7.4D-16, r^2= 6.6D-01
   Bfn.  Coefficient  Atom+Function         Bfn.  Coefficient  Atom+Function  
  ----- ------------  ---------------      ----- ------------  ---------------
    10     -0.410772  1 O  pz                13     -0.404253  1 O  pz         
     7     -0.365547  1 O  pz         

 Vector    6  Occ=0.000000D+00  E= 1.105883D-01
              MO Center=  2.4D-06, -6.4D-01,  2.4D-16, r^2= 3.6D+00
   Bfn.  Coefficient  Atom+Function         Bfn.  Coefficient  Atom+Function  
  ----- ------------  ---------------      ----- ------------  ---------------
     4      1.447213  1 O  s                 33     -0.891467  2 H  s          
    47     -0.891464  3 H  s                 12     -0.427168  1 O  py         
    46     -0.259700  3 H  s                 32     -0.259699  2 H  s          
     9     -0.196087  1 O  py         

 Vector    7  Occ=0.000000D+00  E= 1.753989D-01
              MO Center= -3.6D-06, -6.8D-01,  9.1D-17, r^2= 4.4D+00
   Bfn.  Coefficient  Atom+Function         Bfn.  Coefficient  Atom+Function  
  ----- ------------  ---------------      ----- ------------  ---------------
    47     -1.689898  3 H  s                 33      1.689895  2 H  s          
    11     -0.801655  1 O  px                 8     -0.217140  1 O  px         
     5     -0.166743  1 O  px         

 Vector    8  Occ=0.000000D+00  E= 4.875535D-01
              MO Center=  8.1D-06, -8.6D-02,  1.0D-16, r^2= 2.3D+00
   Bfn.  Coefficient  Atom+Function         Bfn.  Coefficient  Atom+Function  
  ----- ------------  ---------------      ----- ------------  ---------------
    32      1.451171  2 H  s                 46     -1.451164  3 H  s          
    11     -1.061932  1 O  px                33     -0.717257  2 H  s          
    47      0.717248  3 H  s                  8     -0.264800  1 O  px         

 Vector    9  Occ=0.000000D+00  E= 5.439155D-01
              MO Center= -5.3D-06, -5.4D-01,  2.4D-16, r^2= 2.1D+00
   Bfn.  Coefficient  Atom+Function         Bfn.  Coefficient  Atom+Function  
  ----- ------------  ---------------      ----- ------------  ---------------
    46     -1.152823  3 H  s                 32     -1.152802  2 H  s          
    47      0.651251  3 H  s                 33      0.651247  2 H  s          
    12     -0.343689  1 O  py                37     -0.285463  2 H  px         
    51      0.285461  3 H  px                 2      0.197948  1 O  s          
     4      0.190737  1 O  s                  9     -0.176224  1 O  py         

 Vector   10  Occ=0.000000D+00  E= 6.127500D-01
              MO Center= -2.5D-07,  3.4D-01,  3.3D-16, r^2= 2.2D+00
   Bfn.  Coefficient  Atom+Function         Bfn.  Coefficient  Atom+Function  
  ----- ------------  ---------------      ----- ------------  ---------------
     4     -4.363491  1 O  s                 12      2.579096  1 O  py         
    46      2.270198  3 H  s                 32      2.270193  2 H  s          
    51      0.818137  3 H  px                37     -0.818133  2 H  px         
    38      0.623861  2 H  py                52      0.623861  3 H  py         
    47      0.395412  3 H  s                 33      0.395408  2 H  s          

 Vector   11  Occ=0.000000D+00  E= 7.194693D-01
              MO Center=  1.9D-06,  7.0D-02, -8.7D-16, r^2= 1.7D+00
   Bfn.  Coefficient  Atom+Function         Bfn.  Coefficient  Atom+Function  
  ----- ------------  ---------------      ----- ------------  ---------------
    13      1.108916  1 O  pz                10     -0.757332  1 O  pz         
     7     -0.291593  1 O  pz         

 Vector   12  Occ=0.000000D+00  E= 7.367169D-01
              MO Center= -1.6D-06,  1.1D-01, -3.3D-15, r^2= 3.0D+00
   Bfn.  Coefficient  Atom+Function         Bfn.  Coefficient  Atom+Function  
  ----- ------------  ---------------      ----- ------------  ---------------
    11     -2.906548  1 O  px                46     -1.567144  3 H  s          
    32      1.567135  2 H  s                 47     -1.432430  3 H  s          
    33      1.432429  2 H  s                 51     -0.840211  3 H  px         
    37     -0.840205  2 H  px                38      0.672078  2 H  py         
    52     -0.672071  3 H  py                19      0.435588  1 O  d -2       

 Vector   13  Occ=0.000000D+00  E= 7.388084D-01
              MO Center= -1.2D-07, -1.5D-01,  1.7D-16, r^2= 2.0D+00
   Bfn.  Coefficient  Atom+Function         Bfn.  Coefficient  Atom+Function  
  ----- ------------  ---------------      ----- ------------  ---------------
    12     -1.481639  1 O  py                32     -1.109761  2 H  s          
    46     -1.109752  3 H  s                  4      1.011807  1 O  s          
    37      0.613974  2 H  px                51     -0.613966  3 H  px         
    52      0.609467  3 H  py                38      0.609460  2 H  py         
    47      0.218716  3 H  s                 33      0.218704  2 H  s          

 Vector   14  Occ=0.000000D+00  E= 8.016775D-01
              MO Center= -3.9D-07, -4.6D-01,  3.0D-15, r^2= 1.7D+00
   Bfn.  Coefficient  Atom+Function         Bfn.  Coefficient  Atom+Function  
  ----- ------------  ---------------      ----- ------------  ---------------
    39      0.835714  2 H  pz                53     -0.835713  3 H  pz         

 Vector   15  Occ=0.000000D+00  E= 8.933689D-01
              MO Center= -1.4D-06, -2.0D-01, -5.0D-16, r^2= 2.0D+00
   Bfn.  Coefficient  Atom+Function         Bfn.  Coefficient  Atom+Function  
  ----- ------------  ---------------      ----- ------------  ---------------
    13     -1.162421  1 O  pz                53      0.987668  3 H  pz         
    39      0.987665  2 H  pz         


 center of mass
 --------------
 x =   0.00000000 y =   0.09911481 z =   0.00000000

 moments of inertia (a.u.)
 ------------------
           2.266428026031           0.000005469268           0.000000000000
           0.000005469268           4.155714155453           0.000000000000
           0.000000000000           0.000000000000           6.422142181484

     Multipole analysis of the density
     ---------------------------------

     L   x y z        total         alpha         beta         nuclear
     -   - - -        -----         -----         ----         -------
     0   0 0 0      0.000000     -5.000000     -5.000000     10.000000

     1   1 0 0      0.000000      0.000000      0.000000      0.000000
     1   0 1 0     -0.803752     -0.401876     -0.401876      0.000000
     1   0 0 1      0.000000      0.000000      0.000000      0.000000

     2   2 0 0     -3.369686     -3.746567     -3.746567      4.123448
     2   1 1 0     -0.000002      0.000002      0.000002     -0.000005
     2   1 0 1      0.000000      0.000000      0.000000      0.000000
     2   0 2 0     -4.738954     -3.382367     -3.382367      2.025780
     2   0 1 1      0.000000      0.000000      0.000000      0.000000
     2   0 0 2     -5.663805     -2.831903     -2.831903      0.000000


 Parallel integral file used      22 records with       0 large values


          -------------
          Dipole Moment
          -------------

int_init: setting std/high accuracies to  1.0D-15  1.0D-30
  int_init: cando_txs set to always be   F

 Center of charge (in au) is the expansion point
         X =       0.0000000 Y =       0.0000000 Z =       0.0000000

   Dipole moment        0.8037515845 A.U.
             DMX       -0.0000002697 DMXEFC        0.0000000000
             DMY       -0.8037515845 DMYEFC        0.0000000000
             DMZ        0.0000000000 DMZEFC        0.0000000000
   -EFC- dipole         0.0000000000 A.U.
   Total dipole         0.8037515845 A.U.

   Dipole moment        2.0429481928 Debye(s)
             DMX       -0.0000006854 DMXEFC        0.0000000000
             DMY       -2.0429481928 DMYEFC        0.0000000000
             DMZ        0.0000000000 DMZEFC        0.0000000000
   -EFC- dipole         0.0000000000 DEBYE(S)
   Total dipole         2.0429481928 DEBYE(S)

 1 a.u. = 2.541766 Debyes 

 Task  times  cpu:        0.6s     wall:        0.7s


                                NWChem Input Module
                                -------------------



                                 NWChem DFT Module
                                 -----------------



int_init: setting std/high accuracies to  1.0D-15  1.0D-30
  int_init: cando_txs set to always be   F
  Caching 1-el integrals 

            General Information
            -------------------
          SCF calculation type: DFT
          Wavefunction type:  closed shell.
          No. of atoms     :     3
          No. of electrons :    10
           Alpha electrons :     5
            Beta electrons :     5
          Charge           :     0
          Spin multiplicity:     1
          Use of symmetry is: off; symmetry adaption is: off
          Maximum number of iterations:  30
          AO basis - number of functions:    58
                     number of shells:    22
          A Charge density fitting basis will be used.
          CD basis - number of functions:    74
                     number of shells:    26
          Convergence on energy requested: 1.00D-07
          Convergence on density requested: 1.00D-05
          Convergence on gradient requested: 1.00D-06

              XC Information
              --------------
                     Hartree-Fock (Exact) Exchange  1.000          
                   LC-BNL 2007 Exchange Functional  0.900 local    
              Lee-Yang-Parr Correlation Functional  1.000          

             Grid Information
             ----------------
          Grid used for XC integration:  fine      
          Radial quadrature: Mura-Knowles        
          Angular quadrature: Lebedev. 
          Tag              B.-S. Rad. Rad. Pts. Rad. Cut. Ang. Pts.
          ---              ---------- --------- --------- ---------
          O                   0.60       70           6.0       590
          H                   0.35       60           7.0       590
          Grid pruning is: on 
          Number of quadrature shells:   190
          Spatial weights used:  Erf1

          Convergence Information
          -----------------------
          Convergence aids based upon iterative change in 
          total energy or number of iterations. 
          Levelshifting, if invoked, occurs when the 
          HOMO/LUMO gap drops below (HL_TOL): 1.00D-02
          DIIS, if invoked, will attempt to extrapolate 
          using up to (NFOCK): 10 stored Fock matrices.

                    Damping( 0%)  Levelshifting(0.5)       DIIS
                  --------------- ------------------- ---------------
          dE  on:    start            ASAP                start   
          dE off:    2 iters         30 iters            30 iters 


      Screening Tolerance Information
      -------------------------------
          Density screening/tol_rho: 1.00D-11
          AO Gaussian exp screening on grid/accAOfunc:  16
          CD Gaussian exp screening on grid/accCDfunc:  20
          XC Gaussian exp screening on grid/accXCfunc:  20
          Schwarz screening/accCoul: 1.00D-08


 Loading old vectors from job with title :



   Time after variat. SCF:      2.2

      3 Center 2 Electron Integral Information
      ----------------------------------------
          Maximum number of 3-center 2e- integrals is:          248936.
            This is reduced with Schwarz screening to:          132682.
            Incore requires a per proc buffer size of:           35185.
                  The minimum integral buffer size is:            3626
          Minimum dble words available (all nodes) is:       209713711
                   This is reduced (for later use) to:       209269611
                             Suggested buffer size is:           35185

           0.035 MW buffer allocated for incore 3-center 
          2e- integral storage on stack. 
          The percent of 3c 2e- integrals held in-core is: 100.00

   Time prior to 1st pass:      2.2

 Integral file          = ./h2o.aoints.0
 Record size in doubles =  65536        No. of integs per rec  =  43688
 Max. records in memory =      7        Max. records in file   = 169374
 No. of bits per label  =      8        No. of bits per value  =     64


 #quartets = 3.213D+04 #integrals = 7.484D+05 #direct =  0.0% #cached =100.0%


File balance: exchanges=     0  moved=     0  time=   0.0


 Grid_pts file          = ./h2o.gridpts.0
 Record size in doubles =  12289        No. of grid_pts per rec  =   3070
 Max. records in memory =      7        Max. recs in file   =    903262


           Memory utilization after 1st SCF pass: 
           Heap Space remaining (MW):      104.31           104311708
          Stack Space remaining (MW):      104.82           104821920

   convergence    iter        energy       DeltaE   RMS-Dens  Diis-err    time
 ---------------- ----- ----------------- --------- --------- ---------  ------
 d= 0,ls=0.0,diis     1    -75.2185510877 -8.43D+01  2.55D-08  2.30D-12     2.7
 d= 0,ls=0.0,diis     2    -75.2185510877 -6.11D-13  6.44D-09  1.46D-12     2.9


         Total DFT energy =      -75.218551087687
      One electron energy =     -122.612233353025
           Coulomb energy =       46.290151975967
    Exchange-Corr. energy =       -8.015486334466
 Nuclear repulsion energy =        9.119016623837

 Numeric. integr. density =       10.000000185496

     Total iterative time =      0.7s



                       DFT Final Molecular Orbital Analysis
                       ------------------------------------

 Vector    1  Occ=2.000000D+00  E=-1.866226D+01
              MO Center= -2.5D-10,  1.2D-01,  5.6D-16, r^2= 1.5D-02
   Bfn.  Coefficient  Atom+Function         Bfn.  Coefficient  Atom+Function  
  ----- ------------  ---------------      ----- ------------  ---------------
     1      0.949623  1 O  s          

 Vector    2  Occ=2.000000D+00  E=-1.144985D+00
              MO Center= -5.9D-07, -8.8D-02,  5.0D-13, r^2= 5.3D-01
   Bfn.  Coefficient  Atom+Function         Bfn.  Coefficient  Atom+Function  
  ----- ------------  ---------------      ----- ------------  ---------------
     2      0.468703  1 O  s                  4      0.290600  1 O  s          

 Vector    3  Occ=2.000000D+00  E=-6.517717D-01
              MO Center=  5.0D-07, -9.5D-02, -4.0D-14, r^2= 7.9D-01
   Bfn.  Coefficient  Atom+Function         Bfn.  Coefficient  Atom+Function  
  ----- ------------  ---------------      ----- ------------  ---------------
     8     -0.322314  1 O  px                 5     -0.299154  1 O  px         
    46      0.214029  3 H  s                 32     -0.214029  2 H  s          
    11     -0.163777  1 O  px         

 Vector    4  Occ=2.000000D+00  E=-5.128503D-01
              MO Center=  2.2D-07,  2.0D-01, -1.4D-13, r^2= 7.1D-01
   Bfn.  Coefficient  Atom+Function         Bfn.  Coefficient  Atom+Function  
  ----- ------------  ---------------      ----- ------------  ---------------
     9     -0.354082  1 O  py                 6     -0.322518  1 O  py         
    12     -0.310242  1 O  py                 4     -0.283098  1 O  s          
     2     -0.185063  1 O  s          

 Vector    5  Occ=2.000000D+00  E=-4.401859D-01
              MO Center= -5.4D-08,  8.1D-02, -1.3D-12, r^2= 6.6D-01
   Bfn.  Coefficient  Atom+Function         Bfn.  Coefficient  Atom+Function  
  ----- ------------  ---------------      ----- ------------  ---------------
    10      0.410772  1 O  pz                13      0.404253  1 O  pz         
     7      0.365547  1 O  pz         

 Vector    6  Occ=0.000000D+00  E= 1.105883D-01
              MO Center=  2.4D-06, -6.4D-01, -1.2D-12, r^2= 3.6D+00
   Bfn.  Coefficient  Atom+Function         Bfn.  Coefficient  Atom+Function  
  ----- ------------  ---------------      ----- ------------  ---------------
     4      1.447213  1 O  s                 33     -0.891467  2 H  s          
    47     -0.891464  3 H  s                 12     -0.427168  1 O  py         
    46     -0.259700  3 H  s                 32     -0.259699  2 H  s          
     9     -0.196087  1 O  py         

 Vector    7  Occ=0.000000D+00  E= 1.753989D-01
              MO Center= -3.6D-06, -6.8D-01,  8.6D-13, r^2= 4.4D+00
   Bfn.  Coefficient  Atom+Function         Bfn.  Coefficient  Atom+Function  
  ----- ------------  ---------------      ----- ------------  ---------------
    47      1.689898  3 H  s                 33     -1.689895  2 H  s          
    11      0.801655  1 O  px                 8      0.217140  1 O  px         
     5      0.166743  1 O  px         

 Vector    8  Occ=0.000000D+00  E= 4.875535D-01
              MO Center=  8.1D-06, -8.6D-02,  4.4D-13, r^2= 2.3D+00
   Bfn.  Coefficient  Atom+Function         Bfn.  Coefficient  Atom+Function  
  ----- ------------  ---------------      ----- ------------  ---------------
    32     -1.451171  2 H  s                 46      1.451164  3 H  s          
    11      1.061931  1 O  px                33      0.717258  2 H  s          
    47     -0.717248  3 H  s                  8      0.264800  1 O  px         

 Vector    9  Occ=0.000000D+00  E= 5.439155D-01
              MO Center= -5.3D-06, -5.4D-01, -1.3D-12, r^2= 2.1D+00
   Bfn.  Coefficient  Atom+Function         Bfn.  Coefficient  Atom+Function  
  ----- ------------  ---------------      ----- ------------  ---------------
    46     -1.152822  3 H  s                 32     -1.152801  2 H  s          
    47      0.651251  3 H  s                 33      0.651247  2 H  s          
    12     -0.343687  1 O  py                37     -0.285463  2 H  px         
    51      0.285462  3 H  px                 2      0.197948  1 O  s          
     4      0.190735  1 O  s                  9     -0.176224  1 O  py         

 Vector   10  Occ=0.000000D+00  E= 6.127500D-01
              MO Center= -2.5D-07,  3.4D-01, -4.1D-12, r^2= 2.2D+00
   Bfn.  Coefficient  Atom+Function         Bfn.  Coefficient  Atom+Function  
  ----- ------------  ---------------      ----- ------------  ---------------
     4     -4.363491  1 O  s                 12      2.579096  1 O  py         
    46      2.270199  3 H  s                 32      2.270193  2 H  s          
    51      0.818137  3 H  px                37     -0.818133  2 H  px         
    38      0.623861  2 H  py                52      0.623861  3 H  py         
    47      0.395412  3 H  s                 33      0.395408  2 H  s          

 Vector   11  Occ=0.000000D+00  E= 7.194693D-01
              MO Center=  1.9D-06,  7.0D-02, -3.9D-12, r^2= 1.7D+00
   Bfn.  Coefficient  Atom+Function         Bfn.  Coefficient  Atom+Function  
  ----- ------------  ---------------      ----- ------------  ---------------
    13      1.108916  1 O  pz                10     -0.757332  1 O  pz         
     7     -0.291593  1 O  pz         

 Vector   12  Occ=0.000000D+00  E= 7.367169D-01
              MO Center= -1.6D-06,  1.1D-01,  1.3D-11, r^2= 3.0D+00
   Bfn.  Coefficient  Atom+Function         Bfn.  Coefficient  Atom+Function  
  ----- ------------  ---------------      ----- ------------  ---------------
    11      2.906548  1 O  px                46      1.567144  3 H  s          
    32     -1.567135  2 H  s                 47      1.432429  3 H  s          
    33     -1.432429  2 H  s                 51      0.840211  3 H  px         
    37      0.840205  2 H  px                38     -0.672077  2 H  py         
    52      0.672071  3 H  py                19     -0.435588  1 O  d -2       

 Vector   13  Occ=0.000000D+00  E= 7.388083D-01
              MO Center= -1.2D-07, -1.5D-01, -2.2D-12, r^2= 2.0D+00
   Bfn.  Coefficient  Atom+Function         Bfn.  Coefficient  Atom+Function  
  ----- ------------  ---------------      ----- ------------  ---------------
    12     -1.481639  1 O  py                32     -1.109761  2 H  s          
    46     -1.109753  3 H  s                  4      1.011808  1 O  s          
    37      0.613974  2 H  px                51     -0.613966  3 H  px         
    52      0.609467  3 H  py                38      0.609460  2 H  py         
    47      0.218716  3 H  s                 33      0.218704  2 H  s          

 Vector   14  Occ=0.000000D+00  E= 8.016775D-01
              MO Center= -3.9D-07, -4.6D-01, -1.5D-11, r^2= 1.7D+00
   Bfn.  Coefficient  Atom+Function         Bfn.  Coefficient  Atom+Function  
  ----- ------------  ---------------      ----- ------------  ---------------
    39     -0.835714  2 H  pz                53      0.835713  3 H  pz         

 Vector   15  Occ=0.000000D+00  E= 8.933689D-01
              MO Center= -1.4D-06, -2.0D-01,  1.1D-11, r^2= 2.0D+00
   Bfn.  Coefficient  Atom+Function         Bfn.  Coefficient  Atom+Function  
  ----- ------------  ---------------      ----- ------------  ---------------
    13      1.162421  1 O  pz                53     -0.987668  3 H  pz         
    39     -0.987665  2 H  pz         


 center of mass
 --------------
 x =   0.00000000 y =   0.09911481 z =   0.00000000

 moments of inertia (a.u.)
 ------------------
           2.266428026031           0.000005469268           0.000000000000
           0.000005469268           4.155714155453           0.000000000000
           0.000000000000           0.000000000000           6.422142181484

     Multipole analysis of the density
     ---------------------------------

     L   x y z        total         alpha         beta         nuclear
     -   - - -        -----         -----         ----         -------
     0   0 0 0      0.000000     -5.000000     -5.000000     10.000000

     1   1 0 0      0.000000      0.000000      0.000000      0.000000
     1   0 1 0     -0.803752     -0.401876     -0.401876      0.000000
     1   0 0 1      0.000000      0.000000      0.000000      0.000000

     2   2 0 0     -3.369685     -3.746567     -3.746567      4.123448
     2   1 1 0     -0.000002      0.000002      0.000002     -0.000005
     2   1 0 1      0.000000      0.000000      0.000000      0.000000
     2   0 2 0     -4.738953     -3.382366     -3.382366      2.025780
     2   0 1 1      0.000000      0.000000      0.000000      0.000000
     2   0 0 2     -5.663805     -2.831903     -2.831903      0.000000


 Parallel integral file used      23 records with       0 large values


int_init: setting std/high accuracies to  1.0D-15  1.0D-30
  int_init: cando_txs set to always be   F
                                NWChem TDDFT Module
                                -------------------


            General Information
            -------------------
           No. of orbitals :   116
            Alpha orbitals :    58
             Beta orbitals :    58
        Alpha frozen cores :     0
         Beta frozen cores :     0
     Alpha frozen virtuals :     0
      Beta frozen virtuals :     0
         Spin multiplicity :     1
    Number of AO functions :    58
        Use of symmetry is : off
      Symmetry adaption is : off
         Schwarz screening : 0.10D-07

              XC Information
              --------------
              Hartree-Fock (Exact) Exchange   1.00          
            LC-BNL 2007 Exchange Functional   0.90 local    
       Lee-Yang-Parr Correlation Functional   1.00          

             TDDFT Information
             -----------------
          Calculation type : TDDFT             
         Wavefunction type : Restricted singlets
          No. of electrons :    10
           Alpha electrons :     5
            Beta electrons :     5
              No. of roots :     5
          Max subspacesize :   265
            Max iterations :   100
               Target root :     1
           Target symmetry : none
      Symmetry restriction : off
                 Algorithm : Disk-based multiple tensor contraction
        Davidson threshold : 0.10D-03

            Memory Information
            ------------------
          Available GA space size is        1677718236 doubles
          Available MA space size is         209714147 doubles
          Length of a trial vector is          265
          Estimated peak GA usage is            151196 doubles
          Estimated peak MA usage is           1268000 doubles
          Estimated peak DRA usage is           280900 doubles

  Entering Davidson iterations
  Restricted singlet excited states

  Iter   NTrls   NConv    DeltaV     DeltaE      Time   
  ----  ------  ------  ---------  ---------  --------- 
    1      5       0     0.21E+00   0.10+100        2.9
    2     15       0     0.75E-01   0.11E-01        4.6
    3     25       0     0.10E-01   0.96E-03        4.8
    4     35       0     0.17E-02   0.35E-04        5.1
    5     45       4     0.37E-03   0.11E-05        5.0
    6     47       5     0.97E-04   0.31E-07        2.6
  ----  ------  ------  ---------  ---------  --------- 
  Convergence criterion met

  Ground state a      -75.218551088 a.u.

  -------------------------------------------------------
  Root  1 singlet a     0.284509346 a.u. (  7.7418965 eV)
  -------------------------------------------------------
     Transition Moments    X  0.00000   Y  0.00000   Z  0.41727
     Transition Moments   XX  0.00000  XY  0.00000  XZ  0.00000
     Transition Moments   YY  0.00000  YZ -0.12273  ZZ  0.00000
     Transition Moments  XXX  0.00000 XXY  0.00000 XXZ  1.39108
     Transition Moments  XYY  0.00000 XYZ  0.00000 XZZ  0.00000
     Transition Moments  YYY  0.00000 YYZ  1.15865 YZZ  0.00000
     Transition Moments  ZZZ  2.90318
     Dipole Oscillator Strength                          0.03302

     Occ.  5  a   ---  Virt.  6  a    0.99598 X
     Occ.  5  a   ---  Virt.  9  a    0.08178 X
  -------------------------------------------------------
  Root  2 singlet a     0.355365411 a.u. (  9.6699890 eV)
  -------------------------------------------------------
     Transition Moments    X  0.00000   Y  0.00000   Z  0.00000
     Transition Moments   XX  0.00000  XY  0.00000  XZ -0.44533
     Transition Moments   YY  0.00000  YZ  0.00000  ZZ  0.00000
     Transition Moments  XXX  0.00000 XXY  0.00000 XXZ  0.00000
     Transition Moments  XYY  0.00000 XYZ  0.40081 XZZ  0.00000
     Transition Moments  YYY  0.00000 YYZ  0.00000 YZZ  0.00000
     Transition Moments  ZZZ  0.00001
     Dipole Oscillator Strength                          0.00000

     Occ.  5  a   ---  Virt.  7  a   -0.98551 X
     Occ.  5  a   ---  Virt.  8  a   -0.14359 X
     Occ.  5  a   ---  Virt. 12  a    0.08921 X
  -------------------------------------------------------
  Root  3 singlet a     0.365819948 a.u. (  9.9544715 eV)
  -------------------------------------------------------
     Transition Moments    X  0.00000   Y -0.59055   Z  0.00000
     Transition Moments   XX  0.35060  XY  0.00000  XZ  0.00000
     Transition Moments   YY  0.37471  YZ  0.00000  ZZ  0.05598
     Transition Moments  XXX  0.00001 XXY -1.74501 XXZ  0.00000
     Transition Moments  XYY  0.00000 XYZ  0.00000 XZZ  0.00000
     Transition Moments  YYY -4.17709 YYZ  0.00000 YZZ -1.16092
     Transition Moments  ZZZ  0.00000
     Dipole Oscillator Strength                          0.08505

     Occ.  3  a   ---  Virt.  7  a    0.05478 X
     Occ.  4  a   ---  Virt.  6  a    0.99408 X
     Occ.  4  a   ---  Virt.  9  a    0.07548 X
  -------------------------------------------------------
  Root  4 singlet a     0.440990815 a.u. ( 11.9999758 eV)
  -------------------------------------------------------
     Transition Moments    X -0.34148   Y  0.00000   Z  0.00000
     Transition Moments   XX  0.00000  XY  0.62414  XZ  0.00000
     Transition Moments   YY  0.00000  YZ  0.00000  ZZ  0.00000
     Transition Moments  XXX -2.08604 XXY  0.00000 XXZ  0.00000
     Transition Moments  XYY -1.40607 XYZ  0.00000 XZZ -0.44857
     Transition Moments  YYY  0.00000 YYZ  0.00000 YZZ  0.00000
     Transition Moments  ZZZ  0.00000
     Dipole Oscillator Strength                          0.03428

     Occ.  3  a   ---  Virt.  6  a   -0.07804 X
     Occ.  4  a   ---  Virt.  7  a   -0.98904 X
     Occ.  4  a   ---  Virt.  8  a   -0.07022 X
     Occ.  4  a   ---  Virt. 12  a    0.08954 X
  -------------------------------------------------------
  Root  5 singlet a     0.500327947 a.u. ( 13.6146220 eV)
  -------------------------------------------------------
     Transition Moments    X  0.80243   Y  0.00000   Z  0.00000
     Transition Moments   XX  0.00000  XY -0.71650  XZ  0.00000
     Transition Moments   YY  0.00000  YZ  0.00000  ZZ  0.00000
     Transition Moments  XXX  6.84608 XXY -0.00001 XXZ  0.00000
     Transition Moments  XYY  2.28613 XYZ  0.00000 XZZ  1.59514
     Transition Moments  YYY -0.00001 YYZ  0.00000 YZZ  0.00000
     Transition Moments  ZZZ  0.00000
     Dipole Oscillator Strength                          0.21477

     Occ.  3  a   ---  Virt.  6  a   -0.99222 X
     Occ.  3  a   ---  Virt. 10  a   -0.05014 X
     Occ.  4  a   ---  Virt.  7  a    0.08333 X
     Occ.  4  a   ---  Virt.  8  a   -0.05781 X

              Target root =      1
          Target symmetry = none
      Ground state energy =    -75.218551087687
        Excitation energy =      0.284509346336
     Excited state energy =    -74.934041741351


 Task  times  cpu:       26.0s     wall:       28.2s


                                NWChem Input Module
                                -------------------


 Summary of allocated global arrays
-----------------------------------
  No active global arrays



                         GA Statistics for process    0
                         ------------------------------

       create   destroy   get      put      acc     scatter   gather  read&inc
calls: 6901     6901     1.74e+05 3.79e+04 8.63e+04  235        0        0     
number of processes/call 1.27e+00 4.51e+00 1.34e+00 1.60e+00 0.00e+00
bytes total:             1.89e+08 4.78e+07 1.15e+08 8.18e+05 0.00e+00 0.00e+00
bytes remote:            1.44e+08 3.72e+07 9.59e+07 -1.75e+05 0.00e+00 0.00e+00
Max memory consumed for GA by this process: 327264 bytes

MA_summarize_allocated_blocks: starting scan ...
MA_summarize_allocated_blocks: scan completed: 0 heap blocks, 0 stack blocks
MA usage statistics:

	allocation statistics:
					      heap	     stack
					      ----	     -----
	current number of blocks	         0	         0
	maximum number of blocks	        26	        51
	current total bytes		         0	         0
	maximum total bytes		   4366392	  22511880
	maximum total K-bytes		      4367	     22512
	maximum total M-bytes		         5	        23


                                     CITATION
                                     --------
                Please cite the following reference when publishing
                           results obtained with NWChem:

                 M. Valiev, E.J. Bylaska, N. Govind, K. Kowalski,
              T.P. Straatsma, H.J.J. van Dam, D. Wang, J. Nieplocha,
                        E. Apra, T.L. Windus, W.A. de Jong
                 "NWChem: a comprehensive and scalable open-source
                  solution for large scale molecular simulations"
                      Comput. Phys. Commun. 181, 1477 (2010)
                           doi:10.1016/j.cpc.2010.04.018

                              AUTHORS & CONTRIBUTORS
                              ----------------------
      E. J. Bylaska, W. A. de Jong, N. Govind, K. Kowalski, T. P. Straatsma,
     M. Valiev, H. J. J. van Dam, D. Wang, E. Apra, T. L. Windus, J. Hammond,
     J. Autschbach, P. Nichols, S. Hirata, M. T. Hackler, Y. Zhao, P.-D. Fan,
      R. J. Harrison, M. Dupuis, D. M. A. Smith, K. Glaesemann, J. Nieplocha,
      V. Tipparaju, M. Krishnan, A. Vazquez-Mayagoitia, L. Jensen, M. Swart,
      Q. Wu, T. Van Voorhis, A. A. Auer, M. Nooijen, L. D. Crosby, E. Brown,
             G. Cisneros, G. I. Fann, H. Fruchtl, J. Garza, K. Hirao,
        R. Kendall, J. A. Nichols, K. Tsemekhman, K. Wolinski, J. Anchell,
       D. Bernholdt, P. Borowski, T. Clark, D. Clerc, H. Dachsel, M. Deegan,
        K. Dyall, D. Elwood, E. Glendening, M. Gutowski, A. Hess, J. Jaffe,
        B. Johnson, J. Ju, R. Kobayashi, R. Kutteh, Z. Lin, R. Littlefield,
    X. Long, B. Meng, T. Nakajima, S. Niu, L. Pollack, M. Rosing, G. Sandrone,
       M. Stave, H. Taylor, G. Thomas, J. H. van Lenthe, A. Wong, Z. Zhang.

 Total times  cpu:       27.7s     wall:       32.0s
