 argument  1 = h2o2-response-uhf-damping.nw
 


============================== echo of input deck ==============================
echo

title "h2o2"

memory 128 mb
#memory global 73 mb stack 20 mb heap 5 mb

start h2o2

geometry units bohr nocenter
symmetry c1
#
 O     0.00000000     0.00000000     1.41178038
 O     0.12488360     0.00000000    -1.40614001
 H    -1.06625676    -1.50151179     1.65190485
 H    -0.91573670     1.50151179    -1.74142163
end

basis spherical
 * library 6-31G**
end

scf
 direct
end

charge 0

dft
 odft
 mult 1
 direct
 xc xcamb88 1.00 lyp 0.81 vwn_5 0.19 hfexch 1.00
 cam 0.33 cam_alpha 0.19 cam_beta 0.46
 tolerances tight
 grid fine
 convergence energy 1e-10
#XC slater vwn_5
# XC pbe0
# XC hfexch
# XC becke88 lyp
end

property
 aoresponse  1  0.077318
 damping 0.1
 convergence 1e-7
 bdtensor
 # orbeta
 gprime
 giao
end

set cphf:acc 1.0d-10
set cphf:maxsub 30

task dft property

tddft
  rpa
  singlet
  notriplet
  nroots 10
  cdspectrum
  thresh 1e-6
  giao
  # velocity
end

# task tddft energy


================================================================================


                                         
                                         
 
 
              Northwest Computational Chemistry Package (NWChem) 6.6
              ------------------------------------------------------
 
 
                    Environmental Molecular Sciences Laboratory
                       Pacific Northwest National Laboratory
                                Richland, WA 99352
 
                              Copyright (c) 1994-2015
                       Pacific Northwest National Laboratory
                            Battelle Memorial Institute
 
             NWChem is an open-source computational chemistry package
                        distributed under the terms of the
                      Educational Community License (ECL) 2.0
             A copy of the license is included with this distribution
                              in the LICENSE.TXT file
 
                                  ACKNOWLEDGMENT
                                  --------------

            This software and its documentation were developed at the
            EMSL at Pacific Northwest National Laboratory, a multiprogram
            national laboratory, operated for the U.S. Department of Energy
            by Battelle under Contract Number DE-AC05-76RL01830. Support
            for this work was provided by the Department of Energy Office
            of Biological and Environmental Research, Office of Basic
            Energy Sciences, and the Office of Advanced Scientific Computing.


           Job information
           ---------------

    hostname        = ja10
    program         = /home/workspace/jochena/nwchem/nwchem-svn/bin/LINUX64/nwchem
    date            = Thu Feb 18 12:38:38 2016

    compiled        = Thu_Feb_18_11:26:07_2016
    source          = /home/workspace/jochena/nwchem/nwchem-svn
    nwchem branch   = Development
    nwchem revision = 28092
    ga revision     = 10636
    input           = h2o2-response-uhf-damping.nw
    prefix          = h2o2.
    data base       = ./h2o2.db
    status          = startup
    nproc           =        2
    time left       =     -1s



           Memory information
           ------------------

    heap     =    4194302 doubles =     32.0 Mbytes
    stack    =    4194299 doubles =     32.0 Mbytes
    global   =    8388608 doubles =     64.0 Mbytes (distinct from heap & stack)
    total    =   16777209 doubles =    128.0 Mbytes
    verify   = yes
    hardfail = no 


           Directory information
           ---------------------
 
  0 permanent = .
  0 scratch   = /tmp
 
 
 
 
                                NWChem Input Module
                                -------------------
 
 
                                       h2o2
                                       ----
 Turning off AUTOSYM since
 SYMMETRY directive was detected!
 

          ------
          auto-z
          ------
 
 
                             Geometry "geometry" -> ""
                             -------------------------
 
 Output coordinates in a.u. (scale by  1.000000000 to convert to a.u.)
 
  No.       Tag          Charge          X              Y              Z
 ---- ---------------- ---------- -------------- -------------- --------------
    1 O                    8.0000     0.00000000     0.00000000     1.41178038
    2 O                    8.0000     0.12488360     0.00000000    -1.40614001
    3 H                    1.0000    -1.06625676    -1.50151179     1.65190485
    4 H                    1.0000    -0.91573670     1.50151179    -1.74142163
 
      Atomic Mass 
      ----------- 
 
      O                 15.994910
      H                  1.007825
 

 Effective nuclear repulsion energy (a.u.)      35.9572722911

            Nuclear Dipole moment (a.u.) 
            ----------------------------
        X                 Y               Z
 ---------------- ---------------- ----------------
    -0.9829246600     0.0000000000    -0.0443938200
 


                                Z-matrix (autoz)
                                -------- 

 Units are Angstrom for bonds and degrees for angles
 
      Type          Name      I     J     K     L     M      Value
      ----------- --------  ----- ----- ----- ----- ----- ----------
    1 Stretch                  1     2                       1.49264
    2 Stretch                  1     3                       0.98278
    3 Stretch                  2     4                       0.98288
    4 Bend                     1     2     4                98.94762
    5 Bend                     2     1     3                98.89289
    6 Torsion                  3     1     2     4         109.83925
 
 
            XYZ format geometry
            -------------------
     4
 geometry
 O                     0.00000000     0.00000000     0.74708206
 O                     0.06608556     0.00000000    -0.74409730
 H                    -0.56423882    -0.79456588     0.87415046
 H                    -0.48458703     0.79456588    -0.92152071
 
 ==============================================================================
                                internuclear distances
 ------------------------------------------------------------------------------
       center one      |      center two      | atomic units |       a.u.
 ------------------------------------------------------------------------------
    3 H                |   1 O                |     1.85718  |     1.85718
    4 H                |   2 O                |     1.85738  |     1.85738
 ------------------------------------------------------------------------------
                         number of included internuclear distances:          2
 ==============================================================================



  library name resolved from: environment
  library file name is: <
 /home/workspace/jochena/nwchem/nwchem-svn/src/basis/libraries/>
  


 Summary of "ao basis" -> "" (spherical)
 ------------------------------------------------------------------------------
       Tag                 Description            Shells   Functions and Types
 ---------------- ------------------------------  ------  ---------------------
 *                          6-31G**                   on all atoms 


                              NWChem Property Module
                              ----------------------
 
 
                                       h2o2
 
 
                                 NWChem DFT Module
                                 -----------------
 
 
                                       h2o2
 
 
                      Basis "ao basis" -> "ao basis" (spherical)
                      -----
  O (Oxygen)
  ----------
            Exponent  Coefficients 
       -------------- ---------------------------------------------------------
  1 S  5.48467170E+03  0.001831
  1 S  8.25234950E+02  0.013950
  1 S  1.88046960E+02  0.068445
  1 S  5.29645000E+01  0.232714
  1 S  1.68975700E+01  0.470193
  1 S  5.79963530E+00  0.358521
 
  2 S  1.55396160E+01 -0.110778
  2 S  3.59993360E+00 -0.148026
  2 S  1.01376180E+00  1.130767
 
  3 P  1.55396160E+01  0.070874
  3 P  3.59993360E+00  0.339753
  3 P  1.01376180E+00  0.727159
 
  4 S  2.70005800E-01  1.000000
 
  5 P  2.70005800E-01  1.000000
 
  6 D  8.00000000E-01  1.000000
 
  H (Hydrogen)
  ------------
            Exponent  Coefficients 
       -------------- ---------------------------------------------------------
  1 S  1.87311370E+01  0.033495
  1 S  2.82539370E+00  0.234727
  1 S  6.40121700E-01  0.813757
 
  2 S  1.61277800E-01  1.000000
 
  3 P  1.10000000E+00  1.000000
 


 Summary of "ao basis" -> "ao basis" (spherical)
 ------------------------------------------------------------------------------
       Tag                 Description            Shells   Functions and Types
 ---------------- ------------------------------  ------  ---------------------
 O                          6-31G**                  6       14   3s2p1d
 H                          6-31G**                  3        5   2s1p




 Summary of "ao basis" -> "ao basis" (spherical)
 ------------------------------------------------------------------------------
       Tag                 Description            Shells   Functions and Types
 ---------------- ------------------------------  ------  ---------------------
 O                          6-31G**                  6       14   3s2p1d
 H                          6-31G**                  3        5   2s1p


  int_init: cando_txs set to always be  F
  Caching 1-el integrals 
  itol2e modified to match energy
  convergence criterion.
  tol_rho modified to match energy
  convergence criterion.
 
            General Information
            -------------------
          SCF calculation type: DFT
          Wavefunction type:  spin polarized.
          No. of atoms     :     4
          No. of electrons :    18
           Alpha electrons :     9
            Beta electrons :     9
          Charge           :     0
          Spin multiplicity:     1
          Use of symmetry is: off; symmetry adaption is: off
          Maximum number of iterations:  30
          This is a Direct SCF calculation.
          AO basis - number of functions:    38
                     number of shells:    18
          Convergence on energy requested:  1.00D-10
          Convergence on density requested:  1.00D-05
          Convergence on gradient requested:  5.00D-04
 
              XC Information
              --------------
                     Hartree-Fock (Exact) Exchange  1.000          
                   CAM-Becke88 Exchange Functional  1.000          
                      VWN V Correlation Functional  0.190 local    
              Lee-Yang-Parr Correlation Functional  0.810          
 
           Range-Separation Parameters        
           ---------------------------
           Alpha           :  0.19
           Beta            :  0.46
           Gamma           :  0.33
           Short-Range HF  :     F
 
             Grid Information
             ----------------
          Grid used for XC integration:  fine      
          Radial quadrature: Mura-Knowles        
          Angular quadrature: Lebedev. 
          Tag              B.-S. Rad. Rad. Pts. Rad. Cut. Ang. Pts.
          ---              ---------- --------- --------- ---------
          O                   0.60       70           7.0       590
          H                   0.35       60           8.0       590
          Grid pruning is: on 
          Number of quadrature shells:   260
          Spatial weights used:  Erf1
 
          Convergence Information
          -----------------------
          Convergence aids based upon iterative change in 
          total energy or number of iterations. 
          Levelshifting, if invoked, occurs when the 
          HOMO/LUMO gap drops below (HL_TOL):  1.00D-02
          DIIS, if invoked, will attempt to extrapolate 
          using up to (NFOCK): 10 stored Fock matrices.

                    Damping( 0%)  Levelshifting(0.5)       DIIS
                  --------------- ------------------- ---------------
          dE  on:    start            ASAP                start   
          dE off:    2 iters         30 iters            30 iters 

 
      Screening Tolerance Information
      -------------------------------
          Density screening/tol_rho:  1.00D-13
          AO Gaussian exp screening on grid/accAOfunc:  23
          CD Gaussian exp screening on grid/accCDfunc:  20
          XC Gaussian exp screening on grid/accXCfunc:  20
          Schwarz screening/accCoul:  1.00D-11

 
      Superposition of Atomic Density Guess
      -------------------------------------
 
 Sum of atomic energies:        -150.50516954
 
      Non-variational initial energy
      ------------------------------

 Total energy =    -150.594795
 1-e energy   =    -278.464275
 2-e energy   =      91.912208
 HOMO         =      -0.358499
 LUMO         =      -0.027517
 
   Time after variat. SCF:      0.1
   Time prior to 1st pass:      0.1

 Grid_pts file          = /tmp/h2o2.gridpts.0
 Record size in doubles =  12289        No. of grid_pts per rec  =   3070
 Max. records in memory =     29        Max. recs in file   =     19728

  Resetting Diis

           Memory utilization after 1st SCF pass: 
           Heap Space remaining (MW):        3.84             3837302
          Stack Space remaining (MW):        4.19             4193828

   convergence    iter        energy       DeltaE   RMS-Dens  Diis-err    time
 ---------------- ----- ----------------- --------- --------- ---------  ------
 d= 0,ls=0.0,diis     1   -151.4613551505 -1.87D+02  4.13D-03  6.59D-02     0.5
                                                     4.13D-03  6.59D-02
 d= 0,ls=0.0,diis     2   -151.4857252344 -2.44D-02  6.89D-04  3.63D-03     0.9
                                                     6.89D-04  3.63D-03
 d= 0,ls=0.0,diis     3   -151.4868935792 -1.17D-03  2.44D-04  3.71D-04     1.3
                                                     2.44D-04  3.71D-04
 d= 0,ls=0.0,diis     4   -151.4870258536 -1.32D-04  5.66D-05  1.79D-05     1.6
                                                     5.66D-05  1.79D-05
 d= 0,ls=0.0,diis     5   -151.4870322495 -6.40D-06  1.82D-05  7.04D-07     2.0
                                                     1.82D-05  7.04D-07
 d= 0,ls=0.0,diis     6   -151.4870326426 -3.93D-07  3.85D-06  2.49D-08     2.4
                                                     3.85D-06  2.49D-08
 d= 0,ls=0.0,diis     7   -151.4870326595 -1.69D-08  1.60D-06  5.26D-09     2.7
                                                     1.60D-06  5.26D-09
 d= 0,ls=0.0,diis     8   -151.4870326618 -2.34D-09  1.05D-06  2.65D-09     3.1
                                                     1.05D-06  2.65D-09
 d= 0,ls=0.0,diis     9   -151.4870326633 -1.47D-09  3.41D-07  3.92D-11     3.5
                                                     3.41D-07  3.92D-11
 d= 0,ls=0.0,diis    10   -151.4870326633 -7.64D-11  1.40D-07  2.32D-12     3.8
                                                     1.40D-07  2.32D-12


         Total DFT energy =     -151.487032663349
      One electron energy =     -279.844786102762
           Coulomb energy =      110.184914202019
    Exchange-Corr. energy =      -17.784433053704
 Nuclear repulsion energy =       35.957272291098

 Numeric. integr. density =       17.999999692671

     Total iterative time =      3.7s


 
                    DFT Final Alpha Molecular Orbital Analysis
                    ------------------------------------------
 
 Vector    1  Occ=1.000000D+00  E=-1.927392D+01
              MO Center=  6.4D-03, -8.2D-05,  6.0D-01, r^2= 2.1D-01
   Bfn.  Coefficient  Atom+Function         Bfn.  Coefficient  Atom+Function  
  ----- ------------  ---------------      ----- ------------  ---------------
     1      0.944656  1 O  s                 15      0.312573  2 O  s          
 
 Vector    2  Occ=1.000000D+00  E=-1.927391D+01
              MO Center=  5.9D-02,  8.2D-05, -6.0D-01, r^2= 2.1D-01
   Bfn.  Coefficient  Atom+Function         Bfn.  Coefficient  Atom+Function  
  ----- ------------  ---------------      ----- ------------  ---------------
    15      0.944709  2 O  s                  1     -0.312734  1 O  s          
 
 Vector    3  Occ=1.000000D+00  E=-1.174843D+00
              MO Center= -5.8D-02, -6.8D-05, -2.4D-03, r^2= 8.3D-01
   Bfn.  Coefficient  Atom+Function         Bfn.  Coefficient  Atom+Function  
  ----- ------------  ---------------      ----- ------------  ---------------
     2      0.333505  1 O  s                 16      0.333443  2 O  s          
     6      0.291298  1 O  s                 20      0.291259  2 O  s          
     1     -0.150357  1 O  s                 15     -0.150331  2 O  s          
 
 Vector    4  Occ=1.000000D+00  E=-9.708991D-01
              MO Center= -1.1D-01,  5.1D-05, -5.0D-03, r^2= 1.3D+00
   Bfn.  Coefficient  Atom+Function         Bfn.  Coefficient  Atom+Function  
  ----- ------------  ---------------      ----- ------------  ---------------
     6      0.352191  1 O  s                 20     -0.352283  2 O  s          
     2      0.350209  1 O  s                 16     -0.350288  2 O  s          
     1     -0.152126  1 O  s                 15      0.152162  2 O  s          
 
 Vector    5  Occ=1.000000D+00  E=-5.807833D-01
              MO Center= -7.4D-02,  3.3D-05, -3.4D-03, r^2= 1.3D+00
   Bfn.  Coefficient  Atom+Function         Bfn.  Coefficient  Atom+Function  
  ----- ------------  ---------------      ----- ------------  ---------------
    19     -0.300479  2 O  pz                 5      0.279689  1 O  pz         
     3     -0.246416  1 O  px                17     -0.220682  2 O  px         
    29      0.178800  3 H  s                 34      0.178852  4 H  s          
     4     -0.173294  1 O  py                18      0.173246  2 O  py         
    23     -0.159744  2 O  pz         
 
 Vector    6  Occ=1.000000D+00  E=-5.485597D-01
              MO Center= -2.0D-02,  5.1D-05, -2.6D-04, r^2= 1.3D+00
   Bfn.  Coefficient  Atom+Function         Bfn.  Coefficient  Atom+Function  
  ----- ------------  ---------------      ----- ------------  ---------------
     4      0.364266  1 O  py                18      0.364146  2 O  py         
     6      0.223091  1 O  s                 20     -0.222750  2 O  s          
     8      0.212297  1 O  py                22      0.212255  2 O  py         
    29     -0.153100  3 H  s                 34      0.152974  4 H  s          
 
 Vector    7  Occ=1.000000D+00  E=-4.764127D-01
              MO Center=  1.2D-01, -9.2D-05,  5.0D-03, r^2= 1.3D+00
   Bfn.  Coefficient  Atom+Function         Bfn.  Coefficient  Atom+Function  
  ----- ------------  ---------------      ----- ------------  ---------------
     5      0.333864  1 O  pz                17      0.308309  2 O  px         
    19     -0.307807  2 O  pz                 3      0.279828  1 O  px         
     9      0.209483  1 O  pz                21      0.210326  2 O  px         
     7      0.192527  1 O  px                23     -0.191687  2 O  pz         
     6      0.172839  1 O  s                 20      0.172995  2 O  s          
 
 Vector    8  Occ=1.000000D+00  E=-3.797477D-01
              MO Center= -4.2D-02,  2.4D-06, -2.0D-03, r^2= 1.2D+00
   Bfn.  Coefficient  Atom+Function         Bfn.  Coefficient  Atom+Function  
  ----- ------------  ---------------      ----- ------------  ---------------
     4      0.403498  1 O  py                18     -0.403600  2 O  py         
     8      0.277287  1 O  py                22     -0.277354  2 O  py         
     3     -0.203864  1 O  px                17     -0.192475  2 O  px         
     7     -0.157555  1 O  px                21     -0.150161  2 O  px         
 
 Vector    9  Occ=1.000000D+00  E=-3.480711D-01
              MO Center=  6.5D-02,  1.9D-05,  2.8D-03, r^2= 1.2D+00
   Bfn.  Coefficient  Atom+Function         Bfn.  Coefficient  Atom+Function  
  ----- ------------  ---------------      ----- ------------  ---------------
     3      0.457777  1 O  px                17     -0.459090  2 O  px         
    21     -0.326591  2 O  px                 7      0.324913  1 O  px         
     4     -0.152258  1 O  py                18     -0.152210  2 O  py         
 
 Vector   10  Occ=0.000000D+00  E= 6.612857D-02
              MO Center= -7.9D-02,  4.7D-04, -3.9D-03, r^2= 1.6D+00
   Bfn.  Coefficient  Atom+Function         Bfn.  Coefficient  Atom+Function  
  ----- ------------  ---------------      ----- ------------  ---------------
     6     -0.520398  1 O  s                 20      0.521142  2 O  s          
     9      0.501495  1 O  pz                23      0.494936  2 O  pz         
     5      0.474314  1 O  pz                19      0.470503  2 O  pz         
    30      0.380727  3 H  s                 35     -0.381868  4 H  s          
     2     -0.166997  1 O  s                 16      0.167142  2 O  s          
 
 Vector   11  Occ=0.000000D+00  E= 1.195853D-01
              MO Center= -6.3D-01, -2.4D-04, -2.8D-02, r^2= 3.2D+00
   Bfn.  Coefficient  Atom+Function         Bfn.  Coefficient  Atom+Function  
  ----- ------------  ---------------      ----- ------------  ---------------
    30      1.019265  3 H  s                 35      1.018966  4 H  s          
     6     -0.625928  1 O  s                 20     -0.625322  2 O  s          
     8      0.314808  1 O  py                22     -0.314609  2 O  py         
     7      0.229553  1 O  px                21      0.223200  2 O  px         
     4      0.173994  1 O  py                18     -0.173921  2 O  py         
 
 Vector   12  Occ=0.000000D+00  E= 1.676837D-01
              MO Center= -5.3D-01, -3.1D-04, -2.3D-02, r^2= 3.1D+00
   Bfn.  Coefficient  Atom+Function         Bfn.  Coefficient  Atom+Function  
  ----- ------------  ---------------      ----- ------------  ---------------
    30      1.046909  3 H  s                 35     -1.046458  4 H  s          
     6     -0.377206  1 O  s                 20      0.376806  2 O  s          
     8      0.333071  1 O  py                22      0.332991  2 O  py         
    23     -0.324124  2 O  pz                 9     -0.303710  1 O  pz         
    19     -0.247205  2 O  pz                 7      0.241240  1 O  px         
 
 Vector   13  Occ=0.000000D+00  E= 8.088302D-01
              MO Center= -4.2D-01,  4.5D-03, -2.5D-02, r^2= 2.3D+00
   Bfn.  Coefficient  Atom+Function         Bfn.  Coefficient  Atom+Function  
  ----- ------------  ---------------      ----- ------------  ---------------
    35      0.695462  4 H  s                 30      0.690256  3 H  s          
    34     -0.631243  4 H  s                 29     -0.626174  3 H  s          
     4     -0.391194  1 O  py                18      0.391878  2 O  py         
     8      0.285652  1 O  py                22     -0.285771  2 O  py         
    20     -0.256744  2 O  s                  6     -0.252402  1 O  s          
 
 Vector   14  Occ=0.000000D+00  E= 8.228117D-01
              MO Center= -3.0D-01, -4.2D-03, -6.4D-03, r^2= 2.6D+00
   Bfn.  Coefficient  Atom+Function         Bfn.  Coefficient  Atom+Function  
  ----- ------------  ---------------      ----- ------------  ---------------
    30     -0.670433  3 H  s                 35      0.665196  4 H  s          
     6      0.623183  1 O  s                 20     -0.621297  2 O  s          
    29      0.623005  3 H  s                 34     -0.618393  4 H  s          
     9     -0.593071  1 O  pz                23     -0.576095  2 O  pz         
     5      0.286721  1 O  pz                17     -0.267587  2 O  px         
 
 Vector   15  Occ=0.000000D+00  E= 9.063921D-01
              MO Center= -3.3D-02, -2.4D-04, -1.9D-03, r^2= 2.1D+00
   Bfn.  Coefficient  Atom+Function         Bfn.  Coefficient  Atom+Function  
  ----- ------------  ---------------      ----- ------------  ---------------
    23      0.816546  2 O  pz                 9      0.802908  1 O  pz         
     8      0.441065  1 O  py                22      0.440963  2 O  py         
     4     -0.421092  1 O  py                18     -0.421169  2 O  py         
    19     -0.384640  2 O  pz                 5     -0.368513  1 O  pz         
    29      0.265918  3 H  s                 34     -0.265330  4 H  s          
 
 Vector   16  Occ=0.000000D+00  E= 9.224975D-01
              MO Center=  2.1D-01,  1.8D-04,  8.6D-03, r^2= 1.6D+00
   Bfn.  Coefficient  Atom+Function         Bfn.  Coefficient  Atom+Function  
  ----- ------------  ---------------      ----- ------------  ---------------
    17      0.647065  2 O  px                21     -0.649593  2 O  px         
     7     -0.642049  1 O  px                 3      0.637710  1 O  px         
     2      0.153915  1 O  s                 16      0.153009  2 O  s          
 
 Vector   17  Occ=0.000000D+00  E= 1.004325D+00
              MO Center=  9.9D-02,  1.1D-04,  3.1D-03, r^2= 1.9D+00
   Bfn.  Coefficient  Atom+Function         Bfn.  Coefficient  Atom+Function  
  ----- ------------  ---------------      ----- ------------  ---------------
     8      0.668479  1 O  py                22     -0.669921  2 O  py         
    23      0.551880  2 O  pz                 9     -0.527432  1 O  pz         
    19     -0.468585  2 O  pz                 5      0.458096  1 O  pz         
    18      0.313220  2 O  py                 4     -0.311622  1 O  py         
     7      0.254111  1 O  px                 6     -0.244429  1 O  s          
 
 Vector   18  Occ=0.000000D+00  E= 1.021780D+00
              MO Center= -1.4D-03, -1.9D-04,  2.7D-03, r^2= 2.5D+00
   Bfn.  Coefficient  Atom+Function         Bfn.  Coefficient  Atom+Function  
  ----- ------------  ---------------      ----- ------------  ---------------
     9      0.825644  1 O  pz                23      0.776606  2 O  pz         
    30     -0.634296  3 H  s                 35      0.633306  4 H  s          
    21     -0.550626  2 O  px                 7      0.478365  1 O  px         
     8     -0.416017  1 O  py                22     -0.412287  2 O  py         
    17      0.375867  2 O  px                 4      0.355335  1 O  py         
 
 Vector   19  Occ=0.000000D+00  E= 1.079719D+00
              MO Center=  6.2D-02,  2.4D-03,  1.2D-04, r^2= 2.2D+00
   Bfn.  Coefficient  Atom+Function         Bfn.  Coefficient  Atom+Function  
  ----- ------------  ---------------      ----- ------------  ---------------
     7      0.899188  1 O  px                21     -0.834469  2 O  px         
    23     -0.776947  2 O  pz                 9     -0.693167  1 O  pz         
     8      0.653554  1 O  py                22      0.646987  2 O  py         
    35     -0.627857  4 H  s                 30      0.622934  3 H  s          
     3     -0.439539  1 O  px                17      0.418257  2 O  px         
 
 
                     DFT Final Beta Molecular Orbital Analysis
                     -----------------------------------------
 
 Vector    1  Occ=1.000000D+00  E=-1.927392D+01
              MO Center=  6.4D-03, -8.2D-05,  6.0D-01, r^2= 2.1D-01
   Bfn.  Coefficient  Atom+Function         Bfn.  Coefficient  Atom+Function  
  ----- ------------  ---------------      ----- ------------  ---------------
     1      0.944656  1 O  s                 15      0.312573  2 O  s          
 
 Vector    2  Occ=1.000000D+00  E=-1.927391D+01
              MO Center=  5.9D-02,  8.2D-05, -6.0D-01, r^2= 2.1D-01
   Bfn.  Coefficient  Atom+Function         Bfn.  Coefficient  Atom+Function  
  ----- ------------  ---------------      ----- ------------  ---------------
    15      0.944709  2 O  s                  1     -0.312734  1 O  s          
 
 Vector    3  Occ=1.000000D+00  E=-1.174843D+00
              MO Center= -5.8D-02, -6.8D-05, -2.4D-03, r^2= 8.3D-01
   Bfn.  Coefficient  Atom+Function         Bfn.  Coefficient  Atom+Function  
  ----- ------------  ---------------      ----- ------------  ---------------
     2      0.333505  1 O  s                 16      0.333443  2 O  s          
     6      0.291298  1 O  s                 20      0.291259  2 O  s          
     1     -0.150357  1 O  s                 15     -0.150331  2 O  s          
 
 Vector    4  Occ=1.000000D+00  E=-9.708991D-01
              MO Center= -1.1D-01,  5.1D-05, -5.0D-03, r^2= 1.3D+00
   Bfn.  Coefficient  Atom+Function         Bfn.  Coefficient  Atom+Function  
  ----- ------------  ---------------      ----- ------------  ---------------
     6      0.352191  1 O  s                 20     -0.352283  2 O  s          
     2      0.350209  1 O  s                 16     -0.350288  2 O  s          
     1     -0.152126  1 O  s                 15      0.152162  2 O  s          
 
 Vector    5  Occ=1.000000D+00  E=-5.807833D-01
              MO Center= -7.4D-02,  3.3D-05, -3.4D-03, r^2= 1.3D+00
   Bfn.  Coefficient  Atom+Function         Bfn.  Coefficient  Atom+Function  
  ----- ------------  ---------------      ----- ------------  ---------------
    19     -0.300479  2 O  pz                 5      0.279689  1 O  pz         
     3     -0.246416  1 O  px                17     -0.220682  2 O  px         
    29      0.178800  3 H  s                 34      0.178852  4 H  s          
     4     -0.173294  1 O  py                18      0.173246  2 O  py         
    23     -0.159744  2 O  pz         
 
 Vector    6  Occ=1.000000D+00  E=-5.485597D-01
              MO Center= -2.0D-02,  5.1D-05, -2.6D-04, r^2= 1.3D+00
   Bfn.  Coefficient  Atom+Function         Bfn.  Coefficient  Atom+Function  
  ----- ------------  ---------------      ----- ------------  ---------------
     4      0.364266  1 O  py                18      0.364146  2 O  py         
     6      0.223091  1 O  s                 20     -0.222750  2 O  s          
     8      0.212297  1 O  py                22      0.212255  2 O  py         
    29     -0.153100  3 H  s                 34      0.152974  4 H  s          
 
 Vector    7  Occ=1.000000D+00  E=-4.764127D-01
              MO Center=  1.2D-01, -9.2D-05,  5.0D-03, r^2= 1.3D+00
   Bfn.  Coefficient  Atom+Function         Bfn.  Coefficient  Atom+Function  
  ----- ------------  ---------------      ----- ------------  ---------------
     5      0.333864  1 O  pz                17      0.308309  2 O  px         
    19     -0.307807  2 O  pz                 3      0.279828  1 O  px         
     9      0.209483  1 O  pz                21      0.210326  2 O  px         
     7      0.192527  1 O  px                23     -0.191687  2 O  pz         
     6      0.172839  1 O  s                 20      0.172995  2 O  s          
 
 Vector    8  Occ=1.000000D+00  E=-3.797477D-01
              MO Center= -4.2D-02,  2.4D-06, -2.0D-03, r^2= 1.2D+00
   Bfn.  Coefficient  Atom+Function         Bfn.  Coefficient  Atom+Function  
  ----- ------------  ---------------      ----- ------------  ---------------
     4      0.403498  1 O  py                18     -0.403600  2 O  py         
     8      0.277287  1 O  py                22     -0.277354  2 O  py         
     3     -0.203864  1 O  px                17     -0.192475  2 O  px         
     7     -0.157555  1 O  px                21     -0.150161  2 O  px         
 
 Vector    9  Occ=1.000000D+00  E=-3.480711D-01
              MO Center=  6.5D-02,  1.9D-05,  2.8D-03, r^2= 1.2D+00
   Bfn.  Coefficient  Atom+Function         Bfn.  Coefficient  Atom+Function  
  ----- ------------  ---------------      ----- ------------  ---------------
     3      0.457777  1 O  px                17     -0.459090  2 O  px         
    21     -0.326591  2 O  px                 7      0.324913  1 O  px         
     4     -0.152258  1 O  py                18     -0.152210  2 O  py         
 
 Vector   10  Occ=0.000000D+00  E= 6.612857D-02
              MO Center= -7.9D-02,  4.7D-04, -3.9D-03, r^2= 1.6D+00
   Bfn.  Coefficient  Atom+Function         Bfn.  Coefficient  Atom+Function  
  ----- ------------  ---------------      ----- ------------  ---------------
     6     -0.520398  1 O  s                 20      0.521142  2 O  s          
     9      0.501495  1 O  pz                23      0.494936  2 O  pz         
     5      0.474314  1 O  pz                19      0.470503  2 O  pz         
    30      0.380727  3 H  s                 35     -0.381868  4 H  s          
     2     -0.166997  1 O  s                 16      0.167142  2 O  s          
 
 Vector   11  Occ=0.000000D+00  E= 1.195853D-01
              MO Center= -6.3D-01, -2.4D-04, -2.8D-02, r^2= 3.2D+00
   Bfn.  Coefficient  Atom+Function         Bfn.  Coefficient  Atom+Function  
  ----- ------------  ---------------      ----- ------------  ---------------
    30      1.019265  3 H  s                 35      1.018966  4 H  s          
     6     -0.625928  1 O  s                 20     -0.625322  2 O  s          
     8      0.314808  1 O  py                22     -0.314609  2 O  py         
     7      0.229553  1 O  px                21      0.223200  2 O  px         
     4      0.173994  1 O  py                18     -0.173921  2 O  py         
 
 Vector   12  Occ=0.000000D+00  E= 1.676837D-01
              MO Center= -5.3D-01, -3.1D-04, -2.3D-02, r^2= 3.1D+00
   Bfn.  Coefficient  Atom+Function         Bfn.  Coefficient  Atom+Function  
  ----- ------------  ---------------      ----- ------------  ---------------
    30      1.046909  3 H  s                 35     -1.046458  4 H  s          
     6     -0.377206  1 O  s                 20      0.376806  2 O  s          
     8      0.333071  1 O  py                22      0.332991  2 O  py         
    23     -0.324124  2 O  pz                 9     -0.303710  1 O  pz         
    19     -0.247205  2 O  pz                 7      0.241240  1 O  px         
 
 Vector   13  Occ=0.000000D+00  E= 8.088302D-01
              MO Center= -4.2D-01,  4.5D-03, -2.5D-02, r^2= 2.3D+00
   Bfn.  Coefficient  Atom+Function         Bfn.  Coefficient  Atom+Function  
  ----- ------------  ---------------      ----- ------------  ---------------
    35      0.695462  4 H  s                 30      0.690256  3 H  s          
    34     -0.631243  4 H  s                 29     -0.626174  3 H  s          
     4     -0.391194  1 O  py                18      0.391878  2 O  py         
     8      0.285652  1 O  py                22     -0.285771  2 O  py         
    20     -0.256744  2 O  s                  6     -0.252402  1 O  s          
 
 Vector   14  Occ=0.000000D+00  E= 8.228117D-01
              MO Center= -3.0D-01, -4.2D-03, -6.4D-03, r^2= 2.6D+00
   Bfn.  Coefficient  Atom+Function         Bfn.  Coefficient  Atom+Function  
  ----- ------------  ---------------      ----- ------------  ---------------
    30     -0.670433  3 H  s                 35      0.665196  4 H  s          
     6      0.623183  1 O  s                 20     -0.621297  2 O  s          
    29      0.623005  3 H  s                 34     -0.618393  4 H  s          
     9     -0.593071  1 O  pz                23     -0.576095  2 O  pz         
     5      0.286721  1 O  pz                17     -0.267587  2 O  px         
 
 Vector   15  Occ=0.000000D+00  E= 9.063921D-01
              MO Center= -3.3D-02, -2.4D-04, -1.9D-03, r^2= 2.1D+00
   Bfn.  Coefficient  Atom+Function         Bfn.  Coefficient  Atom+Function  
  ----- ------------  ---------------      ----- ------------  ---------------
    23      0.816546  2 O  pz                 9      0.802908  1 O  pz         
     8      0.441065  1 O  py                22      0.440963  2 O  py         
     4     -0.421092  1 O  py                18     -0.421169  2 O  py         
    19     -0.384640  2 O  pz                 5     -0.368513  1 O  pz         
    29      0.265918  3 H  s                 34     -0.265330  4 H  s          
 
 Vector   16  Occ=0.000000D+00  E= 9.224975D-01
              MO Center=  2.1D-01,  1.8D-04,  8.6D-03, r^2= 1.6D+00
   Bfn.  Coefficient  Atom+Function         Bfn.  Coefficient  Atom+Function  
  ----- ------------  ---------------      ----- ------------  ---------------
    17      0.647065  2 O  px                21     -0.649593  2 O  px         
     7     -0.642049  1 O  px                 3      0.637710  1 O  px         
     2      0.153915  1 O  s                 16      0.153009  2 O  s          
 
 Vector   17  Occ=0.000000D+00  E= 1.004325D+00
              MO Center=  9.9D-02,  1.1D-04,  3.1D-03, r^2= 1.9D+00
   Bfn.  Coefficient  Atom+Function         Bfn.  Coefficient  Atom+Function  
  ----- ------------  ---------------      ----- ------------  ---------------
     8      0.668479  1 O  py                22     -0.669921  2 O  py         
    23      0.551880  2 O  pz                 9     -0.527432  1 O  pz         
    19     -0.468585  2 O  pz                 5      0.458096  1 O  pz         
    18      0.313220  2 O  py                 4     -0.311622  1 O  py         
     7      0.254111  1 O  px                 6     -0.244429  1 O  s          
 
 Vector   18  Occ=0.000000D+00  E= 1.021780D+00
              MO Center= -1.4D-03, -1.9D-04,  2.7D-03, r^2= 2.5D+00
   Bfn.  Coefficient  Atom+Function         Bfn.  Coefficient  Atom+Function  
  ----- ------------  ---------------      ----- ------------  ---------------
     9      0.825644  1 O  pz                23      0.776606  2 O  pz         
    30     -0.634296  3 H  s                 35      0.633306  4 H  s          
    21     -0.550626  2 O  px                 7      0.478365  1 O  px         
     8     -0.416017  1 O  py                22     -0.412287  2 O  py         
    17      0.375867  2 O  px                 4      0.355335  1 O  py         
 
 Vector   19  Occ=0.000000D+00  E= 1.079719D+00
              MO Center=  6.2D-02,  2.4D-03,  1.2D-04, r^2= 2.2D+00
   Bfn.  Coefficient  Atom+Function         Bfn.  Coefficient  Atom+Function  
  ----- ------------  ---------------      ----- ------------  ---------------
     7      0.899188  1 O  px                21     -0.834469  2 O  px         
    23     -0.776947  2 O  pz                 9     -0.693167  1 O  pz         
     8      0.653554  1 O  py                22      0.646987  2 O  py         
    35     -0.627857  4 H  s                 30      0.622934  3 H  s          
     3     -0.439539  1 O  px                17      0.418257  2 O  px         
 

   alpha - beta orbital overlaps 
   ----------------------------- 


   alpha      1      2      3      4      5      6      7      8      9     10
    beta      1      2      3      4      5      6      7      8      9     10
 overlap   1.000  1.000  1.000  1.000  1.000  1.000  1.000  1.000  1.000  1.000


   alpha     11     12     13     14     15     16     17     18     19     20
    beta     11     12     13     14     15     16     17     18     19     20
 overlap   1.000  1.000  1.000  1.000  1.000  1.000  1.000  1.000  1.000  1.000


   alpha     21     22     23     24     25     26     27     28     29     30
    beta     21     22     23     24     25     26     27     28     29     30
 overlap   1.000  1.000  1.000  1.000  1.000  1.000  1.000  1.000  1.000  1.000


   alpha     31     32     33     34     35     36     37     38
    beta     31     32     33     34     35     36     37     38
 overlap   1.000  1.000  1.000  1.000  1.000  1.000  1.000  1.000

     --------------------------
     Expectation value of S2:  
     --------------------------
      <S2> =     -0.0000 (Exact =     0.0000)
 

 center of mass
 --------------
 x =  -0.00000002 y =   0.00000000 z =  -0.00000000

 moments of inertia (a.u.)
 ------------------
          73.856228234860          -0.227776154541           2.976742618496
          -0.227776154541          71.552259934038           5.134989028825
           2.976742618496           5.134989028825           6.784749349832
 
     Multipole analysis of the density
     ---------------------------------
 
     L   x y z        total         alpha         beta         nuclear
     -   - - -        -----         -----         ----         -------
     0   0 0 0     -0.000000     -9.000000     -9.000000     18.000000
 
     1   1 0 0     -0.790758      0.096083      0.096083     -0.982925
     1   0 1 0      0.000019      0.000010      0.000010      0.000000
     1   0 0 1     -0.035488      0.004453      0.004453     -0.044394
 
     2   2 0 0     -8.290826     -5.195535     -5.195535      2.100244
     2   1 1 0      0.095521     -0.065243     -0.065243      0.226008
     2   1 0 1     -0.003663      0.783919      0.783919     -1.571502
     2   0 2 0     -7.003007     -5.756041     -5.756041      4.509075
     2   0 1 1     -2.150424      1.472348      1.472348     -5.095120
     2   0 0 2     -8.193099    -22.858633    -22.858633     37.524167
 
 *** CALLING NEW AORESP DRIVER FOR CLOSED AND OPEN SHELLS ***
 Entering AOResponse driver routine


--------------------------------------------------------------------------------

          ****************
          *** RESPONSE ***
          ****************

 Response module for NWChem and dynamic CPKS solver
 developed by J. Autschbach and coworkers, SUNY Buffalo
 The methodology used in this program is described in 
 ChemPhysChem 12 (2011), 3224-3235 (main reference)
 J. Chem. Phys. 123 (2005), 114103
 J. Chem. Phys. 122 (2005), 224115
 J. Chem. Phys. 122 (2005), 074105
 Comp. Lett. 3 (2007), 131-150 (contact JA for a copy)
 Please cite this work in publications based on results
 obtained with this code. Thank you!

 For extension of response module to open shell
 calculations please acknowledge:
 F. Aquino, Northwestern University, Schatz Rsrch Group
 The update to the methodology is described in
 J. Phys. Chem. A 118 (2014) 517-525



          -----------------------------------------------
          Solving response equations for perturbing field
          -----------------------------------------------

 number of frequencies:     1
 frequency in a.u.:  0.7731800E-01
 Perturbing field: electric
 Using GIAO formalism for OptRot
 Adding quadrupole terms to OptRot
 to create an origin in dependent tensor.
 Using El. Dipole Length Gauge
 
 Applying DAMPING constant of  0.100000 a.u.
 
 Setting up CPKS
 with frequency omega =      0.07731800 a.u.
 and a damping of            0.10000000 a.u.

  int_init: cando_txs set to always be  F
 
                            NWChem Dynamic CPHF Module
                            --------------------------
 
 
  int_init: cando_txs set to always be  F
    scftype = UHF 
     nalpha =    9
      nbeta =    9
  variables =     2088
  num. vecs =        3
  tolerance =   1.0D-07
  max. iter =   50

 SCF residual:   5.427700426427768E-007


Iterative solution of linear equations
  No. of variables     1044
  No. of equations        3
  Maximum subspace       30
       Convergence  1.0D-07
        Start time      4.3


   iter   nsub   residual    time 
   ----  ------  --------  --------- 
 dft_CPHF2_read: failed to open./h2o2.aoresp_fiao_f1
     1      3    2.93D+00       7.4
     2      6    1.55D+00      10.6
     3      9    1.48D-01      13.8
     4     12    4.16D-02      17.0
     5     15    1.19D-02      20.2
     6     18    2.74D-03      23.4
     7     21    8.87D-04      26.6
     8     24    3.05D-04      29.8
     9     27    1.06D-04      33.0
    10     27    2.53D-05      36.1
    11     27    8.97D-06      39.3
    12     27    2.07D-06      42.5
    13     27    4.80D-07      45.8
    14     27    1.19D-07      51.3
    15     27    7.90D-08      57.1
  int_init: cando_txs set to always be  F

 Calculating some arrays needed for GIAO optical rotation

  int_init: cando_txs set to always be  F
 dip-quad polarizability Re:

              1        2        3        4        5        6      
    1   -2.7102  -0.3468   0.0573  -4.9451   5.5541  -1.4976
    2   -0.5166  -5.1926   5.8186   0.0012  -0.2357   0.5253
    3    0.1042   2.2570  -2.5404  -0.2234   0.3527  -0.2960
 traceless dip-quad polarizability:

              1        2        3      
    1    0.5111  -0.5202   0.0860
    2   -0.5202  -2.8412   8.3311
    3    0.0860   8.3311   2.3300

              1        2        3      
    1   -0.7798  -7.7889   8.7279
    2   -7.7889  -0.0031  -0.3535
    3    8.7279  -0.3535   0.7829

              1        2        3      
    1    0.3639   3.3855  -3.8106
    2    3.3855  -0.1274   0.5291
    3   -3.8106   0.5291  -0.2364

 Electric Dipole Response Matrix (nonzero elements):

              1        2        3      
    1    6.5996   0.1002  -0.3471
    2    0.1002   9.0475  -2.2666
    3   -0.3471  -2.2666  14.4543
 
 Imaginary part:

              1        2        3      
    1    0.1931   0.0077  -0.0256
    2    0.0077   0.3350  -0.1764
    3   -0.0256  -0.1764   0.7716

 ------------------------------------------
 average:        10.03379 + I       0.43325


 DFT Linear Response polarizability / au 
 Frequency  =       0.0773180 / au
 Wavelength =     589.2981324 / nm
              X              Y              Z
 -----------------------------------------------
 X       6.5996241      0.1002110     -0.3471380
 Y       0.1002109      9.0474909     -2.2665946
 Z      -0.3471380     -2.2665946     14.4542601
 -----------------------------------------------
 Eigenvalues =       6.5843120      8.2233888     15.2936743
 Isotropic   =      10.0337917
 Anisotropic =       6.5454437
 -----------------------------------------------

 Magnetic Dipole Response Matrix (nonzero elements):
 Optical rotation tensor G' 
 (Buckingham-Dunn version including dipole-quadrupole terms)

              1        2        3      
    1    0.0487  -0.0047   0.0013
    2   -0.0047  -0.0892   0.1064
    3    0.0013   0.1064   0.0213
 
 Imaginary part:

              1        2        3      
    1    0.1780  -0.0102   0.0072
    2   -0.0023  -0.2168   0.0069
    3    0.0055   0.1966   0.0152

 ------------------------------------------
 average:        -0.00642 + I      -0.00786

 OR Beta:         0.08303 + I       0.10170

 Principal components and PAS (Real part)
                 -0.15399
                  0.08602
                  0.04871
 ------------------------
 average:        -0.00642

              1        2        3      
    1    0.0231  -0.0370   0.9990
    2    0.8545   0.5194  -0.0005
    3   -0.5189   0.8537   0.0437

 Chiral response tensor (Real part):

              1        2        3      
    1   -0.0340   0.0024  -0.0006
    2    0.0024   0.0350  -0.0532
    3   -0.0006  -0.0532  -0.0203
 
 Principal components and PAS (Real part)
                  0.06737
                 -0.05264
                 -0.03399
 ------------------------
 average:        -0.00642

              1        2        3      
    1    0.0231  -0.0370   0.9990
    2    0.8545   0.5194  -0.0005
    3   -0.5189   0.8537   0.0437
 Exiting AOResponse driver routine

 Task  times  cpu:       61.7s     wall:       62.0s
 
 
                                NWChem Input Module
                                -------------------
 
 
 Summary of allocated global arrays
-----------------------------------
  array 0 => double precision density matrix(38,38),  handle: -976 
  array 1 => double precision tmp(38,38),  handle: -973 
  array 2 => double precision tmp(38,38),  handle: -972 
  array 3 => double precision tmp(38,38),  handle: -971 



                         GA Statistics for process    0
                         ------------------------------

       create   destroy   get      put      acc     scatter   gather  read&inc
calls: 6915     6911     1.75e+06 1.98e+06 4.47e+05 7583        0     1995     
number of processes/call 1.05e+00 1.04e+00 1.14e+00 0.00e+00 0.00e+00
bytes total:             1.02e+09 1.17e+08 5.44e+08 1.52e+02 0.00e+00 1.60e+04
bytes remote:            3.85e+07 2.14e+07 9.69e+07 0.00e+00 0.00e+00 0.00e+00
Max memory consumed for GA by this process: 3224168 bytes
 
MA_summarize_allocated_blocks: starting scan ...
MA_summarize_allocated_blocks: scan completed: 0 heap blocks, 0 stack blocks
MA usage statistics:

	allocation statistics:
					      heap	     stack
					      ----	     -----
	current number of blocks	         0	         0
	maximum number of blocks	        21	        51
	current total bytes		         0	         0
	maximum total bytes		   2855968	  22512440
	maximum total K-bytes		      2856	     22513
	maximum total M-bytes		         3	        23
 
 
                                     CITATION
                                     --------
                Please cite the following reference when publishing
                           results obtained with NWChem:
 
                 M. Valiev, E.J. Bylaska, N. Govind, K. Kowalski,
              T.P. Straatsma, H.J.J. van Dam, D. Wang, J. Nieplocha,
                        E. Apra, T.L. Windus, W.A. de Jong
                 "NWChem: a comprehensive and scalable open-source
                  solution for large scale molecular simulations"
                      Comput. Phys. Commun. 181, 1477 (2010)
                           doi:10.1016/j.cpc.2010.04.018
 
                                      AUTHORS
                                      -------
          E. Apra, E. J. Bylaska, W. A. de Jong, N. Govind, K. Kowalski,
       T. P. Straatsma, M. Valiev, H. J. J. van Dam, D. Wang, T. L. Windus,
        J. Hammond, J. Autschbach, K. Bhaskaran-Nair, J. Brabec, K. Lopata,
       S. A. Fischer, S. Krishnamoorthy, W. Ma, M. Klemm, O. Villa, Y. Chen,
    V. Anisimov, F. Aquino, S. Hirata, M. T. Hackler, T. Risthaus, M. Malagoli,
       A. Marenich, A. Otero-de-la-Roza, J. Mullin, P. Nichols, R. Peverati,
     J. Pittner, Y. Zhao, P.-D. Fan, A. Fonari, M. Williamson, R. J. Harrison,
       J. R. Rehr, M. Dupuis, D. Silverstein, D. M. A. Smith, J. Nieplocha,
        V. Tipparaju, M. Krishnan, B. E. Van Kuiken, A. Vazquez-Mayagoitia,
        L. Jensen, M. Swart, Q. Wu, T. Van Voorhis, A. A. Auer, M. Nooijen,
      L. D. Crosby, E. Brown, G. Cisneros, G. I. Fann, H. Fruchtl, J. Garza,
        K. Hirao, R. A. Kendall, J. A. Nichols, K. Tsemekhman, K. Wolinski,
     J. Anchell, D. E. Bernholdt, P. Borowski, T. Clark, D. Clerc, H. Dachsel,
   M. J. O. Deegan, K. Dyall, D. Elwood, E. Glendening, M. Gutowski, A. C. Hess,
         J. Jaffe, B. G. Johnson, J. Ju, R. Kobayashi, R. Kutteh, Z. Lin,
   R. Littlefield, X. Long, B. Meng, T. Nakajima, S. Niu, L. Pollack, M. Rosing,
   K. Glaesemann, G. Sandrone, M. Stave, H. Taylor, G. Thomas, J. H. van Lenthe,
                               A. T. Wong, Z. Zhang.

 Total times  cpu:       61.7s     wall:       62.0s
